2004,KVUE-TV,ABC,"Austin, TX",3,Analog,The Proud Family,Core,Network,Saturdays 10-10:30AM,10,3,30,10,13,"“The Proud Family” revolves around the daily activities of fourteen-year-old Penny Proud and her African-American family consisting of parents Trudy Proud (a veterinarian) and Oscar Proud (self-employed businessman), a no-nonsense Grandmother Suga Mama who resides with the family, twin sisters BeBe and CeCe. Penny’s friends Dijonay and Sticky, and the neighboring Boulevardez family, whose daughter, La Cienega, is Penny’s rival. Teachers and classmates also populate the stories. The majority of the characters in this children’s series are ethnic minorities. Penny faces the struggles of adolescence along with the challenge of balancing academic life (middle school) and home obligations. Series episodes explore issues particularly relevant to 10 to 13 year olds: maintaining social relationships, overcoming self-doubt, standing up for one’s beliefs, dealing with peer pressure, relating to authority and rules, assuming responsibility, appreciating differences (gender, race, and generational), maintaining loyalty to family, and cultivating values such as honesty and persistence.",3,N/A,N/A,N/A
2004,KVUE-TV,ABC,"Austin, TX",3,Analog,That's So Raven,Core,Network,Saturdays 10:30-11AM,10,3,30,10,13,"Raven Baxter, who has inherited her grandmother’s gift of clairvoyance, is a normal, happy young woman. Nonetheless, Raven sometimes worries that she is a freak because of her clairvoyant abilities. She has a ten-year old brother, Cory. They are typical siblings, with the tension and rivalry that most siblings experience. Raven and Cory's mother is in law school, and their father owns a small restaurant. Raven attends an ethnically diverse San Francisco public high school. She is responsible for the after-school safety and activities of Cory. Her closest friends, Chelsea and Eddie, are fiercely committed to environmental issues and sports, respectively. Raven dreams of a career in fashion design, and the new season's episodes revolve around her internship with an eccentric fashion designer. Raven’s parents and clos friends know about her “visions.” These premonitions often prompt her to intervene before trouble occurs. Sometimes her interventions backfire, and at other times the foreseen events occur, bringing embarrassment or sadness. She learns valuable lessons from her transgressions. “Visions” set up issues that the Core episodes of this series explore, among which are sibling rivalry, popularity, loyalty, self-acceptance, jealousy, dealing with authority, and consequences of lying or cheating.",3,N/A,N/A,N/A
2004,KVUE-TV,ABC,"Austin, TX",3,Analog,Phil of the Future,Core,Network,Saturdays 11-11:30AM,8,5,30,10,12,"“Phil of the Future” is the story of a teenage boy, Phil Diffy, his younger sister, Pim, and their parents, who find themselves living in the 21st century when their time travel vehicle malfunctions in flight. While their goal is to repair the time travel vehicle and return to their home in the 22nd century, for the time being they must conceal their identities, their futuristic traits and their gadgets to “blend in” with the locals. The Diffys enroll Phil and Pim in public school, where Phil excels in higher math and Pim, who is a rebel by nature, must learn to live by middle school rules. The series conveys relevant messages about growing up. Some of the issues that are explored in this series are sibling rivalry, responsibility, dealing with authority (parent/child and teacher/student conflicts), peer pressure, self-acceptance, loyalty, and honesty.",5,N/A,N/A,N/A
2004,KVUE-TV,ABC,"Austin, TX",3,Analog,Lizzie McGuire,Core,Network,Saturdays 11:30-12PM,8,5,30,9,12,"""Lizzie McGuire"" is the story of an ingenious twelve-year-old girl who attends an ethnically diverse middle school. Her best friends are Miranda, a feisty Hispanic girl, and a boy named Gordo. Lizzie has a gifted younger brother who is frequently the source of conflict. Their parents handle their children's crises with humor and affection. Stories are realistic, revolving around school issues, rules, peer pressure, the struggle to find a comfortable identity, trust, facing one's mistakes, and the emotional ups-and-downs of pre-adolescence. Particular strengths of this series are its believability and the creation of a live action series that features a strong, positive girl in the lead role.",5,N/A,N/A,N/A
2004,KXAM,NBC,"Austin, TX",3.5,Analog,Eyewitness Kids News,Core,Syndicated,Saturdays 9-9:30AM,13,0,30,13,16,"Eyewitness Kids News is a kid-to-kid newscast, created for and delivered by children. Hosted by a diverse news team made up of young ""journalists"" reporting from a professional news set and from the field on stories of interest and educational value to its own audience. The show emphasizes diversity and experience by developing a cast of engaging and intelligent African-American, Hispanic, Asian and Caucasian male and female child actors who interact with each other-and connect to the viewers.",99,N/A,N/A,N/A
2004,KXAM,NBC,"Austin, TX",3.5,Analog,Tutenstein,Core,Network,Saturdays 9:30-10AM,13,0,30,9,14,"Tutenstein is an animated show featuring the resurrected mummy of an Egyptian boy-king. After the discovery of his tomb, the entire burial chamber with artifacts is brought to a metropolitan museum for a permanent exhibit and scientific research. Tut comes alive shortly after his arrival and connects with Cleo, a teen-age museum intern and her cat Luxor. Each episode teaches the audience about Egyptian history, mythology and belief systems. Because Tut’s resurrection is a secret, Cleo has to draw on her knowledge of Egyptology to understand the mummy and his frame of reference. More importantly, she and Tut use the characters, gods, demons, and articles from the tomb to solve the many problems they encounter when Tut forgets the rules of engagement and ventures out into the world on his own.",99,N/A,N/A,N/A
2004,KXAM,NBC,"Austin, TX",3.5,Analog,Trading Spaces: Boys vs. Girls,Core,Network,Saturdays 10-10:30AM,13,0,30,9,14,"Boys and girls get to show how well they know each other, how effectively they can manage a budget, and how skillfully they can execute a design plan in Trading Spaces: Boys vs. Girls. Each week a boy or girl will be given two days and $5000 dollars to complete a renovation of their partner’s “room.” The space might be a bedroom, a recreation room, or a club house, but the “designer” has to show his or her knowledge of the other person’s preferences, hobbies, and lifestyle to come up with a good design. Then, the challenge of balancing the budget and figuring out the renovation process begins. Participants will learn measurement, spatial reasoning, and principles of aesthetic design as they go through the experience. In the end, they will find out if their knowledge and perception of their partner was on or off base.",99,N/A,N/A,N/A
2004,KXAM,NBC,"Austin, TX",3.5,Analog,Endurance,Core,Network,Saturdays 10:30-11AM,13,0,30,9,14,"Endurance is an engrossing program that shows the target audience, with typical kids ages 12-16, succeeding at several different physical, intellectual and strategic challenges in order to win a fabulous travel prize. The audience will be exposed to historical information about great feats of endurance, from Houdini's escape artistry to Sir Edmund Hillary's ascent of Mount Everest. Each of the 12 competitive challenges is a metaphor for one of these feats of endurance. In addition, there are strategic challenges based on ten character traits that are important for success. Contestants must estimate probabilities and beat the odds. Overall, the competition balances luck or fate against personal effort so that the contestants learn to balance intellect with intuition in developing their winning strategy. Narration and interviews during each episode trace the emotional growth and insights of the contestants, with an emphasis on how the experience of protracted competition and teamwork teaches both social skills and life skills for achieving success with your goals.",99,N/A,N/A,N/A
2004,KXAM,NBC,"Austin, TX",3.5,Analog,Strange Days at Blake Holsey High,Core,Network,Saturdays 11-11:30AM,13,0,30,9,14,"This program focuses on a group of five young teens who are students at a very unusual boarding school. Strange phenomena happen at the school, and our kids are members of a science club that decides, with the help of their professor, to figure it all out. The initiator of many of their investigative processes is the newest student to the school, Josie Trent. In exploring the larger mystery of why the phenomena occur, our kids also deal with issues relating to their socio-emotional messages. The educational goal of the program is to embed scientific content in a narrative story with strong socio-emotional messages. In each episode, one of the main characters models a learning process that relates to their social competence. Each episode also explores science content that relates to resolving an immediate problem or some aspect of the larger mystery. Specific objectives are to expose the audience to content about the physical sciences, such as experiments, the audience is exposed to the scientific method, hypothesis testing and analysis of data. Other objectives are to model the development of group cohesion, teamwork, and social competence within the group and between the group and other significant people in their lives.",99,N/A,N/A,N/A
2004,KXAM,NBC,"Austin, TX",3.5,Analog,Darcy's Wild Life,Core,Network,Saturdays 11:30-12PM,13,0,30,9,14,"This program follows the life of 15-year-old Darcy Fields, the pampered daughter of a top Hollywood movie-star who was plucked out of a life of limousines, movie-premieres and world class restaurants to live a “no frills” life in rural Idaho. Darcy’s initial resentment gives way to optimism as she makes new friends and becomes a part of the community. The overarching educational goal is for the audience to see how the main character, Darcy, is able to make a successful adjustment to a new environment that is the complete antithesis of her old life. Darcy comes to a deeper understanding of herself, the value of relationships, and the insignificance of material things. This occurs as she makes new friends who have totally different perspectives than hers. The viewer will also learn about the care and treatment of a variety of animals that live on farms or in the wild.",99,N/A,N/A,N/A
2004,KXAM,NBC,"Austin, TX",3.5,Analog,Jack Hanna,Core,Syndicated,Saturdays 12-12:30PM,10,3,30,6,16,"Jack Hanna is a live action television program designed to meet the educational and informational needs of children. In each episode the cameras follow Jack as he spends time with nature's creatures across the continents. Jack talks with people who are knowledgeable about each animal and habitat, teaching as he goes.",0,N/A,N/A,N/A
2004,KXAN,NBC,"Austin, TX",3.5,Analog,Eyewitness Kids News,Core,Syndicated,Saturdays 9-9:30AM,13,0,30,13,16,"Eyewitness Kids News is a kid-to-kid newscast, created for and delivered by children. Hosted by a diverse news team made up of young ""journalists"" reporting from a professional news set and from the field on stories of interest and educational value to its own audience. The show emphasizes diversity and experience by developing a cast of engaging and intelligent African-American, Hispanic, Asian and Caucasian male and female child actors who interact with each other-and connect to the viewers.",99,N/A,N/A,N/A
2004,KXAN,NBC,"Austin, TX",3.5,Analog,Tutenstein,Core,Network,Saturdays 9:30-10AM,13,0,30,9,14,"Tutenstein is an animated show featuring the resurrected mummy of an Egyptian boy-king. After the discovery of his tomb, the entire burial chamber with artifacts is brought to a metropolitan museum for a permanent exhibit and scientific research. Tut comes alive shortly after his arrival and connects with Cleo, a teen-age museum intern and her cat Luxor. Each episode teaches the audience about Egyptian history, mythology and belief systems. Because Tut’s resurrection is a secret, Cleo has to draw on her knowledge of Egyptology to understand the mummy and his frame of reference. More importantly, she and Tut use the characters, gods, demons, and articles from the tomb to solve the many problems they encounter when Tut forgets the rules of engagement and ventures out into the world on his own.",99,N/A,N/A,N/A
2004,KXAN,NBC,"Austin, TX",3.5,Analog,Trading Spaces: Boys vs. Girls,Core,Network,Saturdays 10-10:30AM,13,0,30,9,14,"Boys and girls get to show how well they know each other, how effectively they can manage a budget, and how skillfully they can execute a design plan in Trading Spaces: Boys vs. Girls. Each week a boy or girl will be given two days and $5000 dollars to complete a renovation of their partner’s “room.” The space might be a bedroom, a recreation room, or a club house, but the “designer” has to show his or her knowledge of the other person’s preferences, hobbies, and lifestyle to come up with a good design. Then, the challenge of balancing the budget and figuring out the renovation process begins. Participants will learn measurement, spatial reasoning, and principles of aesthetic design as they go through the experience. In the end, they will find out if their knowledge and perception of their partner was on or off base.",99,N/A,N/A,N/A
2004,KXAN,NBC,"Austin, TX",3.5,Analog,Endurance,Core,Network,Saturdays 10:30-11AM,13,0,30,9,14,"Endurance is an engrossing program that shows the target audience, with typical kids ages 12-16, succeeding at several different physical, intellectual and strategic challenges in order to win a fabulous travel prize. The audience will be exposed to historical information about great feats of endurance, from Houdini's escape artistry to Sir Edmund Hillary's ascent of Mount Everest. Each of the 12 competitive challenges is a metaphor for one of these feats of endurance. In addition, there are strategic challenges based on ten character traits that are important for success. Contestants must estimate probabilities and beat the odds. Overall, the competition balances luck or fate against personal effort so that the contestants learn to balance intellect with intuition in developing their winning strategy. Narration and interviews during each episode trace the emotional growth and insights of the contestants, with an emphasis on how the experience of protracted competition and teamwork teaches both social skills and life skills for achieving success with your goals.",99,N/A,N/A,N/A
2004,KXAN,NBC,"Austin, TX",3.5,Analog,Strange Days at Blake Holsey High,Core,Network,Saturdays 11-11:30AM,13,0,30,9,14,"This program focuses on a group of five young teens who are students at a very unusual boarding school. Strange phenomena happen at the school, and our kids are members of a science club that decides, with the help of their professor, to figure it all out. The initiator of many of their investigative processes is the newest student to the school, Josie Trent. In exploring the larger mystery of why the phenomena occur, our kids also deal with issues relating to their socio-emotional messages. The educational goal of the program is to embed scientific content in a narrative story with strong socio-emotional messages. In each episode, one of the main characters models a learning process that relates to their social competence. Each episode also explores science content that relates to resolving an immediate problem or some aspect of the larger mystery. Specific objectives are to expose the audience to content about the physical sciences, such as experiments, the audience is exposed to the scientific method, hypothesis testing and analysis of data. Other objectives are to model the development of group cohesion, teamwork, and social competence within the group and between the group and other significant people in their lives.",99,N/A,N/A,N/A
2004,KXAN,NBC,"Austin, TX",3.5,Analog,Darcy's Wild Life,Core,Network,Saturdays 11:30-12PM,13,0,30,9,14,"This program follows the life of 15-year-old Darcy Fields, the pampered daughter of a top Hollywood movie-star who was plucked out of a life of limousines, movie-premieres and world class restaurants to live a “no frills” life in rural Idaho. Darcy’s initial resentment gives way to optimism as she makes new friends and becomes a part of the community. The overarching educational goal is for the audience to see how the main character, Darcy, is able to make a successful adjustment to a new environment that is the complete antithesis of her old life. Darcy comes to a deeper understanding of herself, the value of relationships, and the insignificance of material things. This occurs as she makes new friends who have totally different perspectives than hers. The viewer will also learn about the care and treatment of a variety of animals that live on farms or in the wild.",99,N/A,N/A,N/A
2004,KXAN,NBC,"Austin, TX",3.5,Analog,Jack Hanna,Core,Syndicated,Saturdays 12-12:30PM,10,3,30,6,16,"Jack Hanna is a live action television program designed to meet the educational and informational needs of children. In each episode the cameras follow Jack as he spends time with nature's creatures across the continents. Jack talks with people who are knowledgeable about each animal and habitat, teaching as he goes.",0,N/A,N/A,N/A
2004,KXLK-CA,Pappas Telecasting,"Austin, TX",3,Analog,Cat Paws,Core,Local,Wednesdays 9-10:30AM,13,0,90,5,11,Educational Interactive programming produced by School Teachers.,99,N/A,N/A,N/A
2004,KXLK-CA,Pappas Telecasting,"Austin, TX",3,Analog,L.O.V.E. 2 Talk,Core,Syndicated,Thursdays 9-10:30AM,13,0,90,12,18,Previously Recorded call in show advising Teens on such crucial Issues as Suicide and Drug Use.,99,N/A,N/A,N/A