Year,Call Sign,Network Affiliation,Nielsen DMA,Ave. # of Analog hours,Analog or Digital,Title of EI programs,Core or Non-core,Origin of Program,Regular schedule of Program,Total times aired,Number of pre-emptions,Length of Program (in minutes),Age of Target Audience From,Age of Target Audience To,Description of Program,Number of pre-emptions rescheduled,Ave. # of hours of all digital programming per week,Ave. # of hours per week of digital Core Programming per week,Y or N to Q 11 in Digital Core Programming: At least 50% of the Core Programming had not already aired within the previous seven days
2007,KAKW-CA,N/A,"Austin, TX",3,Analog,Pinky Dinky Doo,Core,Network,Saturdays 7-7:30AM & 7:30-8AM,26,0,30,2,6,"This animated program has four educational goals: to celebrate the power of inventing imaginative stories, to introduce basic literary concepts, to help viewers develop listening and comprehension skills, and to enrich vocabulary through storytelling. Pinky Dinky Doo, a 7-year-old girl, lives in the ""great big city"" with her parents. When a problem arises, Pinky dances her way to a cardboard story box and uses a piece of chalk and her imagination to tell a story. During the made-up story, Pinky must ""think big"" at which point she comes up with an often clever and wacky solution to the problem. To encourage listening skills, Pinky then invites children to play games where they review details about the story. Children are helped to increase their vocabularies with each episode's ""Great Big Fancy Word,"" which is featured several times during each episode.",99,N/A,N/A,N/A
2007,KAKW-CA,N/A,"Austin, TX",3,Analog,Donde en el Mundo esta Carmen Sandiego?,Core,Network,Saturdays 8-8:30AM & 8:30-9AM,26,0,30,7,12,"A significant purpose and key educational objective of this half hour program is to help children develop logical reasoning while learning about geography and history in a fun and entertaining way. When a former agent of Acme Detective Agency, Carmen Sandiego, turns bad and starts stealing major cultural and historical artifacts around the world, two teenager super-sleuths will travel the world trying to catch her. As they collect clues trying to find Carmen Sandiego and the missing artifacts, the two teenagers learn historical and geographical facts.",99,N/A,N/A,N/A
2007,KAKW-CA,N/A,"Austin, TX",3,Analog,Bill El Cientifico,Core,Network,Saturdays 9-9:30AM & 9:30-10AM,26,0,30,7,12,"""Bill Nye the Science Guy"" is an educational television program that teaches science to a preteen audience. Bill Nye, a scientist wearing a lab coat and a bow-tie, mixes the serious science of everyday things with fast-paced action and humor. Each episode covers a specific scientific topic such as physics, chemistry, humans, living things, earth science, or space science.",99,N/A,N/A,N/A
2007,KAKW-TV,N/A,"Austin, TX",3,Analog,Pinky Dinky Doo,Core,Network,Saturdays 7-7:30AM & 7:30-8AM,26,0,30,2,6,"This animated program has four educational goals: to celebrate the power of inventing imaginative stories, to introduce basic literary concepts, to help viewers develop listening and comprehension skills, and to enrich vocabulary through storytelling. Pinky Dinky Doo, a 7-year-old girl, lives in the ""great big city"" with her parents. When a problem arises, Pinky dances her way to a cardboard story box and uses a piece of chalk and her imagination to tell a story. During the made-up story, Pinky must ""think big"" at which point she comes up with an often clever and wacky solution to the problem. To encourage listening skills, Pinky then invites children to play games where they review details about the story. Children are helped to increase their vocabularies with each episode's ""Great Big Fancy Word,"" which is featured several times during each episode.",99,N/A,3,Y
2007,KAKW-TV,N/A,"Austin, TX",3,Analog,Donde en el Mundo esta Carmen Sandiego?,Core,Network,Saturdays 8-8:30AM & 8:30-9AM,26,0,30,7,12,"A significant purpose and key educational objective of this half hour program is to help children develop logical reasoning while learning about geography and history in a fun and entertaining way. When a former agent of Acme Detective Agency, Carmen Sandiego, turns bad and starts stealing major cultural and historical artifacts around the world, two teenager super-sleuths will travel the world trying to catch her. As they collect clues trying to find Carmen Sandiego and the missing artifacts, the two teenagers learn historical and geographical facts.",99,N/A,3,Y
2007,KAKW-TV,N/A,"Austin, TX",3,Analog,Bill El Cientifico,Core,Network,Saturdays 9-9:30AM & 9:30-10AM,26,0,30,7,12,"""Bill Nye the Science Guy"" is an educational television program that teaches science to a preteen audience. Bill Nye, a scientist wearing a lab coat and a bow-tie, mixes the serious science of everyday things with fast-paced action and humor. Each episode covers a specific scientific topic such as physics, chemistry, humans, living things, earth science, or space science.",99,N/A,3,Y
2007,KBVO,Telefutura,"Austin, TX",3.5,Analog,Patrulla de Sapitos,Core,Network,Sundays 7:30-8AM,4,0,30,7,12,"A significant purpose and key educational objective of this half-hour program is to illustrate the importance of discovering oneself and friendship. Eight toadlets who miss the migration to Toad Hollow, a peaceful and protected haven for toads, are lost and stranded in an unknown world, where they have to survive and confront their problems as a team. Through their amazing quest, the toad patrol teach young children many lessons about friendship, trust, caring and sharing, empathy, caution, determination, self-esteem, responsibility, selflessness, sacrifice and respect for others.",99,N/A,N/A,N/A
2007,KBVO,Telefutura,"Austin, TX",3.5,Analog,Plaza Sesamo,Core,Network,Sat and Sun 8-8:30AM & 8:30-9AM,52,0,30,2,7,"A significant purpose and key educational objective of this half-hour program is to teach young children the importance of different cultures and traditions. Children will easily identify with the main characters: Abelardo, Contreras, and Lola. These animated personalities will help children develop a better understanding of the world around them through their stories. Throughout the shows, these characters not only reinforce and expose the Spanish language to native and non-native Spanish speakers, but also teach children valuable lessons that include problem solving, gender equity, symbolic representation, and social interaction. A significant purpose and key educational objective of this half-hour program is to teach young children the importance of different cultures and traditions. Children will easily identify with the main characters: Abelardo, Contreras, and Lola. These animated personalities will help children develop a better understanding of the world around them through their stories. Throughout the shows, these characters not only reinforce and expose the Spanish language to native and non-native Spanish speakers, but also teach children valuable lessons that include problem solving, gender equity, symbolic representation, and social interaction.",99,N/A,N/A,N/A
2007,KBVO,Telefutura,"Austin, TX",3.5,Analog,Reino Animal,Core,Network,Sundays 9-9:30AM & 9:30-10AM,26,0,30,13,16,"This half-hour program educates young viewers on the natural habitat of animals in an educational, yet entertaining way. With narrations and interactive segments, the series builds upon natural science concepts, sparking a sense of curiosity in its viewers. The program discussed concepts like the functions of animals in an ecosystem, the elements of animal classification, and life sciences to help teach children about the natural world, while having fun at the same time.",99,N/A,N/A,N/A
2007,KBVO,Telefutura,"Austin, TX",3.5,Analog,Toonturama Presenta: La Vida Animal,Core,Network,Sundays 7:30-8AM,9,0,30,7,12,"A significant purpose and key educational objective of this program is to present animals, birds, and insects in their natural environments in order to engage the curiosity and developing intelligence of boys and girls. There is a special emphasis on nature, science, the adaptation and survival of species, and the role of species in human planetary welfare. Each episode examines topics of geography, ecology, and the ways in which non-humans, animals, birds, and insects adjust to the complexities of their specific habitats in the various continents and oceans that make up our planet. Using original footage, music, and humor, this series presents information about where animals live, how they build their unique dwellings, the tools they use for foraging, the migrations of animals due to climatic changes, and how they care for and protect their offspring. The main purpose of the series is to educate and inform young children about a variety of species and about how animals and humans are interdependent.",99,N/A,N/A,N/A
2007,KEYE,CBS,"Austin, TX",3,Analog,Care Bears: Adventures in Care-a-Lot,Core,Network,Saturdays 8-8:30AM,13,0,30,5,7,"Care Bears are a group of funny, colorful bears, each with a special way of caring and a belly badge, which unleashes that bear's special caring power. The bears use their caring hearts and their belly badges to help each other and to thwart the evil plots of Grizzle, a bad bear with his own flying lair. Each Care Bears episode is designed to foster children's ""emotional intelligence,"" defined by psychologist Daniel Goleman and other researchers as skill in five areas: knowing one's emotions; managing one's emotions; motivating oneself; recognizing emotions in others; and handling relationships. This program is specifically designed to further the educational and informational needs of children, has educating and informing children as a significant purpose, and otherwise meets the definition of Core Programming as specified in the Commission's rules.",99,N/A,3,Y
2007,KEYE,CBS,"Austin, TX",3,Analog,Strawberry Shortcake,Core,Network,Saturdays 8:30-9AM,13,0,30,3,6,"In this series, Strawberry Shortcake, a curious, self-confident leader, narrates stories of her and her friends' adventures in the richly-imagined world of Strawberry Land. Using her many positive qualities, Strawberry helps her friends, who share her values but not necessarily her ability to take a broader view, to see beyond their own self-interest. The themes of the stories are designed to have particular relevance for young viewers, focusing on such issues as friendship, fear, self-confidence, sportsmanship, trust and shyness. The pro-social messages flow naturally from the narrative, as the characters experience concrete (positive and negative) consequences of their actions. This program is specifically designed to further the educational and informational needs of children, has educating and informing children as a significant purpose, and otherwise meets the definition of Core Programming as specified in the Commission's rules.",99,N/A,3,Y
2007,KEYE,CBS,"Austin, TX",3,Analog,Cake,Core,Network,Saturdays 9-9:30AM,13,0,30,8,12,"CAKE is a live-action show-within-a-show about a teenage girl by the name of Cake, who, with the help of three friends, produces a cable access show. The series is designed to provide the viewers with two integrated levels of educational and informational experiences. On one level, each episode provides actual instruction regarding specific activities, with hands-on examples related to the design and use of various fabrics, the making of clothes, the crafting of useful home, school, play, and household items, and other forms of creative expression. The other level in the episode provides an opportunity for the viewers to learn about social and emotional themes such as the value of honesty, the importance of personal worth and self-esteem, the meaning of friendship, the value of having a healthy life-style, and other prosocial concepts that are developmentally appropriate for this age-group. This program is specifically designed to further the educational and informational needs of children, has educating and informing children as a significant purpose, and otherwise meets the definition of Core Programming as specified in the Commission's rules.",99,N/A,3,Y
2007,KEYE,CBS,"Austin, TX",3,Analog,Horseland,Core,Network,Saturdays 9:30-10AM,13,0,30,9,11,"HORSELAND is an animated series about five girls and two boys who live in spectacular countryside that houses a farm called Horseland. Each of these main characters has a special horse whose personality is similar to its owner's. Horseland and its unique approach of integrating the personality of the main characters and animals serve to reinforce prosocial themes. Horseland is also a ""coming of age"" series in which viewers experience and learn from the social interactions, hopes, dreams, and even fears of this group of culturally diverse adolescents. From this background, the experiences of sharing, caring, compromise, friendship, respect, and competition emerge to provide the young viewers with social and emotional guidelines for better understanding many of the life-lessons they need to learn as they grow and develop. This program is specifically designed to further the educational and informational needs of children, has educating and informing children as a significant purpose, and otherwise meets the definition of Core Programming as specified in the Commission's rules.",99,N/A,3,Y
2007,KEYE,CBS,"Austin, TX",3,Analog,Sabrina: The Animated Series,Core,Network,Saturdays 10-10:30AM,4,0,30,7,12,"The animated series, ""Sabrina,"" involves the adventures of a modern, early adolescent girl who is part human and part witch. While Sabrina is not your typical girl - she has magical powers that must be kept secret and also under control - the familial, social, peer-group, and school-related issues she experiences all serve as educational and instructional life-lessons for viewers, as they reflect many of the same learning experiences and teenage challenges faced by children today. This program is specifically designed to further the educational and informational needs of children, has educating and informing children as a significant purpose, and otherwise meets the definition of Core Programming as specified in the Commission's rules.",99,N/A,3,Y
2007,KEYE,CBS,"Austin, TX",3,Analog,Trollz,Core,Network,Saturdays 10:30-11AM,4,0,30,8,12,"TROLLZ is an animated series about five teenage girls growing up in a magic and colorful world, who live by the credo B.F.F.I. - Best Friends for Life. The magic in their lives is interwoven into real-world type experiences through which they learn to engage in problem solving, creative thinking, and cooperative strategy skills. The series also provides an opportunity for the five girls to learn how to cope with some of the social and emotional issues of self-esteem relating to physical features and other personal attributes, emerging friendships and peer-group relationships, and other experiences found in Trollzopolis. This program is specifically designed to further the educational and informational needs of children, has educating and informing children as a significant purpose, and otherwise meets the definition of Core Programming as specified in the Commission's rules.",99,N/A,3,Y
2007,KEYE,CBS,"Austin, TX",3,Analog,Sushi Pack,Core,Network,Saturdays 10-10:30AM,9,0,30,9,11,"SUSHI PACK is an animated series featuring an unlikely group of superheroes consisting of four small pieces of Sushi, and a tube of mustard. Through an accident involving an irradiation process, these characters are brought to life, and dedicate themselves to fighting crime, injustice, and helping those in need. The themes integrated into the episodes of SUSHI PACK are associated with the teaching of certain positive social behaviors and skills to children. The major educational objectives of the program are to have young viewers learn some important life-lessons related to such traits as loyalty, honesty, and self-confidence, and such behaviors as teamwork problem-solving and cooperation. The program seeks to help children understand that these are every day pro-social attitudes and behaviors that can be modeled and used by them at home and among their friends. This program is specifically designed to further the educational and informational needs of children, has educating and informing children as a significant purpose, and otherwise meets the definition of Core Programming as specified in the Commission's rules.",99,N/A,3,Y
2007,KEYE,CBS,"Austin, TX",3,Analog,Dino Squad,Core,Network,Saturdays 10:30-11AM,9,0,30,9,11,"DINO SQUAD is an animated program focusing on a group of five ordinary, but diverse teenagers, who, through an unusual accident, become contaminated with a substance that allows them to morph from humans into various species of dinosaurs. Their science teacher, with full knowledge of their parents and with a few special abilities of her own, becomes their mentor. Her tasks are to help them maneuver through the experiences of the high school years, with its social, emotional, educational, recreational, and teenage angst, and to guide them as they stand up for justice against the forces of evil. Each episode draws on a set of planned educational and informational themes related to specific pro-social concepts, life-lessons, and/or selected groups of facts drawn from a variety of fields of study. This program is specifically designed to further the educational and informational needs of children, has educating and informing children as a significant purpose, and otherwise meets the definition of Core Programming as specified in the Commission's rules.",99,N/A,3,Y
2007,KEYE,CBS,"Austin, TX",3,Digital,Care Bears: Adventures in Care-a-Lot,Core,Network,Saturdays 8-8:30AM,13,0,30,5,7,"Care Bears are a group of funny, colorful bears, each with a special way of caring and a belly badge, which unleashes that bear's special caring power. The bears use their caring hearts and their belly badges to help each other and to thwart the evil plots of Grizzle, a bad bear with his own flying lair. Each Care Bears episode is designed to foster children's ""emotional intelligence,"" defined by psychologist Daniel Goleman and other researchers as skill in five areas: knowing one's emotions; managing one's emotions; motivating oneself; recognizing emotions in others; and handling relationships. This program is specifically designed to further the educational and informational needs of children, has educating and informing children as a significant purpose, and otherwise meets the definition of Core Programming as specified in the Commission's rules.",99,N/A,3,Y
2007,KEYE,CBS,"Austin, TX",3,Digital,Strawberry Shortcake,Core,Network,Saturdays 8:30-9AM,13,0,30,3,6,"In this series, Strawberry Shortcake, a curious, self-confident leader, narrates stories of her and her friends' adventures in the richly-imagined world of Strawberry Land. Using her many positive qualities, Strawberry helps her friends, who share her values but not necessarily her ability to take a broader view, to see beyond their own self-interest. The themes of the stories are designed to have particular relevance for young viewers, focusing on such issues as friendship, fear, self-confidence, sportsmanship, trust and shyness. The pro-social messages flow naturally from the narrative, as the characters experience concrete (positive and negative) consequences of their actions. This program is specifically designed to further the educational and informational needs of children, has educating and informing children as a significant purpose, and otherwise meets the definition of Core Programming as specified in the Commission's rules.",99,N/A,3,Y
2007,KEYE,CBS,"Austin, TX",3,Digital,Cake,Core,Network,Saturdays 9-9:30AM,13,0,30,8,12,"CAKE is a live-action show-within-a-show about a teenage girl by the name of Cake, who, with the help of three friends, produces a cable access show. The series is designed to provide the viewers with two integrated levels of educational and informational experiences. On one level, each episode provides actual instruction regarding specific activities, with hands-on examples related to the design and use of various fabrics, the making of clothes, the crafting of useful home, school, play, and household items, and other forms of creative expression. The other level in the episode provides an opportunity for the viewers to learn about social and emotional themes such as the value of honesty, the importance of personal worth and self-esteem, the meaning of friendship, the value of having a healthy life-style, and other prosocial concepts that are developmentally appropriate for this age-group. This program is specifically designed to further the educational and informational needs of children, has educating and informing children as a significant purpose, and otherwise meets the definition of Core Programming as specified in the Commission's rules.",99,N/A,3,Y
2007,KEYE,CBS,"Austin, TX",3,Digital,Horseland,Core,Network,Saturdays 9:30-10AM,13,0,30,9,11,"HORSELAND is an animated series about five girls and two boys who live in spectacular countryside that houses a farm called Horseland. Each of these main characters has a special horse whose personality is similar to its owner's. Horseland and its unique approach of integrating the personality of the main characters and animals serve to reinforce prosocial themes. Horseland is also a ""coming of age"" series in which viewers experience and learn from the social interactions, hopes, dreams, and even fears of this group of culturally diverse adolescents. From this background, the experiences of sharing, caring, compromise, friendship, respect, and competition emerge to provide the young viewers with social and emotional guidelines for better understanding many of the life-lessons they need to learn as they grow and develop. This program is specifically designed to further the educational and informational needs of children, has educating and informing children as a significant purpose, and otherwise meets the definition of Core Programming as specified in the Commission's rules.",99,N/A,3,Y
2007,KEYE,CBS,"Austin, TX",3,Digital,Sabrina: The Animated Series,Core,Network,Saturdays 10-10:30AM,4,0,30,7,12,"The animated series, ""Sabrina,"" involves the adventures of a modern, early adolescent girl who is part human and part witch. While Sabrina is not your typical girl - she has magical powers that must be kept secret and also under control - the familial, social, peer-group, and school-related issues she experiences all serve as educational and instructional life-lessons for viewers, as they reflect many of the same learning experiences and teenage challenges faced by children today. This program is specifically designed to further the educational and informational needs of children, has educating and informing children as a significant purpose, and otherwise meets the definition of Core Programming as specified in the Commission's rules.",99,N/A,3,Y
2007,KEYE,CBS,"Austin, TX",3,Digital,Trollz,Core,Network,Saturdays 10:30-11AM,4,0,30,8,12,"TROLLZ is an animated series about five teenage girls growing up in a magic and colorful world, who live by the credo B.F.F.I. - Best Friends for Life. The magic in their lives is interwoven into real-world type experiences through which they learn to engage in problem solving, creative thinking, and cooperative strategy skills. The series also provides an opportunity for the five girls to learn how to cope with some of the social and emotional issues of self-esteem relating to physical features and other personal attributes, emerging friendships and peer-group relationships, and other experiences found in Trollzopolis. This program is specifically designed to further the educational and informational needs of children, has educating and informing children as a significant purpose, and otherwise meets the definition of Core Programming as specified in the Commission's rules.",99,N/A,3,Y
2007,KEYE,CBS,"Austin, TX",3,Digital,Sushi Pack,Core,Network,Saturdays 10-10:30AM,9,0,30,9,11,"SUSHI PACK is an animated series featuring an unlikely group of superheroes consisting of four small pieces of Sushi, and a tube of mustard. Through an accident involving an irradiation process, these characters are brought to life, and dedicate themselves to fighting crime, injustice, and helping those in need. The themes integrated into the episodes of SUSHI PACK are associated with the teaching of certain positive social behaviors and skills to children. The major educational objectives of the program are to have young viewers learn some important life-lessons related to such traits as loyalty, honesty, and self-confidence, and such behaviors as teamwork problem-solving and cooperation. The program seeks to help children understand that these are every day pro-social attitudes and behaviors that can be modeled and used by them at home and among their friends. This program is specifically designed to further the educational and informational needs of children, has educating and informing children as a significant purpose, and otherwise meets the definition of Core Programming as specified in the Commission's rules.",99,N/A,3,Y
