2000,WHDH,NBC,"Boston, MA",3.5,Analog,City Guys - A,Core,Network,Saturdays 12:30-1PM,13,2,30,13,16,"The educational objective of this program is to demonstrate how the knowledge of one or more characters in the story moves from one level to a more informed or higher level of knowledge by the end of each episode. This change in knowledge conveys an educational message to the audience which may fall into one or more categories- intellectual-cognitive and/or socio-emotional. The message will always be integral to the plot and present throughout the script. This objective is achieved in this series by exploring the pressures of living in a big city environment where situations are sometimes so difficult and challenging, kids have to learn sophisticated and responsible decision-making to be safe and stay focused. The series follows the encounters and problem-solving of two young men through an eventful school year at Manhattan High and shows teens how to work with their principal, family and friends to be successful.",N/A,N/A,N/A,N/A,,,,,
2000,WHDH,NBC,"Boston, MA",3.5,Analog,One World,Core,Network,Saturdays 1-1:30PM,13,4,30,13,16,"The educational objective of this program is to demonstrate how the knowledge of one or more characters in the story moves from one level to a more informed or higher level of knowledge by the end of each episode. This change in knowledge conveys an educational message to the audience which may fall into one or more categories -- intellectual-cognitive and/or socio-emotional. The message will always be integral to the plot and present throughout the script. This objective is achieved through this series by exploring socio-emotional themes of identity, self-worth, social reciprocity, service to others and acceptance of differences. Through the characters in the show, our audience will see examples of different approaches to resolving problems caused by these issues.",N/A,N/A,N/A,N/A,,,,,
2000,WHDH,NBC,"Boston, MA",3.5,Analog,City Guys - B,Core,Local,Sundays 7-7:30AM,13,0,30,13,16,"The educational objective of this program is to demonstrate how the knowledge of one or more characters in the story moves from one level to a more informed or higher level of knowledge by the end of each episode. This change in knowledge conveys an educational message to the audience which may fall into one or more categories- intellectual-cognitive and/or socio-emotional. The message will always be integral to the plot and present throughout the script. This objective is achieved in this series by exploring the pressures of living in a big city environment where situations are sometimes so difficult and challenging, kids have to learn sophisticated and responsible decision-making to be safe and stay focused. The series follows the encounters and problem-solving of two young men through an eventful school year at Manhattan High and shows teens how to work with their principal, family and friends to be successful.",99,N/A,N/A,N/A,,,,,
2000,WHDH,NBC,"Boston, MA",3.5,Analog,The 7 High School Sports Show,Core,Local,Sundays 12:30-1PM,5,1,30,13,16,"The High School Sports Show is a half hour program aimed at teens which focuses on the positive aspects of high school students, teams and coaches. There are feature stories such as Athlete of the Week and Scholastic Honor Roll that focus on those that have overcome adversity of one kind or another; highlighting a student's achievements in the classroom as well as on the field. The overall positive attitude and academic emphasis of the program helps in the emotional and social education of 13-16 year olds by focusing on stories where teens excel in a particular sport, overcome adversity to achieve goals, or talk about their future athletic and academic goals. To the teen viewers, the outstanding student athletes profiled on the show serve as real role models, sharing the secrets of their high school success. In addition, coming in and out of each commercial break ""Stay in School,"" ""Don't Do Drugs,"" and other public service bumps are used to help educate and inform the targeted 13-16 year old viewers.",N/A,N/A,N/A,N/A,,,,,
2000,WHDH,NBC,"Boston, MA",3.5,Analog,The 7 High School Sports Show,Core,Local,Sundays 1:30-2PM,9,0,30,13,16,"The High School Sports Show is a half hour program aimed at teens which focuses on the positive aspects of high school students, teams and coaches. There are feature stories such as Athlete of the Week and Scholastic Honor Roll that focus on those that have overcome adversity of one kind or another; highlighting a student's achievements in the classroom as well as on the field. The overall positive attitude and academic emphasis of the program helps in the emotional and social education of 13-16 year olds by focusing on stories where teens excel in a particular sport, overcome adversity to achieve goals, or talk about their future athletic and academic goals. To the teen viewers, the outstanding student athletes profiled on the show serve as real role models, sharing the secrets of their high school success. In addition, coming in and out of each commercial break ""Stay in School,"" ""Don't Do Drugs,"" and other public service bumps are used to help educate and inform the targeted 13-16 year old viewers. *WHDH aired a special addition of this show on 12/30/00 with a repeat on 12/31/00. This special, The American Hgh School Sports Show, focused on high school students who nationally have stood out among their other teammates and made a significant contribution to high school sports.",99,N/A,N/A,N/A,,,,,
2000,WHDH,NBC,"Boston, MA",3.5,Analog,Awesome Adventures,Non-Core,Syndicated,Saturdays 6:30-7AM,13,0,30,6,11,"This half-hour series features fascinating ""awesome adventures"" for children every week. Children can experience volcanic explorations, the rapids of the Salmon River and Safaris throughout the world. This program informs, entertains, and educates children about the history and cultures of the places visited.",99,N/A,N/A,N/A,,,,,
2000,WHUB-TV,N/A,"Boston, MA",3,Analog,Beakman's World,Core,Syndicated,Mon-Fri 7:30-8AM & Mon-Fri 8:30-9AM,65,0,30,2,11,"A significant purpose of this half-hour magazine show is to educate and inform children, ages 2-11 about principles of science and nature. Beakman, an inquisitive scientist and the show's host answer children's questions about how the world works though revealing the relationship between principles of science and nature and explaining how they impact our daily lives. Beakman also performs entertaining and eye-opening experiments enhanced with state of the art visuals, which make learning fun and understandable for children.",99,N/A,N/A,N/A,,,,,
2000,WHUB-TV,N/A,"Boston, MA",3,Analog,Game Warden,Core,Syndicated,Saturdays 8-8:30AM & 12:30-1PM,12,1,30,13,16,"A significant purpose of this half-hour program is to educate young viewers about the importance of preserving and protecting our natural resources, wildlife and the environment. Note: 12/9/00: Pre-emption was due technical difficulties. WHUB-TV lost it's signal to transmit. The program was madegood same day from 3-3:30pm E.T.",N/A,N/A,N/A,N/A,,,,,
2000,WLVI-TV,WB Network,"Boston, MA",3.5,Analog,Detention,Core,Network,Fridays 3-3:30PM,13,0,30,6,11,"Detention is an animated series revolving around the boys and girls of the Benedict Arnold Middle School. By focusing on the relationships, adventures, and concerns of a group of middle school students, the series provides the young viewing audience with a non-threatening arena from which to observe and learn from the actions of others. Learning is engaging, natural and becomes part of the overall fun of the show.",99,N/A,N/A,N/A,,,,,
2000,WLVI-TV,WB Network,"Boston, MA",3.5,Analog,Histeria,Core,Network,Mon-Thurs 2-2:30PM & 2:30-3PM,52,0,30,6,12,"Histeria is an animated series intended to keep history alive by supplying youngsters with a portion of the historical frame of reference missing in the schools, and challenge them to proceed with future learning. The learning objective and goals are fully integrated with the story lines, characters and the historical settings dealt with in ""Histeria."" In this way, new knowledge and learning skills become part of the overall fun of the series.",99,N/A,N/A,N/A,,,,,
2000,WLVI-TV,WB Network,"Boston, MA",3.5,Analog,Jim Fowler's Life in the Wild,Core,Syndicated,Saturdays 7:30-8AM,13,0,30,13,16,"The key educational objective of this program is to create awareness and understanding of animals, and their interaction with their particular environment. Further, the role that humans play interacting with animals in the wild will be consistently explored.",99,N/A,N/A,N/A,,,,,
2000,WLVI-TV,WB Network,"Boston, MA",3.5,Analog,Generation 0!,Core,Network,Fridays 4:30-5 & 3:30-4PM,13,0,30,7,12,"Generation O! seeks to engage and delight young, grade-school children while promoting positive pro-social models of life-skills and character development as it portrays how an eight-year-old ""normal kid/famous rock star"" deals with the kinds of day-to-day problems that all children must confront.",99,N/A,N/A,N/A,,,,,
2000,WLVI-TV,WB Network,"Boston, MA",3.5,Analog,Jim Fowler's Life in the Wild,Non-Core,Syndicated,Sundays 6:30-7AM,13,0,30,13,16,"The key educational objective of this program is to create awareness and understanding of animals, and their interaction with their particular environment. Further, the role that humans play interacting with animals in the wild will be consistently explored.",99,N/A,N/A,N/A,,,,,
2000,WLVI-TV,WB Network,"Boston, MA",3.5,Analog,One Person Can Make a Difference,Non-Core,Local,(12/23) Saturday 8-9PM,1,0,60,12,18,"This WB56 News/FamilyFirst prime-time special on Team Harmony VII, “One Person Can Make A Difference” has the goal to motivate young people to make a positive difference in their lives. On Tuesday, December 5 with camera and mic in hand, WB56 captured live footage of thousands of local teens at the FleetCenter for Team Harmony VII. WB56’s “Ten O’Clock News” Anchors Karen Marinella and Jeff Barnd went behind-the-scenes, interviewing key-note speakers, performers, some amazing kids and motivating teachers who all “made a difference” at this year’s event. By combining entertainment, education and inspiration, the prime-time special will help spread Team Harmony’s anti-discrimination message throughout Massachusetts.",99,N/A,N/A,N/A,,,,,
2000,WMFP,N/A,"Boston, MA",3,Analog,New Zoo Review,Core,Syndicated,Saturdays 7-10AM,77,1,30,3,12,"New Zoo Review is a non-violent and enlightening program focusing on ethical, moral, and social issues. It received a four star rating from NEA and it is recognized by the National School Board. Each of the 195 episodes develops a variety of ethical, moral, and social issues (i.e. being neat, being yourself, sports, optimism, etc.) that can influence the behavior of young children in a very positive way. We continue to air this show because it is difficult to find an alternative to influence, positively and harmlessly, young children (3-12) as does New Zoo Review.",N/A,N/A,N/A,N/A,,,,,
2000,WMUR-TV,ABC,"Boston, MA",3,Analog,Disney's One Saturday Morning,Core,Network,Saturdays 8:30-10:30AM,9,0,120,8,12,"This two-hour program block features three half-hour educational series in combination with various short-form educational elements. The latter include ""Find Out Why"" (physical science shorts produced in association with the National Science Foundation), ""Great Minds ... Think for Themselves"" (American history segments voiced by Robin Williams), ""What's My Name?"" (facts about interesting figures in world history), ""What's the Diff"" (game segments that teach visual discrimination and analytical skills), ""Let's Go!"" (geography and cultural information segments) and ""Flyndiggery Do: Where'd it Go?"" (short segments describing animal behavior). ""Disney's Recess"" is a collection of animated stories about six fourth-grade children who attend public school. These children are an ethnically and gender-diverse group. Their experiences at Third Street School deliver messages about problems common to middle childhood: conflicts with authority figures, school and family rules, issues of fairness, peer pressure and coping with disappointment. A number of episodes revolve around class bullies or teacher's pets. Series episodes provide opportunities for parent/child discussions about values. ""Disney's The Weekenders"" introduces four twelve-year-olds who have been friends since kindergarten. They attend middle school in southern California and spend time together on weekends. Their family circumstances are diverse: Tino is the only son of a single mother; Carver is the middle child in an affluent African-American family; Tish comes from an Easteren European immigrant family and Lor is the only girl among fourteen sports-minded brothers. Stories explore topics such as parent/child relations, sibling rivalry, acculturation, competition vs. compromise, responsibility, honesty, peer acceptance and loyalty. ""Disney's Teacher's Pet"" - Via a magical transformation, nine-year-old Leonard Helperman's dog, Spot, discovers that he is able to talk and walk upright. He seizes the opportunity to fulfill a lifelong ambition - to go to school. Dressed in some of Leonard's clothes, Spot becomes Scott Leadready reveling in the challenge of learning fourth-grade spelling, math and history. The fourth-grade teacher, Mrs. Helperman, is Leonard's mother. She is also a single parent. This series is built around the privilege of being able to attend school and the value of education. Stories teach honesty, cooperation, peer team work, problem-solving, respect for rules (particularly in the school setting) and empathy. Spot's/Scott's extraordinarily wide vocabulary introduces children to new vocabulary and its meaning in context.",99,N/A,N/A,N/A,,,,,
2000,WMUR-TV,ABC,"Boston, MA",3,Analog,Disney's the Weekenders,Core,Network,Saturdays 8:30-9AM,4,0,30,8,12,"This series introduces four twelve-year-olds that have been friends since kindergarten. They attend middle school in southern California and spend time together on weekends. Their family circumstances are diverse: Tino is the only son of a single mother; Carver is the middle child in an affluent African-American family; Tish comes from an Eastern European immigrant family and Lor is the only girl among fourteen sports-minded brothers. Stories explore topics such as parent/child relations, sibling rivalry, acculturation, competition vs. compromise, responsibility, honesty, peer acceptance and loyalty.",99,N/A,N/A,N/A,,,,,
2000,WMUR-TV,ABC,"Boston, MA",3,Analog,Disney's Recess,Core,Network,Saturdays 9-9:30AM,4,0,30,8,12,"""Disney's Recess"" is a collection of animated stories about six fourth-grade children who attend public school. These children are an ethnically and gender-diverse group. Their experiences at Third Street School deliver messages about problems common to middle childhood: conflicts with authority figures, school and family rules, issues of fairness, peer pressure and coping with disappointment. A number of episodes revolve around class bullies or teacher's pets. Series episodes provide opportunities for parent/child discussions about values.",99,N/A,N/A,N/A,,,,,
2000,WMUR-TV,ABC,"Boston, MA",3,Analog,Disney's Recess,Core,Network,Saturdays 9:30-10AM,4,0,30,8,12,"""Disney's Recess"" is a collection of animated stories about six fourth-grade children who attend public school. These children are an ethnically and gender-diverse group. Their experiences at Third Street School deliver messages about problems common to middle childhood: conflicts with authority figures, school and family rules, issues of fairness, peer pressure and coping with disappointment. A number of episodes revolve around class bullies or teacher's pets. Series episodes provide opportunities for parent/child discussions about values.",99,N/A,N/A,N/A,,,,,
2000,WMUR-TV,ABC,"Boston, MA",3,Analog,Disney's Teacher's Pet,Core,Network,Saturdays 10-10:30AM,4,0,30,8,12,"Via a magical transformation, nine-year-old Leonard Helperman's dog, Spot, discovers that he is able to talk and walk upright. He seizes the opportunity to fulfill a lifelong ambition - to go to school. Dressed in some of Leonard's clothes, Spot becomes Scott Leadready reveling in the challenge of learning fourth-grade spelling, math and history. The fourth-grade teacher, Mrs. Helperman, is Leonard's mother. She is also a single parent. This series is built around the privilege of being able to attend school and the value of education. Stories teach honesty, cooperation, peer teamwork, problem solving, respect for rules (particularly in the school setting) and empathy. Spot's/Scott's extraordinarily wide vocabulary introduces children to new vocabulary and its meaning in context.",99,N/A,N/A,N/A,,,,,
2000,WMUR-TV,ABC,"Boston, MA",3,Analog,Disney's Recess,Core,Network,Saturdays 10:30-11AM,1,0,30,8,12,"""Disney's Recess"" is a collection of animated stories about six fourth-grade children who attend public school. These children are an ethnically and gender-diverse group. Their experiences at Third Street School deliver messages about problems common to middle childhood: conflicts with authority figures, school and family rules, issues of fairness, peer pressure and coping with disappointment. A number of episodes revolve around class bullies or teacher's pets. Series episodes provide opportunities for parent/child discussions about values.",99,N/A,N/A,N/A,,,,,
2000,WMUR-TV,ABC,"Boston, MA",3,Analog,Disney's Pepper Ann,Core,Network,Saturdays 11-11:30AM & 11:30-12PM,13,0,30,10,12,"Pepper Ann is the daughter of a single working mother. She loves math and science and hopes to some day make a name for herself in biology or medicine. Pepper Ann and her Hazelnut Middle School friends demonstrate individuality, problem solving, perseverance, responsibility and creativity. While the primary educational focus of the series is building self-esteem, particularly that of girls, stories also break down gender and ethnic stereotypes and broaden the definition of ""family"".",99,N/A,N/A,N/A,,,,,
2000,WMUR-TV,ABC,"Boston, MA",3,Analog,Disney's Doug,Core,Network,Saturdays 11-11:30AM,12,0,30,8,12,"This series uses humor and fantasy in depicting a twelve-year-old boy's struggles to develop self-confidence, define identity, resolve family and school problems and maintain friendships. Narrated via the journal entries of aspiring writer/cartoonist Doug Funnie, episodes promote values such as honesty, loyalty, fairness and respect for individual differences. These stories also encourage creative writing and artistic expression.",99,N/A,N/A,N/A,,,,,
2000,WMUR-TV,ABC,"Boston, MA",3,Analog,"Sabrina, the Animated Series",Core,Network,Saturdays 11:30-12PM,1,0,30,8,12,"Twelve-year-old Sabrina Spellman, who is half witch and half mortal, is being raised in a non-traditional family consisting of her Uncle Quigley and two young aunts. Series episodes explore social and developmental issues such as peer pressure/competition, loyalty and friendship, responsibility, honesty, facing fears, speaking up for one's beliefs, etc.. Family issues such as divorce and remarriage and household rules are also addressed.",99,N/A,N/A,N/A,,,,,
2000,WMUR-TV,ABC,"Boston, MA",3,Analog,"Winnie the Pooh and Christmas, Too",Non-Core,Network,(12/3) Sunday 7-7:30PM,1,0,30,3,6,"Based on the classic ""Winnie the Pooh"" books by A.A. Milne, ""Winnie the Pooh and Christmas, Too"" depicts Christopher Robin and his companions (Pooh, Piglet, Rabbit, Tigger, Eeyore, Owl and Gopher) dealing with holiday gift giving. Each one comes to realize that holiday happiness is derived from giving, not receiving, and that being with friends is the nicest gift of all.",99,N/A,N/A,N/A,,,,,
2000,WNDS,N/A,"Boston, MA",3,Analog,L'il Iguana,Core,Local,Tuesdays 8-8:30AM & 2:30-3PM,24,0,30,3,16,"LIL' IGUANA IA A TALKING IGUANA PUPPET WHO, TOGETHER WITH HIS HUMAN CO-HORTS, TEACHES KIDS ABOUT SAFETY, TAKING CARE OF THEMSELVES AND OTHERS. tHIS IS DONE THROUGH FUN SONGS AND SKITS.",99,N/A,N/A,N/A,,,,,
2000,WNDS,N/A,"Boston, MA",3,Analog,Popular Mechanics for Kids,Core,Syndicated,Thursdays 2:30-3PM,12,0,30,6,16,"THIS SHOW TEACHES KIDS HOW CARS, TRUCKS, TRAINS AND OTHER THINGS RUN, HOW THEY ARE BUILT, ETC. IT'S VERY EDUCATIONAL AND SHOWS KIDS HOW TO RESPECT MACHINES AND USE THEM WISELY.",99,N/A,N/A,N/A,,,,,
2000,WNDS,N/A,"Boston, MA",3,Analog,Jack Hanna's Animal Adventures,Core,Syndicated,Fridays 2:30-3PM,12,0,30,7,16,"JACK HANNA TAKES VIEWERS TO FOREIGN LANDS TO LEARN ABOUT THE ANIMALS THAT LIVE IN THE REGION. RESPECT FOR NATURE AND ANIMALS IS TAUGHT AS JACK EXPLAINS THAT ANIMALS ARE NOT TO BE FEARED, BUT RESPECTED.",99,N/A,N/A,N/A,,,,,
2000,WNDS,N/A,"Boston, MA",3,Analog,Did You Ever Wonder,Core,Syndicated,Mondays 2:30-3PM,12,0,30,6,12,"THIS SHOW ILLUSTRATES, THROUGH LIVE FOOTAGE AND MUSIC, JUST HOW THINGS ARE MADE. IT SHOWS THE MANUFACTURING PROCESS, FROM BEGINNING TO END, OF SUCH THINGS AS CANDY, TOY TRAINS, LAWN MOWERS, ETC. IT SHOWS VIEWERS HOW DESIGN AND PLANNING ARE IMPORTANT TO GET THE DESIRED RESULTS.",99,N/A,N/A,N/A,,,,,
2000,WNDS,N/A,"Boston, MA",3,Analog,Full House,Non-Core,Syndicated,Mon-Fri 3:30-4PM,65,0,30,7,16,"A FAMILY HAS LOST ITS MOTHER. TO RECOVER, THE FATHER ENLISTS HIS TWO FRIENDS TO TEACH HIS THREE DAUGHTERS GOOD ETHICS, MORAL AND MANNERS. EVERYONE IN THE FAMILY LEARNS SOME THINGS ABOUT THEMSELVES, ALSO.",99,N/A,N/A,N/A,,,,,
2000,WPXB,N/A,"Boston, MA",3,Analog,Jack Hanna's Animal Adventures,Core,Network,Mon-Fri 1-1:30PM & 1:30-2PM,30,0,30,13,16,"Jack Hanna's Animal Adventures is a live-action program designed to meet the educational and informational needs of children between the ages of 13 and 16. Each episode follows Jack Hanna as he spends time with animals from all continents. Jack interviews people knowledgeable about each animal and their habitat. Children will learn about ecology, respnosibility for the environment and sharing the planet with the animals.",99,N/A,N/A,N/A,,,,,
2000,WPXB,N/A,"Boston, MA",3,Analog,Jack Hanna's Animal Adventures,Core,Network,Mon-Thurs 1-1:30PM,24,0,30,13,16,"Jack Hanna's Animal Adventures is a live-action program designed to meet the educational and informational needs of children between the ages of 13 and 16. Each episode follows Jack Hanna as he spends time with animals from all continents. Jack interviews people knowledgeable about each animal and their habitat. Children will learn about ecology, respnosibility for the environment and sharing the planet with the animals.",99,N/A,N/A,N/A,,,,,
2000,WPXB,N/A,"Boston, MA",3,Analog,Jack Hanna's Animal Adventures,Core,Network,Fridays 1-1:30PM & 1:30-2PM,20,0,30,13,16,"Jack Hanna's Animal Adventures is a live-action program designed to meet the educational and informational needs of children between the ages of 13 and 16. Each episode follows Jack Hanna as he spends time with animals from all continents. Jack interviews people knowledgeable about each animal and their habitat. Children will learn about ecology, respnosibility for the environment and sharing the planet with the animals.",99,N/A,N/A,N/A,,,,,
2000,WPXB,N/A,"Boston, MA",3,Analog,Jack Hanna's Animal Adventures,Core,Network,Mon-Thurs 1:30-2PM,16,0,30,13,16,"Jack Hanna's Animal Adventures is a live-action program designed to meet the educational and informational needs of children between the ages of 13 and 16. Each episode follows Jack Hanna as he spends time with animals from all continents. Jack interviews people knowledgeable about each animal and their habitat. Children will learn about ecology, respnosibility for the environment and sharing the planet with the animals.",99,N/A,N/A,N/A,,,,,
2000,WPXG,PAX TV,"Boston, MA",3,Analog,Jack Hanna's Animal Adventures,Core,Network,Mon-Fri 1-1:30PM & 1:30-2PM,30,0,30,13,16,"Jack Hanna's Animal Adventures is a live-action program designed to meet the educational and informational needs of children between the ages of 13 and 16. Each episode follows Jack Hanna as he spends time with animals from all continents. Jack interviews people knowledgeable about each animal and their habitat. Children will learn about ecology, respnosibility for the environment and sharing the planet with the animals.",99,N/A,N/A,N/A,,,,,
2000,WPXG,PAX TV,"Boston, MA",3,Analog,Jack Hanna's Animal Adventures,Core,Network,Mon-Thur 1-1:30PM,24,0,30,13,16,"Jack Hanna's Animal Adventures is a live-action program designed to meet the educational and informational needs of children between the ages of 13 and 16. Each episode follows Jack Hanna as he spends time with animals from all continents. Jack interviews people knowledgeable about each animal and their habitat. Children will learn about ecology, respnosibility for the environment and sharing the planet with the animals.",99,N/A,N/A,N/A,,,,,
2000,WPXG,PAX TV,"Boston, MA",3,Analog,Jack Hanna's Animal Adventures,Core,Network,Fridays 1-1:30PM & 1:30-2PM,20,0,30,13,16,"Jack Hanna's Animal Adventures is a live-action program designed to meet the educational and informational needs of children between the ages of 13 and 16. Each episode follows Jack Hanna as he spends time with animals from all continents. Jack interviews people knowledgeable about each animal and their habitat. Children will learn about ecology, respnosibility for the environment and sharing the planet with the animals.",99,N/A,N/A,N/A,,,,,
