2000,WPXG,PAX TV,"Boston, MA",3,Analog,Jack Hanna's Animal Adventures,Core,Network,Mon-Thur 1:30-2PM,16,0,30,13,16,"Jack Hanna's Animal Adventures is a live-action program designed to meet the educational and informational needs of children between the ages of 13 and 16. Each episode follows Jack Hanna as he spends time with animals from all continents. Jack interviews people knowledgeable about each animal and their habitat. Children will learn about ecology, respnosibility for the environment and sharing the planet with the animals.",99,N/A,N/A,N/A,,,,,
2000,WSBK,UPN,"Boston, MA",3,Analog,Disney's Recess,Core,Network,Mon-Fri 7:30-8AM,65,0,30,2,11,"""Disney's Recess"" follows the adventures and misadventures of six friends in their school playground as they struggle through the whirlwind of growing up. Issues covered include friendship, honesty, and the difference between right and wrong.",99,N/A,N/A,N/A,,,,,
2000,WSBK,UPN,"Boston, MA",3,Analog,Disney's Recess,Core,Network,Sundays 10-10:30AM,13,0,30,2,11,"""Disney's Recess"" follows the adventures and misadventures of six friends in their school playground as they struggle through the whirlwind of growing up. Issues covered include friendship, honesty, and the difference between right and wrong.",99,N/A,N/A,N/A,,,,,
2000,WSBK,UPN,"Boston, MA",3,Analog,Teen Files: New England,Non-Core,Local,(12/2) Saturday 7-7:30AM,1,0,30,13,16,"This local program explores the issue of violence, including gun violence, dating violence, and violence in the media, and how these issues affect local teens.",99,N/A,N/A,N/A,,,,,
2000,WSBK,UPN,"Boston, MA",3,Analog,Teen Files: New England,Non-Core,Local,(12/23) Saturday 6-6:30PM,1,0,30,13,16,"This episode tackles the issue of ""surviving high school"" in the New England area. We talk with teens throughout New England about fitting in, body image & eating disorders, and depression & suicide.",99,N/A,N/A,N/A,,,,,
2000,WSBK,UPN,"Boston, MA",3,Analog,Disney's Doug,Non-Core,Network,(10/1) Sunday 9-9:30AM,1,0,30,6,11,"Disney's Doug follows the trials and tribulations of young man, Doug Funnie, and his friends, as they struggle through the ups and downs of growing up. Through Doug's relationships with family, friends, and teachers, issues like peer pressure, friendship, and honesty are explored",99,N/A,N/A,N/A,,,,,
2000,WUNI,N/A,"Boston, MA",4.4,Analog,Plasa Sesamo,Core,Network,Sat & Sun 8-9AM,24,0,60,2,5,"PROVIDES READING READINESS TRAINING, EARLY MATHEMATICS SKILLS, EDUCATION IN HEALTH, HYGEINE AND NUTRITION, AND PROVIDES ENCOURAGEMENT AND STIMULATION FOR ACADEMIC SUCCESS. PRODUCED BY CTW SPECIFICALLY FOR A SPANISH-LANGUAGE AUDIENCE.",99,N/A,N/A,N/A,,,,,
2000,WUNI,N/A,"Boston, MA",4.4,Analog,Carrusel de las Americas,Core,Network,Saturdays 7-8AM,9,0,60,6,11,"""CARRUSEL"" TEACHES LESSONS IN HISTORY AND GEOGRAPHY THAT THE VIEWER LEARNS ALONG WITH THE TELEVISION CLASSMATES. THE LESSONS ARE DEDICATED TO THE HISTORY OF THE AMERICAS, CONCENTRATING ON THE DISCOVERY AND SETTLING OF THE AMERICAS, THE HISTORY OF SLAVERY AND THE MEXICAN REVOLUTION. THE SHOW TEACHES THE IMPACT OF THE EXPLORATIONS AND DISCOVERY OF THE AMERICAS ON THE CONQUERORS AND THE INDIGENOUS PEOPLES. THE SERIES AIMS TO TEACH ALL CHILDREN OF THE AMERICAS BOUT THEIR COMMONALITY ROOTED IN THEIR SHARED ORIGINS.",99,N/A,N/A,N/A,,,,,
2000,WUNI,N/A,"Boston, MA",4.4,Analog,Serafin,Core,Network,Saturdays 7-8AM (12/9) & 7-9AM (12/16) & 7-8AM (12/2),5,0,60,8,11,"Dora and her best friend, a monkey named Boots, invite the viewer to participate in an exciting adventure. Each step on the journey presents some kind of problem or puzzle and Dora is proudly bilingual, using that knowledge to communicate with her friends, overcome obstacles, and reach her goal. Dora enriches her world by providing preschoolers with lessons in language and culture while serving as a role model for children by developing self-confidence and a positive self-image by embracing herself for who she is, where she comes from, and what she will one day grow up to be.",99,N/A,N/A,N/A,,,,,
2000,WWDP,N/A,"Boston, MA",5,Analog,Oye Arnold,Core,Syndicated,Saturdays 7-7:30AM,9,0,30,6,11,"Oye Arnold presents a fresh look at life in the big city from a child's point of view. The program focuses on Arnold, the principal character and his friends as they learn to deal with challenges, fears, temptations, and responsibility.",99,N/A,N/A,N/A,,,,,
2000,WWDP,N/A,"Boston, MA",5,Analog,Oye Arnold,Core,Syndicated,Sat & Sun 8-8:30AM,27,0,30,6,11,"Oye Arnold presents a fresh look at life in the big city from a child's point of view. The program focuses on Arnold, the principal character and his friends as they learn to deal with challenges, fears, temptations, and responsibility.",99,N/A,N/A,N/A,,,,,
2000,WWDP,N/A,"Boston, MA",5,Analog,Aventura en Panales,Core,Syndicated,Saturdays 7:30-8AM,9,0,30,6,8,"Aventura en Panales takes children on a tour of the world that exists between your knees and the floor. It is a baby's-eye view of life that takes the main character, one-year-old Tommy Pickles, and his friends on adventures that explore the way everyday experiences can be fantastic. They discover magic, danger and comic adventure in our world. They venture into the unknown led by their curiosity and innocent love of mischief. The animation emphasizes perspective, often exaggerating sizes and shapes to reflect a child's point of view.",99,N/A,N/A,N/A,,,,,
2000,WWDP,N/A,"Boston, MA",5,Analog,Aventura en Panales,Core,Syndicated,Sat & Sun 8:30-9AM,27,0,30,4,8,"Aventura en Panales takes children on a tour of the world that exists between your knees and the floor. It is a baby's-eye view of life that takes the main character, one-year-old Tommy Pickles, and his friends on adventures that explore the way everyday experiences can be fantastic. They discover magic, danger and comic adventure in our world. They venture into the unknown led by their curiosity and innocent love of mischief. The animation emphasizes perspective, often exaggerating sizes and shapes to reflect a child's point of view.",99,N/A,N/A,N/A,,,,,
2000,WWDP,N/A,"Boston, MA",5,Analog,Lift-Off,Core,Syndicated,Saturdays 9-9:30AM & 9:30-10AM,26,0,30,3,8,"Lift-off is a storybook program. Each program presents a group of characters in a different adventure. Through these stories the protagonists, children, discover that they are able to face certain situations and resolve their daily problems. Each day a story teaches a different lesson regarding the community, friendship, relationships, and experiences they will encounter in the future. Children also learn the meaning of hope, perseverance, tolerance, and how dreams come true.",99,N/A,N/A,N/A,,,,,
2000,WWDP,N/A,"Boston, MA",5,Analog,Pistas de Blue,Core,Syndicated,Sundays 7-7:30AM,14,0,30,2,6,"Pistas de Blue is an interactive pre-school program, which teaches children how to use the basic tools for critical thinking and reasoning, before going to school for the first time. Clues are given throughout the program by Steve the principal host and his dog Blue.",99,N/A,N/A,N/A,,,,,
2000,WWDP,N/A,"Boston, MA",5,Analog,Dora the Explorer,Core,Syndicated,Sundays 7:30-8AM,14,0,30,2,6,"Dora and her best friend, a monkey named Boots, invite the viewer to participate in an exciting adventure. Each step on the journey presents some kind of problem or puzzle and Dora is proudly bilingual, using that knowledge to communicate with her friends, overcome obstacles, and reach her goal. Dora enriches her world by providing preschoolers with lessons in language and culture while serving as a role model for children by developing self-confidence and a positive self-image by embracing herself for who she is, where she comes from, and what she will one day grow up to be.",99,N/A,N/A,N/A,,,,,