2001,WSTR,The WB,Cincinnati,4.5,Analog,KEEPING IT WILD,Core,Syndicated,Sundays 10:00am - 10/1/01-12/31/01,13,0,30,11,14,"Keeping It Wild: The key educational objective of this program is to create awareness and understanding of animals, and their interaction with their particular environments. Further, the role that humans play interacting with animals in the wild will be consistently explored. A theme running throughout this series will be the importance of protecting endangered species and the impact of human interacting with their environment and the need to protect their natural habitats. Jim Fowler and specific experts will also provide educational information related to animal behavior.",99,N/A,N/A,N/A
2001,WSTR,The WB,Cincinnati,4.5,Analog,THE PET SHOP,Core,Syndicated,Sundays 10:30am - 10/01/01-12/31/01,13,0,30,11,14,"Marc Morrone guides viewers through the frenetic world of pets. Playing ringmaster to the countless pets that jump, crawl, fly and bark around him, he provides a look at what makes pets special. His unique advice and helpful tips on anything from supplementing a lizard's diet with peach baby food or housebreaking a puppy will help pet lovers of all ages to better understand and care for all creatures great and small.",99,N/A,N/A,N/A
2001,WSTR,The WB,Cincinnati,4.5,Analog,HS SPORTS SHOW,Core,Syndicated,Sundays 11:30am - 10/01/01-12/31/01,13,0,30,13,16,"This program features off the field pro-social activities of male and female student athletes and coaches. Segments focus on messages encouraging school completion, community service, cooperation, leadership, healthful practices, athletes, involvement in extracurricular activities, positive reinforcement, goal setting or overcoming adversity by showing examples of students and coaches that have achieved these values.",99,N/A,N/A,N/A
2001,WXIX,FOX,Cincinnati,4.01,Analog,SCHOLASTIC'S THE MAGIC SCHOOL BUS,Core,Network,"Saturday, 7-7:30AM",13,0,30,6,9,"A significant purpose of Scholastic's The Magic School Bus is to motivate children's interest in science, introduce science ideas, inspire positive attitudes toward science and model age appropriate science problem solving behaviors. The magically transforming bus, powered by imagination, takes the children and their teacher, Miss Frizzle, on a variety of science adventures.",99,N/A,N/A,N/A
2001,WXIX,FOX,Cincinnati,4.01,Analog,SCHOLASTIC'S THE MAGIC SCHOOL BUS,Core,Network,"Saturday, 7:30-8AM",13,0,30,6,9,"A significant purpose of Scholastic's The Magic School Bus is to motivate children's interest in science, introduce science ideas, inspire positive attitudes toward science and model age appropriate science problem solving behaviors. The magically transforming bus, powered by imagination, takes the children and their teacher, Miss Frizzle, on a variety of science adventures.",99,N/A,N/A,N/A
2001,WXIX,FOX,Cincinnati,4.01,Analog,LIFE WITH LOUIE,Core,Network,"Monday, 2:00-2:30pm",13,0,30,6,11,"A significant purpose of Life With Louie is to educate and inform children between the ages of 6 and 11. The educational and informational objective of the program is to offer children the opportunity to explore issues and scenarios that are common to growing up, yet might be perplexing to children, such as how to cope with family and friends as part of this process. As children view this series, they are learning valuable life lessons, as well as being entertained.",99,N/A,N/A,N/A
2001,WXIX,FOX,Cincinnati,4.01,Analog,SCHOLASTIC'S THE MAGIC SCHOOL BUS,Core,Network,"Sunday, 8:00-8:30AM",13,0,30,6,9,"A significant purpose of Scholastic's The Magic School Bus is to motivate children's interest in science, introduce science ideas, inspire positive attitudes toward science and model age appropriate science problem solving behaviors. The magically transforming bus, powered by imagination, takes the children and their teacher, Miss Frizzle, on a variety of science adventures.",99,N/A,N/A,N/A
2001,WXIX,FOX,Cincinnati,4.01,Analog,SCHOLASTIC'S THE MAGIC SCHOOL BUS,Core,Network,"Sunday, 8:30-9:00AM",13,0,30,6,9,"A significant purpose of Scholastic's The Magic School Bus is to motivate children's interest in science, introduce science ideas, inspire positive attitudes toward science and model age appropriate science problem solving behaviors. The magically transforming bus, powered by imagination, takes the children and their teacher, Miss Frizzle, on a variety of science adventures.",99,N/A,N/A,N/A
2001,WXIX,FOX,Cincinnati,4.01,Analog,KIDS TALK SPORTS,Core,Syndicated,"Sunday, 9:00-9:30AM",13,0,30,13,16,"This program is specifically designed to serve the educational needs of teenagers 13-16 years old. The educational objective of this program is to guide teens, by providing positive role models of accomplished and successful adults in the world of sports. Issues discussed will include cheating, violence, drugs and the value of education, as well as tolerance and conflict resolution. (Began airing in this time period 10/7/2001)",99,N/A,N/A,N/A
2001,WXIX,FOX,Cincinnati,4.01,Analog,THIS WEEK IN BASEBALL,Core,Network,"Saturday, 12:30-1:00PM",1,0,30,13,16,"This show is aimed at teens 13-16 and highlights the pro social on and off field activities of MLB's leading players and coaches. Working with the National Association for Sport and Physical Education, the program portrays the positive outcomes that result from dedication, hard work, self-discipline, teamwork, practice and personal responsibility. [Aired in this time period through 10/6/2001]",99,N/A,N/A,N/A
2001,WXIX,FOX,Cincinnati,4.01,Analog,CHICKEN SOUP FOR THE SOUL,Core,Syndicated,"Sunday, 9:30-10:00AM",13,0,30,13,16,"This Show serves the educational and informational needs of teens 13-16 years old. Based on the award winning series of books, the objectives of the program are to provide teens with examples of young people in modern situations involving choices, to help them identify and select the positive alternatives when facing personal, interpersonal and social dilemmas. Also to show young people that commitment and personal efforts make it possible to be better people. (Aired in this time period beginning 10/7/2001)",99,N/A,N/A,N/A
2001,WXIX,FOX,Cincinnati,4.01,Analog,NFL - UNDER THE HELMET,Core,Network,"Sunday, 11:00-11:30AM",13,0,30,13,16,"This show serves the cognitive needs of teens 13-16. The show uses highly recognizable NFL starts to encourage teens toward pro-social behaviors - such as staying away from drugs, gangs and violence.",99,N/A,N/A,N/A
2001,WXIX,FOX,Cincinnati,4.01,Analog,ONLY IN AMERICA,Non-Core,Syndicated,"Saturday, 12/8/01, 5:00PM",1,0,30,13,16,Show is designed to serve the cognitive needs of teens by presenting inspirational stories of Americans who have succeeded in life despite overwhelming odds and obstacles. These stories are meant to serve as role models for teens facing adversity and present strategies for coping with those problems.,99,N/A,N/A,N/A
2001,WBQC,UPN,Cincinnati,3,Analog,DISNEY'S RECESS,Core,Network,MTWTHF/7:00AM; SUN/9:30AM,78,0,30,2,11,"RECESS IS DESIGNED TO EDUCATE AND INFORM CHILDREN WHO ARE BETWEEN THE AGES 2 AND 11 YEARS OLD. MORE SPECIFICALLY, THE SERIES TEACHES CHILDREN ABOUT THE FUNDAMENTALS, MORALS AND EDICATIONAL LESSONS OF LIFE.",99,N/A,N/A,N/A