Year,Call Sign,Network Affiliation,Nielsen DMA,Ave. # of Analog hours,Analog or Digital,Title of EI programs,Core or Non-core,Origin of Program,Regular schedule of Program,Total times aired,Number of pre-emptions,Length of Program (in minutes),Age of Target Audience From,Age of Target Audience To,Description of Program,Number of pre-emptions rescheduled,Ave. # of hours of all digital programming per week,Ave. # of hours per week of digital Core Programming per week,Y or N to Q 11 in Digital Core Programming: At least 50% of the Core Programming had not already aired within the previous seven days
2001,WCPO,ABC,Cincinnati,4,Analog,DISNEY'S TEACHER'S PET,Core,Network,Saturdays/9:00-9:30 AM ET (through 12/8/01); 9:30-10:00 AM (as of 12/15/01),13,0,30,8,12,"Via a magical transformation, nine-year-old Leonard Helperman's dog ""Spot"" discovers that he is able to talk and walk upright. He seizes the opportunity to fulfill a lifelong ambition: to go to school. Dressed in some of Leonard's clothes, Spot becomes ""Scott Leadready"", reveling in the challenge of learning fourth-grade spelling, math and history. The fourth grade teacher, Mrs. Helperman, is Leonard's mother. She is a single parent. This series celebrates the privilege of being able to obtain an education. Stories teach honesty, cooperation, team work, resourcefulness, respect for rules (particularly in the school setting) and empathy. ""Spot/Scott's"" wide vocabulary exposes the audience to new vocabulary, used in context.",99,N/A,N/A,N/A
2001,WCPO,ABC,Cincinnati,4,Analog,DISNEY'S LLOYD IN SPACE,Core,Network,Saturdays/9:30-10:00 AM ET (through 12/8/01); Saturdays/7:00 AM-7:30 AM (as of 12/15/01),13,0,30,8,12,"""Lloyd in Space"" is the story of an alien boy who attends Middle School in a galaxy far away. His mother, Nora, is the commander of the space station in Intrepidville, where Lloyd, his six-year-old sister Francine and his three buddies, Eddie, Kurt and Douglas live. Nora is a single parent. Many of the stories are set at school and invlove peer and friendship issues as well as school rules, procedures and authority conflicts. Episodes are designed to teach values, problem-solving, responsibility (as in a story about Lloyd's babysitting his younger sister, who runs away when he becomes overbearing, and several stories about taking responsibility for pets), and goal setting.",99,N/A,N/A,N/A
2001,WCPO,ABC,Cincinnati,4,Analog,DISNEY'S RECESS,Core,Network,Saturdays/10:00-10:30 AM ET,13,0,30,8,12,"""Disney's Recess"" is a collection of stories about six fourth-grade children who attend public school. These children are an ethnically diverse and gender-diverse group. Their experiences at Third Street School deliver messages about problems common to middle childhood: conflicts with authority figures, school and family rules, issues of fairness, peer pressure and coping with disappointment. A number of episodes revolve around class bullies or conflicts with teachers' favored students. Series episodes provide opportunities for parent/child discussions about values.",99,N/A,N/A,N/A
2001,WCPO,ABC,Cincinnati,4,Analog,DISNEY'S RECESS,Core,Network,Saturdays/10:30-11:00 AM ET,13,0,30,8,12,"""Disney's Recess"" is a collection of stories about six fourth-grade children who attend public school. These children are an ethnically diverse and gender-diverse group. Their experiences at Third Street School deliver messages about problems common to middle childhood: conflicts with authority figures, school and family rules, issues of fairness, peer pressure and coping with disappointment. A number of episodes revolve around class bullies or conflicts with teachers' favored students. Series episodes provide opportunities for parent/child discussions about values.",99,N/A,N/A,N/A
2001,WCPO,ABC,Cincinnati,4,Analog,LIZZIE MCGUIRE,Core,Network,Saturdays/11:00-11:30 AM ET,13,0,30,9,12,"""Lizzie McGuire"" is the story of an ingenious twelve-year-old girl who attends an ethnically diverse middle school. Her best friends are Miranda, a feisty Hispanic girl, and a boy named Gordo. Lizzie has a gifted younger brother who is frequently the source of conflict. Their parents handle their children's crises with humor and affection. Stories are realistic, revolving around school issues, rules, peer pressure, the struggle to find a comfortable identity, trust, facing one's mistakes, and the emotional ups-and-downs of pre-adolescence. Particular strengths of this series are its believability and the creation of a live action series that features a strong, positive girl in the lead role.",99,N/A,N/A,N/A
2001,WCPO,ABC,Cincinnati,4,Analog,EVEN STEVENS,Core,Network,Saturdays/11:30 AM-12:00 PM ET,13,0,30,9,12,"""Even Stevens"" explores the day-to-day interaction between seventh grader Louis, a bright and unconventional boy, his eighth grade sister Ren, whose straight-A average and mature manner belie her vulnerability, and his two best friends. Louis is naturally funny and spontaneous. He is often the instigator of a prank or scheme-much to the embarrassment of his older sister. Ren's brains and superior organizational skills often make Louis feel clumsy and inadequate by comparison. They are loyal and loving siblings, although each marches to a very different beat. ""Even Stevens"" episodes are highly kid-relatable, focusing on family and brother-sister conflicts, responsibility, fairness, competition, goal-setting, self-esteem, problems with schoolmates and parent-child interaction.",99,N/A,N/A,N/A
2001,WCPO,ABC,Cincinnati,4,Analog,"SABRINA, THE ANIMATED SERIES",Core,Network,Saturdays/7:00-7:30 AM ET (through 10/13/01),2,0,30,8,12,"Twelve-year-old Sabrina Spellman, who is half witch and half mortal, is being raised in a non-traditional family consisting of her Uncle Quigley and two young aunts. Series episodes explore social and developmental issues such as peer pressure/competition, loyalty and friendship, responsibility, honesty, facing fears, speaking up for one's beliefs, etc. Family issues such as divorce, remarriage and household rules are also addressed.",99,N/A,N/A,N/A
2001,WCPO,ABC,Cincinnati,4,Analog,DISNEY'S THE WEEKENDERS,Core,Network,Saturdays/7:30 AM-8:00 AM ET,13,0,30,9,12,"""The Weekenders"" introduces four twelve-year-olds who have been friends since kindergarten. They attend middle school in southern California and spend time together on weekends. Their family circumstances are diverse: Tino is the only son of a single mother, Carver is the middle child in an affluent African American family, Tish comes from an Eastern European immigrant family and Lor is the only girl among fourteen sports-minded brothers. Stories explore such topics as parent/child relations, sibling rivalry, acculturation, competition vs. compromise, responsibility, honesty, peer acceptance and loyalty.",99,N/A,N/A,N/A
2001,WCPO,ABC,Cincinnati,4,Analog,MARY-KATE AND ASHLEY IN ACTION,Core,Network,Saturdays/7:00-7:30 AM ET (as of 10/20/01); Saturdays/9:00-9:30 AM ET (as of 12/15/01),11,0,30,9,11,"""Mary-Kate and Ashley in Action"" features two well-known, real-life siblings in a fanciful scenario. They play actors performing roles in a weekly movie about two young special agents whose adventures take them all over the world. Their sister ""team"" relationship is one in which cooperation, logical deduction, inventiveness and humor triumph. Mary-Kate and Ashley's friendship with a fellow team member, Chinese-American sicteen-year-old Rod Choi, is a close one, as is their relationship with Hispanic team member Ivan Quintero. Ivan is extremely gifted at technical and mathematical matters; his electronic inventions are a great asset to the team. In addition to problem-solving strategies each episode teaches children values such as honesty, perseverence, kindness and respect for differences. As girls engaged in active, adventurous stories Mary-Kate and Ashley Olsen are particularly good role models for our school-aged audience.",99,N/A,N/A,N/A
2001,WCPO,ABC,Cincinnati,4,Analog,JACK HANNA'S ANIMAL ADVENTURES,Core,Syndicated,Saturdays/Sundays 1:00PM ET,13,1,30,13,16,"In each episode the cameras follow Jack as he spends time with nature’s creatures across the continents. Jack talks with people that are knowledgeable about each animal and habitat, teaching as he goes. Each episode is designed to reveal to children the world around them in a way that presents positive role models and pro-social values within an environmentally responsible universe.",0,N/A,N/A,N/A
2001,WCPO,ABC,Cincinnati,4,Analog,"BOO! TO YOU, TOO, WINNIE THE POOH!",Non-Core,Network,"Tuesday, 10/30/01; 8:30-9:00 PM ET",1,0,30,3,6,"Piglet discovers unexpected courage, resourcefulness and self-esteem when he forces himself to conquer fears of imaginary creatures on Halloween night. His friends also learn that helping someone else---in this case their small friend Piglet--is more satisfying than Halloween revelry or trick-or-treating.",99,N/A,N/A,N/A
2001,WCPO,ABC,Cincinnati,4,Analog,A WINNIE THE POOH THANKSGIVING,Non-Core,Network,"Friday, 11/16/01; 8:30-9:00 PM ET",1,0,30,3,6,"Facing disappointment with grace, exercising resourcefulness and creativity, working as a team and comforting a friend are demonstrated in this story. Each of those who gathers around the table for a bounteous but unconventional Thanksgiving feast realizes that Thanksgiving is not about certain foods or decorations but is about family, friends and acknowledging one's blessings.",99,N/A,N/A,N/A
2001,WCPO,ABC,Cincinnati,4,Analog,THE NEW ADVENTURES OF WINNIE THE POOH,Non-Core,Network,"Saturdays, 6:30AM ET",13,0,30,3,6,"Based on the classic ""Winnie the Pooh"" books by author A.A. Milne, ""The New Adventures of Winnie the Pooh"" depicts the everyday lives of Christopher Robin and his companions Pooh, Piglet, Rabbit, Tigger, Eeyore, Owl and Gopher. Series episodes deliver strong messages about honesty, responsibility, persistence, cooperative effort, friendship and caring. Many stories are designed to help young children distinguish between fantasy and reality and overcome common childhood fears.",99,N/A,N/A,N/A
2001,WKRC,CBS,Cincinnati,3,Analog,OSWALD,Core,Network,Saturday 10:00-10:30AM/ Sundays 7:30-8:00AM,13,0,30,2,5,"This series follows the adventures of Oswald, an animated octopus, who experiences the world as would a preschool child. Living in the metropolis of Big City, Oswald, curious and intensely interested in how the world works, picks his way through the problems and predicaments he faces by sorting through the varying responses of his friends and coming to his own answer. The objectives of this series are to assist preschool children in adapting to the early developmental challenges of building friendships, learning news physical skills, and beginning to understand their own perspectives, as well as those of others. The program also focuses on teaching life-lessons relating to tolerance, civility, problem-solving and cooperation. This program is specifically designed to further the educational and informational needs of children, has educating and informing children as a significant purpose, and otherwise meets the definition of Core Programming as specified in the Commission’s rules.",99,N/A,N/A,N/A
2001,WKRC,CBS,Cincinnati,3,Analog,DORA THE EXPLORER,Core,Network,Saturday 10:30a - 11:00a,13,0,30,2,5,"In this series seven-year-old Dora and her monkey travel companion Boots invite the audience to join them each week on a journey in which they will have to overcome various obstacles to reach an end goal. The series uses a CD-ROM/on-line adventure game format to encourage a variety of problem-solving strategies. The objectives of this program are to assist children in developing their problem-solving skills, reinforce their emerging cognitive skills, and make computers more familiar to them by introducing and using the conventions and vocabulary of computer games. This program is specifically designed to further the educational and informational needs of children, has educating and informing children as a significant purpose, and otherwise meets the definition of Core Programming as specified in the Commission's rules.",99,N/A,N/A,N/A
2001,WKRC,CBS,Cincinnati,3,Analog,BLUE'S CLUES,Core,Network,Saturday 11:00am - 11:30am,12,1,30,2,5,"In this series, a young adult host - together with Blue, a puppy whose personality and actions mirror those of a preschooler - brings viewers a variety of games, themes and concepts that are based on an age-appropriate educational curriculum. The program follows a narrative format, in which the host elicits contributions from the viewer to answer questions and move the action forward. The program's objectives include encouraging preschoolers to actively explore the world around them, fostering their problem-solving skills and independent reasoning, and creating a foundation of confidence and optimism for future learning. This program is specifically designed to further the educational and informational needs of children, has educating and informing children as a significant purpose, and otherwise meets the definition of Core Programming as specified in the Commission's rules.",1,N/A,N/A,N/A
2001,WKRC,CBS,Cincinnati,3,Analog,LITTLE BILL,Core,Network,Saturday 11:30a - 12:00n,12,1,30,2,5,"This is an animated series based on children's books written by Bill Cosby that examines life through the eyes of a five-year-old boy eager to understand his world. Each episode contains two stories in which Little Bill is faced with a challenge or problem - whether emotional, social or physical - he must solve. The objectives of this series are to encourage children to value themselves and the love and support of their family, friends and community, and to help them develop their social skills and ethical values by dealing with the conflicts in their lives with fairness and creativity. This program is specifically designed to further the educational and informational needs of children, has educating and informing children as a significant purpose, and otherwise meets the definition of Core Programming as specified in the Commission's rules.",1,N/A,N/A,N/A
2001,WKRC,CBS,Cincinnati,3,Analog,FRANKLIN,Core,Network,Saturdays 7:00-7:30AM,13,0,30,2,5,"Based on a series by Paulette Bourgeois and Brenda Clark, this program features the adventures of the turtle Franklin and his friends Bear, Snail, Rabbit and Goose. The objectives of the program are to present to young viewers age-appropriate moral dilemmas addressing issues such as the meaning of right and wrong, the purposes of rules and the consequences of following or not following them, and the values inherent in telling the truth, and to teach viewers important social values such as cooperation and compromise, fairness, responsibility, self-respect and respect for others. This program is specifically designed to further the educational and informational needs of children, has educating and informing children as a significant purpose, and otherwise meets the definition of Core Programming as specified in the Commission's rules.",99,N/A,N/A,N/A
2001,WKRC,CBS,Cincinnati,3,Analog,BOB THE BUILDER,Core,Network,Sundays 7:30-8:00AM/Saturdays 10:00-10:30AM,13,0,30,2,5,"This series presents episodes centered around Bob, a friendly builder, and his talking machines, and follows their adventures as they work on a variety of construction projects. Bob’s machines have minds of their own, and act like a gang of lively children, exhibiting traits to which a young audience will relate. The objective of the program is to provide an opportunity for preschool children to explore and learn about issues such as fears, sharing, shyness, teamwork, self-esteem, and cooperation, which are critical to their early development. This program is specifically designed to further the educational and informational needs of children, has educating and informing children as a significant purpose, and otherwise meets the definition of Core Programming as specified in the Commission’s rules.",99,N/A,N/A,N/A
2001,WLWT,NBC,Cincinnati,3.38,Analog,CITY GUYS-A,Core,Network,Saturday/11:00am,12,1,30,13,16,"""City Guys"" originates at a densely populated, multi-ethnic, public high school in the heart of Manhattan. Through its characters the show demonstrates that what we see doesn't begin to tell the story about who people really are and what life is really like. Two young men, who seem to be opposite in all obvious ways (race, economic background, culture, clothes, and music) are thrown into a friendship and working relationship by their wise and acerbic principal. The boys actually have a lot in common as they are both bright, they want to be more than the negative images they sometimes project, and they have never been motivated to really think, reflect, or act beyond the superficial. As they deal with the pressures of big city life, they learn that getting beyond the superficial and seriously dealing with the deeper reality is the critical path to attaining success.",0,N/A,N/A,N/A
2001,WLWT,NBC,Cincinnati,3.38,Analog,ALL ABOUT US,Core,Network,Saturday/11:30am,13,0,30,13,16,"This program is set in Chicago and follows four high school friends as they define their friendships with each other. The emphasis is inward as the girls learn from each other, whether the point is to respect a family's rules, or to let your parents helps you when your pride might get in the way. These girls are an interesting group-an athlete, a social crusader, a singer/composer, and a rich diva-but they are all smart and ambitious. They use their different talents, perspectives, and family experiences to illustrate alternative approaches to understanding and solving problems. The basketball player's approach to a big loss teaches the singer how to overcome her stage fright. When the African-American girl avidly works on the black students' fund-raiser, the others understand racial isolation for the first time. The girls come to appreciate that every person has unique gifts; it is their duty as friends to make sure they share their gifts with each other.",99,N/A,N/A,N/A
2001,WLWT,NBC,Cincinnati,3.38,Analog,JUST DEAL,Core,Network,Saturday/12:00pm,13,0,30,13,16,"""Just Deal"" takes the perspective of three close friends, a girl and two boys, who have a complicated but very strong bond of friendship. Set in suburban Seattle, these three have comfortable and happy lives, but that doesn't absent them from all the normal issues of adolescence. Their overarching challenges are defining their values and purpose in life, and like most teens, they are serious about figuring it all out. They aren't confused or alienated, just earnest and sincere about doing the right thing by others, while doing what is best for their own development. They have different family backgrounds with strong parents who also weigh in on these issues. When they mix it up with input from a diverse circle of friends this threesome always learns that life isn't simple, not matter where you come from or what you have. There is no substitute for having to Just Deal.",99,N/A,N/A,N/A
2001,WLWT,NBC,Cincinnati,3.38,Analog,SKATE,Core,Network,Saturday/12:30pm,13,0,30,13,16,"This program comes from the perspective of ""culture"" based on a sport. The central character is a teen who is trying to break out of athletic mediocrity and become an explosive skater. Yet, he's got other obligations, like school, college and long-term security, which totally conflict with embracing the skater's lifestyle or bravado and risk. Balancing competing goals is the underlying struggle of the main character's life, which is spiked by specific situations that test his moral fiber and his decision-making ability. Through a strong relationship with his father and close friends, he learns hows to establish priorities, become a professional, and develop a good sense of judgment about people and situations.",99,N/A,N/A,N/A
2001,WLWT,NBC,Cincinnati,3.38,Analog,CITY GUYS-B,Core,Network,Sunday/11:00am,13,0,30,13,16,"""City Guys"" originates at a densely populated, multi-ethnic, public high school in the heart of Manhattan. Through its characters the show demonstrates that what we see doesn't begin to tell the story about who people really are and what life is really like. Two young men, who seem to be opposite in all obvious ways (race, economic background, culture, clothes, and music) are thrown into a friendship and working relationship by their wise and acerbic principal. The boys actually have a lot in common as they are both bright, they want to be more than the negative images they sometimes project, and they have never been motivated to really think, reflect, or act beyond the superficial. As they deal with the pressures of big city life, they learn that getting beyond the superficial and seriously dealing with the deeper reality is the critical path to attaining success. This is a different episode than the one that airs Saturdays at 12:00pm.",99,N/A,N/A,N/A
2001,WLWT,NBC,Cincinnati,3.38,Analog,NBA INSIDE STUFF,Core,Network,Sunday/11:30am,13,0,30,13,16,"""NBA Inside Stuff"" is a half-hour news magazine about the players and programs of the NBA. The show features players and coaches in a variety of short segments that communicate a point-of-view or reveal new information to the audience. The information might be about the game of basketball or it might show another side of the players' lives. Every week the audience sees examples of individual players and the NBA organization in civic endeavors. Whether it's supporting reading programs, scholarships, camps, or health and fitness programs, the NBA and its players have a presence. In some segments, specific questions from the audience on topics ranging from developing specific athletic skills to dealing with personal problems are answered by a player. Co-hosts Ahmad Rashad and Summer Sanders moderate and connect the different segments of the show. Every episode of NBA Inside Stuff offers content stressing the value of practice, hard word, and professionalism as a way to achieve one's goals.",99,N/A,N/A,N/A
2001,WLWT,NBC,Cincinnati,3.38,Analog,WILD MOMENTS,Core,Network,Sunday/12:00pm,9,4,30,13,16,"""Wild Moments"" offers viewers an educational, and somtetimes humorous, walk on the wild side. Hosted by Naturalist Jack Hubley and his faithful dog Trusty, the program treks viewers through fields, forests, lakes, and mountains solving the mysteries of animal life and the environment. Through Hubley's humor and unique point-of-view, ""Wild Moments"" is infomative, educational, and humorous, answering such questions as ""what keep a duck warm in winter?"" and ""where can you find a turtle with fangs?""",2,N/A,N/A,N/A
2001,WLWT,NBC,Cincinnati,3.38,Analog,COMMITMENT 2001: THE CINCINNATI MAYORAL DEBATE,Non-Core,Local,10/30/01 8:00pm,1,99,60,13,16,Live coverage of the historic debate between the two candidates vying to become Cincinnati's first strong mayor in more than 60 years. Produced by WLWT-TV is cooperation with the League of Women Voters.,99,N/A,N/A,N/A
2001,WLWT,NBC,Cincinnati,3.38,Analog,THE SWEARING-IN CEREMONY FOR THE CINCINNATI MAYOR,Non-Core,Local,12/1/01 11:00am,1,0,30,13,16,Live coverage of the swearing-in of Cincinnati's first strong mayor in more than 60 years.,99,N/A,N/A,N/A
2001,WLWT,NBC,Cincinnati,3.38,Analog,NATIONAL GEOGRAPHIC CHANNEL PRESENTS PEARL HARBOR: LEGACY OF AN ATTACK,Non-Core,Network,12/7/01 8:00pm,1,0,60,13,16,A documentary recounting the historic events that took place in Pearl Harbor 60 years ago.,99,N/A,N/A,N/A
2001,WLWT,NBC,Cincinnati,3.38,Analog,NATIONAL GEOGRAPHIC CHANNEL PRESENTS SUPER CROC,Non-Core,Network,12/9/01 7:00pm,1,0,120,13,16,A documentary about the search for remnants and modern-day ancestors of the prehistoric super croc that roamed the earth more than 60-million years ago.,99,N/A,N/A,N/A
2001,WLWT,NBC,Cincinnati,3.38,Analog,2002 WINTER OLYMPICS TORCH RELAY SPECIAL,Non-Core,Local,12/17/01 7:00pm,1,0,30,13,16,Live coverage as the 2002 Winter Olympics Torch Relay arrives in Cincinnati.,99,N/A,N/A,N/A
2001,WSTR,The WB,Cincinnati,4.5,Analog,CITY GUYS,Core,Syndicated,Monday-Friday 7:00am 10/1/01 - 12/31/01,66,0,30,13,16,"City Guys: The educational objective of this program is to demonstrate how the knowledge of one or more characters in the story moves from one level to a more informed or higher level of knowledge by the end of each episode. This change in knowledge conveys an educational message to the audience which may fall into one or more categories - intellectual-cognitive and/or socio-emotional. The message will always be integral to the plot and present throughout the script. This objective is achieved in this series by exploring the pressures of living in a big city environment where situations are sometimes so difficult and challenging, kids have to learn sophisticated and responsible decision-making to be safe and stay focused. The series follows the encounters and problem-solving of two young men through an eventful school year at Manhattan High and shows teens how to work with their principal, family and friends to be successful.",99,N/A,N/A,N/A
2001,WSTR,The WB,Cincinnati,4.5,Analog,TAMA AND FRIENDS,Core,Syndicated,Saturdays 7:00am - 10/1/01-12/31/01,13,0,30,2,6,"This animated series promotes the importance of friendship and workinng together. The program uses the characters of cats and dogs getting along as a way to reinforce tolerence and appreciation for the differences in people. The stories are ingrained with messages like the power of cooperation, the idea that perseverance pays off and that it's not what's on the outside but what's on the inside that counts.",99,N/A,N/A,N/A
