2000,WXYZ,ABC,DETROIT,4.5,ANALOG,DISNEY'S ONE SATURDAY MORNING (FEATURING LONG AND SHORT-FORM EDUCATIONAL ELEMENTS),CORE,NETWORK,SAT 8:30AM (THROUGH 12/2),9,0,120,8,12,"Disney's One Saturday Morning (Featuring Long and Short-Form Educational Elements) This two-hour program block features three half-hour educational series in combination with various short-form educational elements. The latter include ""Find Out Why"" (physical science shorts produced in association with the National Science Foundation), ""Great Minds...Think For Themselves"" (American history segments voiced by Robin Williams), ""What's My Name?"" (facts about interesting figures in world history), ""What's the Diff?"" (game segments that teach visual discrimination and analytical skills), ""Let's Go!"" (geography and cultural information segments) and ""Flyndiggery Do: Where'd It Go?"" (short segments describing animal behavior). ""Disney's Recess"" is a collection of animated stories about six fourth-grade children who attend public school. These children are an ethnically and gender-diverse group. Their experiences at Third Street School deliver messages about problems common to middle childhood: conflicts with authority figures, school and family rules, issues of fairness, peer pressure and coping with disappointment. A number of episodes revolve around class bullies or ""teacher's pets."" Series episodes provide opportunities for parent/child discussions about values. ""Disney's The Weekenders"" introduces four twelve-year-olds who have been friends since kindergarten. They attend middle school in southern California and spend time together on weekends. Their family circumstances are diverse: Tino is the only son of a single mother; Carver is the middle child in an affluent African-American family; Tish comes from an Eastern European immigrant family and Lor is the only girl among fourteen sports-minded brothers. Stories explore topics such as parent/child relations, sibling rivalry, acculturation, competition vs. compromise, responsibility, honesty, peer acceptance and loyalty. ""Disney's Teacher's Pet"" Via a magical transformation, nine-year-old Leonard Helperman's dog ""Spot"" discovers that he is able to talk and walk upright. He seizes the opportunity to fulfill a lifelong ambition: to go to school. Dressed in some of Leonard's clothes, Spot becomes ""Scott Leadready,"" reveling in the challenge of learning fourth-grade spelling, math and history. The fourth-grade teacher, Mrs. Helperman, is Leonard's mother. She is also a single parent. This series is built around the privilege of being able to attend school and value of education. Stories teach honesty, cooperation, peer team work, problem-solving, respect for rules--particularly in the school setting--and empathy. ""Spot/Scott's"" extraordinarily wide vocabulary introduces children to new vocabulary and its meaning in context.",99,N/A,N/A,N/A
2000,WXYZ,ABC,DETROIT,4.5,ANALOG,DISNEY'S DOUG,CORE,NETWORK,SAT/8AM (through 10/7/00) SAT/11:00AM(as of 10/14/00),13,7,30,8,12,"This series uses humor and fantasy in depicting a twelve-year-old boy's struggles to develop self-confidence, define identity, resolve family and school problems and maintain friendships. Narrated via the journal entries of aspiring writer/cartoonist Doug Funnie, episodes promote values such as honesty, loyalty, fairness and respect for individual differences. These stories also encourage creative writing and artistic expression.",N/A,N/A,N/A,N/A
2000,WXYZ,ABC,DETROIT,4.5,ANALOG,DISNEY'S PEPPER ANN,CORE,NETWORK,SAT/11:00AM (through 10/7/00) SAT/11:30AM  (as of 10/14/00),13,9,30,10,12,"Pepper Ann is the daughter of a single working mother. She loves math and science and hopes to some day make a name for herself in biology or medicine. Pepper Ann and her Hazelnut Middle School friends demonstrate individuality, problem solving, perseverance, responsibility and creativity. While the primary educational focus of the series is building self-esteem--particularly that of girls--stories also break down gender and ethnic stereotypes and broaden the definition of ""family.""",N/A,N/A,N/A,N/A
2000,WXYZ,ABC,DETROIT,4.5,ANALOG,THE NEW ADVENTURES OF WINNIE THE POOH,CORE,NETWORK,SAT 12PM,13,6,30,3,6,"Based on the classic ""Winnie the Pooh"" books by author A.A. Milne, ""The New Adventures of Winnie the Pooh"" depicts the everyday lives of Christopher Robin and his companions Pooh, Piglet, Rabbit, Tigger, Eeyore, Owl and Gopher. Series episodes deliver strong messages about honesty, responsibility, persistence, cooperative effort, friendship and caring. Many stories are designed to help young children distinguish between fantasy and reality and overcome common childhood fears.",N/A,N/A,N/A,N/A
2000,WXYZ,ABC,DETROIT,4.5,ANALOG,DISNEY'S RECESS,CORE,NETWORK,SAT 10:30AM THROUGH 10/7,1,1,30,8,12,"""Disney's Recess"" is a collection of animated stories about six fourth-grade children who attend public school. These children are an ethnically and gender-diverse group. Their experiences at Third Street School deliver messages about problems common to middle childhood: conflicts with authority figures, school and family rules, issues of fairness, peer pressure and coping with disappointment. A number of episodes revolve around class bullies or ""teacher's pets."" Series episodes provide opportunities for parent/child discussions about values.",N/A,N/A,N/A,N/A
2000,WXYZ,ABC,DETROIT,4.5,ANALOG,DISNEY'S THE WEEKENDERS,CORE,NETWORK,SAT 8:30AM AS OF 12/9,4,0,30,8,12,"This series introduces four twelve-year-olds that have been friends since kindergarten. They attend middle school in southern California and spend time together on weekends. Their family circumstances are diverse: Tino is the only son of a single mother; Carver is the middle child in an affluent African-American family; Tish comes from an Eastern European immigrant family and Lor is the only girl among fourteen sports-minded brothers. Stories explore topics such as parent/child relations, sibling rivalry, acculturation, competition vs. compromise, responsibility, honesty, peer acceptance and loyalty.",99,N/A,N/A,N/A
2000,WXYZ,ABC,DETROIT,4.5,ANALOG,DISNEY'S RECESS,CORE,NETWORK,SAT 9AM AS OF 12/9,4,0,30,8,12,"""Disney's Recess"" is a collection of animated stories about six fourth-grade children who attend public school. These children are an ethnically and gender-diverse group. Their experiences at Third Street School deliver messages about problems common to middle childhood: conflicts with authority figures, school and family rules, issues of fairness, peer pressure and coping with disappointment. A number of episodes revolve around class bullies or ""teacher's pets."" Series episodes provide opportunities for parent/child discussions about values.",99,N/A,N/A,N/A
2000,WXYZ,ABC,DETROIT,4.5,ANALOG,DISNEY'S RECESS,CORE,NETWORK,SAT 9:30AM AS OF 12/9,4,0,30,8,12,"""Disney's Recess"" is a collection of animated stories about six fourth-grade children who attend public school. These children are an ethnically and gender-diverse group. Their experiences at Third Street School deliver messages about problems common to middle childhood: conflicts with authority figures, school and family rules, issues of fairness, peer pressure and coping with disappointment. A number of episodes revolve around class bullies or ""teacher's pets."" Series episodes provide opportunities for parent/child discussions about values.",99,N/A,N/A,N/A
2000,WXYZ,ABC,DETROIT,4.5,ANALOG,DISNEY'S TEACHER'S PET,CORE,NETWORK,SAT 10AM AS OF 12/9,4,0,30,8,12,"Via a magical transformation, nine-year-old Leonard Helperman's dog ""Spot"" discovers that he is able to talk and walk upright. He seizes the opportunity to fulfill a lifelong ambition: to go to school. Dressed in some of Leonard's clothes, Spot becomes ""Scott Leadready,"" reveling in the challenge of learning fourth-grade spelling, math and history. The fourth-grade teacher, Mrs. Helperman, is Leonard's mother. She is also a single parent. This series is built around the privilege of being able to attend school and the value of education. Stories teach honesty, cooperation, peer teamwork, problem solving, respect for rules--particularly in the school setting--and empathy. Spot/Scott's extraordinarily wide vocabulary introduces children to new vocabulary and its meaning in context.",99,N/A,N/A,N/A
2000,WXYZ,ABC,DETROIT,4.5,ANALOG,GAME WARDEN,CORE,SYNDICATED,SAT 7AM,12,4,30,13,16,The program will take viewers inside the great outdoors with wildlife professionals around the globe. Viewers will experience the world of wildlife research and law enforcement through the eyes and hearts of the experts.,N/A,N/A,N/A,N/A
2000,WXYZ,ABC,DETROIT,4.5,ANALOG,JACK HANNA'S ANIMAL ADVENTURES,CORE,SYNDICATED,SAT 7:30AM,13,0,30,13,16,"This weekly series tours outstanding zoos and wildlife areas around the world. It provides educational information about animals, plants, and the people of the world and how they fit into the Earth's ecosystem. This program is recommended by the National Education Association.",99,N/A,N/A,N/A
2000,WXYZ,ABC,DETROIT,4.5,ANALOG,MORE THAN A GAME,CORE,SYNDICATED,SAT 11AM (TIL 11/25) & 7 (FROM 12/2),12,2,30,13,16,"This show will tell great stories giving audiences a fan's eye view of the positive side of sports, while revealing today's true sports hereos.",N/A,N/A,N/A,N/A
2000,WXYZ,ABC,DETROIT,4.5,ANALOG,ABCS KIDS' MATINEE: DISNEY'S DOUG QUAILMAN,NON-CORE,NETWORK,FRI 4:30-6AM,1,0,90,8,12,"This special uses humor and fantasy in depicting a twelve-year-old boy's struggles to develop self-confidence, define identity, resolve family and school problems and maintain friendships. Narrated via the journal entries of aspiring writer/cartoonist Doug Funnie, episodes promote values such as honesty, loyalty, fairness and respect for individual differences. These stories also encourage creative writing and artistic expression.",99,N/A,N/A,N/A
2000,WXYZ,ABC,DETROIT,4.5,ANALOG,"WINNIE THE POOH AND CHRISTMAS, TOO",NON-CORE,NETWORK,SUN 7PM (12/3),1,0,30,3,6,"Based on the classic ""Winnie the Pooh"" books by A.A. Milne, "" Winnie the Pooh and Christmas, Too "" depicts Christopher Robin and his companions Pooh, Piglet, Rabbit, Tigger, Eeyore, Owl and Gopher, dealing with holiday gift giving. Each one comes to realize that holiday happiness is derived from giving, not receiving, and that ""Being with friends is the nicest gift of all.""",99,N/A,N/A,N/A