Year,Call Sign,Network Affiliation,Nielsen DMA,Ave. # of Analog hours,Analog or Digital,Title of EI programs,Core or Non-core,Origin of Program,Regular schedule of Program,Total times aired,Number of pre-emptions,Length of Program (in minutes),Age of Target Audience From,Age of Target Audience To,Description of Program,Number of pre-emptions rescheduled,Ave. # of hours of all digital programming per week,Ave. # of hours per week of digital Core Programming per week,Y or N to Q 11 in Digital Core Programming: At least 50% of the Core Programming had not already aired within the previous seven days
2001,WADL-TV,N/A,DETROIT,3.5,ANALOG,THE MAGIC SCHOOL BUS,CORE,NETWORK,MON-FRI 2:30-3:00 PM,66,0,30,6,9,"A significant purpose of Scholastic's ""The Magic School Bus"" is to educate and inform children between 6 and 9 years of age. The educational and informational objectives of the series are to: motivate children's interest in science; introduce science ideas; inspire positive attitudes toward science and education; and model age appropriate science problem solving behavior.",99,N/A,N/A,N/A
2001,WADL-TV,N/A,DETROIT,3.5,ANALOG,SCOPE,CORE,SYNDICATED,SAT 7:30-8:00 AM,13,0,30,12,17,"This exceptional series, filmed in part at California State University, Long Beach, investigates over 200 diverse subjects from the realms of science, technology and nature through current happenings unknown to the public, as well as compelling stories of the human condition. Some of the more fascinating topics involve well-know personalities: the astonishing work of the legendary Jane Goodall with chimpanzees; the insightful revelations of astronauts John Glenn and Gene Cernin concernning their space travel experiences; the controversial stance of Dr. Craig Venter on genetic engineering; and the convictions of Dr. Richard Gott that time-travel isn't a myth. Twelve Nobel Prize winners are featured, further boosting the stature of this series.",99,N/A,N/A,N/A
2001,WADL-TV,N/A,DETROIT,3.5,ANALOG,KIDS TALK SPORTS,CORE,SYNDICATED,SAT 7:00-7:30 AM,13,0,30,13,16,"The educational objective of this program is to guide teens with the knowledge of an accomplished and sucessful adult in the world of sports. Important issues facing kids will be addressed such as competition, value of physical fitness, cheating, violence, value of education, drug abuse, etc. This show will provide a model to inspire kids/teens to meet and overcome challenges in their own lives.",99,N/A,N/A,N/A
2001,WBXD-LP,MTV2,DETROIT,3,ANALOG,ZEBBY'S ZOO,CORE,SYNDICATED,TUES 7:00-7:30 AM & 8:00-8:30 AM,26,0,30,2,6,"Zebby's Zoo follows the many adventures of Zebby the talking Zebra and his friends. Zebby's Zoo furthers the educational and informational needs of children ages 2 to 6 by introducing younger children to good values, fitness/health, basic spelling and arithmetic, along with home and neighborhood safety.",99,N/A,N/A,N/A
2001,WBXD-LP,MTV2,DETROIT,3,ANALOG,DID YOU EVER WONDER,CORE,SYNDICATED,TUES 7:30-8:00 AM,13,0,30,8,12,"Did You Ever Wonder is a ""nationally acclaimed"" children's series that furthers the educational and informational needs of children ages 8 to 12. Did You Ever Wonder provides answers to the why's and how's on a wide variety of topics such as making chocolate, cereal and paper and how computers are built.",99,N/A,N/A,N/A
2001,WBXD-LP,MTV2,DETROIT,3,ANALOG,LOVE TO TALK,CORE,SYNDICATED,TUES 8:30-10:00 AM,13,0,90,12,16,"Love To Talk furthers the educational and informational needs of children ages 12 to 16 by focusing on the many problems encountered by young teens and pre-teens. This ""Larry King"" type television talk show is hosted by Robert Holt of L.O.V.E. (Let Our Violence End), an Arkansas based intervention and prevention organization that has developed a nationwide reputation for reaching out to teens. Love To Talk mediated calls from teens, parents, and educators and includes topics such as teen sex, relationships, drugs and alcohol, teen pregnancy, racism and numerous other topics that directly affects the young people of today.",99,N/A,N/A,N/A
2001,WDIV,NBC,DETROIT,3,ANALOG,CITY GUYS,CORE,NETWORK,SAT 10:00-10:30 AM,13,0,30,13,16,"""City Guys"" originates at a densely populated, multi-ethnic public high school in the heart of Manhattan. Through its characters the show demonstrates that what we see doesn't begin to tell the story about who people really are and what life is really like. Two young men who seem to be opposites in all the obvious ways - race, economic background, culture, clothes and music - are thrown into a friendship and working relationship by their wise and acerbic principle. The boys actually have a lot in common - they are both bright, they want to be more than the negative images they sometimes project, and they have never been motivated to really think, reflect, or act beyond the superficial. As they deal with the pressures of big city life, they learn that getting beyond the superficial and seriously dealing with a deeper reality is the critical path to attaining success",99,N/A,N/A,N/A
2001,WDIV,NBC,DETROIT,3,ANALOG,ALL ABOUT US,CORE,NETWORK,SAT 10:30-11:00 AM,13,0,30,13,16,"""All About Us"" focuses on the development of four teen girls who live and attend high school in Chicago. They come from very different family backgrounds, and have different strengths, but share a bond of friendship. Their different talents, perspectives, and family experiences become the platform for illustrating alternative approaches to understanding and solving problems. The overarching goal of the series is to model a learning experience for the audience, where the primary character goes from one state of knowledge to another, higher state of knowledge by the end of the episode. Each week, embedded in the story narrative, a lesson is presented to the audience that relates specifically to teen concerns. Topics include interracial understanding, using compromise to avoid negative conflict, effective communication with parents, the hazards of risk-taking, saying ""no"" to peer pressure, and using logic to solve your problems.",99,N/A,N/A,N/A
2001,WDIV,NBC,DETROIT,3,ANALOG,JUST DEAL,CORE,NETWORK,SAT 11:00-11:30 AM,13,0,30,13,16,"""Just Deal"" focuses on the development of three teens who are uniquely different from one another yet forge deep bonds of friendship through their shared interests and problems. As these three navigate their way through high school, they will deal with all the important issues of adolescence, modeling their problem-solving and decision-making for the teen audience. The overarching goal of this series is to take the viewer from one level of knowledge to a more informed or higher level of knowledge within each episode. Topics include racial identity, understanding and accepting loss, facing failure, effective communication, conflict management, personal responsibility, service to others, trust and betrayal, academic achievement, life balance, and tolerance.",99,N/A,N/A,N/A
2001,WDIV,NBC,DETROIT,3,ANALOG,SKATE,CORE,NETWORK,SAT 11:30-12:00PM 10/6-11/17; 12:00-12:30 PM 11/24-12/29 (A) SEE QUESTION #11,13,0,30,13,16,"This show focuses on the overarching challenge of teens -- accepting the reality that they must develop a sense of personal responsibility and life purpose even though they will always be tested to embrace a culture of bravado and risk. The main character in this show is academically gifted but he is also trying to become accepted as a radical skater. With his friends, his father, and a variety of other characters who have some impact on his life, our lead shows us how hard it is to be successful in more than one way. The characters come from diverse family situations. Our main character and his father model a trusting and communicative relationship even through very difficult situations. Each week, the story takes the audience from one level of knowledge to another as the main character and his friends learn how to establish priorities, become professional about their work, and develop a good sense of judgment about people and situations.",99,N/A,N/A,N/A
2001,WDIV,NBC,DETROIT,3,ANALOG,CITY GUYS,CORE,NETWORK,SAT 12:00-12:30 PM 10/6-11/17; 11:30-12:00 PM 11/24-12/29 (A) SEE QUESTION #11,13,0,30,13,16,"""City Guys"" originates at a densely populated, multi-ethnic public high school in the heart of Manhattan. Through its characters the show demonstrates that what we see doesn't begin to tell the story about who people really are and what life is really like. Two young men who seem to be opposites in all the obvious ways - race, economic background, culture, clothes and music - are thrown into a friendship and working relationship by their wise and acerbic principle. The boys actually have a lot in common - they are both bright, they want to be more than the negative images they sometimes project, and they have never been motivated to really think, reflect, or act beyond the superficial. As they deal with the pressures of big city life, they learn that getting beyond the superficial and seriously dealing with a deeper reality is the critical path to attaining success.",99,N/A,N/A,N/A
2001,WDIV,NBC,DETROIT,3,ANALOG,NBA INSIDE STUFF,CORE,NETWORK,SAT 12:30-1:00 PM,13,0,30,13,16,"This program is a 30 minute news magazine about the players and programs of the NBA. The show features players and coaches in a variety of short segments that communicate a point of view or reveal new information to the audience. The information might be about the game of basketball or it might show another side of the players' lives. Every week the audience sees examples of individual players and the NBA organization in civic endeavors. In some segments specific questions from the audience on topics ranging from developing specific athletic skills to dealing with personal problems are answered by a player. Each episode of the program offers content stressing the value of practice, hard work, and professionalism as a way to achieve one's goals.",99,N/A,N/A,N/A
2001,WDWB,WB,DETROIT,3,ANALOG,SHERLOCK HOLMES IN THE 22ND CENTURY,CORE,SYNDICATED,SAT 12:00-12:30 PM  ,13,0,30,6,11,"Sherlock Holmes in the 22nd Century was designed to build problem solving and informational management skills and to model the pro-social values and behaviors associated with enduring friendships and effective teamwork. Themes are illustrated in each episode which also demonstrate fundamental principles of gathering, evaluating and interpreting information and using it to imagine, present and test plausible scenarios. The intent is to motivate children to see critical thinking and team problem solving as exciting, fun and within their capacity.",99,N/A,N/A,N/A
2001,WDWB,WB,DETROIT,3,ANALOG,CITY GUYS,CORE,SYNDICATED,MON-FRI 7:00-7:30 AM,67,1,30,13,16,"City Guys follows the encounters and problem solving of five teenagers, and the guiding hand of their understanding, but tough, principal. By the end of the episode they have moved to another level of understanding and decision making skills. The message is always integral to the plot and present throughout the episode. This show was developed to focus on the learning process of teenagers about the realities of life and that those actions have consequences.",1,N/A,N/A,N/A
2001,WDWB,WB,DETROIT,3,ANALOG,KEYS KIDS,NON-CORE,LOCAL,SUN 5:30-6:00 AM,13,0,30,7,12,"KEYS Kids is a locally produced show. The letters of the program title stand for [K]Kids [E]Enjoy [Y]Your [S]Selves without drugs. The show asks children and their families to look for alternatives to behaviors that can hurt them. Many episodes cover fitness, self-esteem, the importance of education, etc. KEYS Kids is designed to entertain and educate using life-sized puppet characters to teach young people and their families about the importance of living a happy, healthy and drug free life - confident in who they are.",99,N/A,N/A,N/A
2001,WDWB,WB,DETROIT,3,ANALOG,AMERICAN ATHLETE,NON-CORE,SYNDICATED,FRI 5:00-5:30 AM,13,0,30,12,16,"American Athlete was developed to extend the educational and informational needs of teens through the celebration of athletics. Each week successful sports figures share messages of good sportsmanship, the importance of higher education, goal setting, commitment, hard work, family support and family members as role models. The show also touts team work and achievement for young people in all that they attempt.",99,N/A,N/A,N/A
2001,WDWO-LP,N/A,DETROIT,10.5,ANALOG,BED BUG BIBLE GANG,CORE,NETWORK,SAT 7:00-7:30 AM,12,1,30,4,9,"Through the use of computer animation, cartoons and puppets, the program teaches simple Biblical Stories and values as well as other educational elements, such as learning about animals, how things work, recognizing similarites and counting skills.",0,N/A,N/A,N/A
2001,WDWO-LP,N/A,DETROIT,10.5,ANALOG,LIFT JESUS HIGHER,CORE,NETWORK,SAT 7:30-8:00 AM,12,1,30,2,10,This live action variety series educates and informs children how to make important life choices based on Biblical primcipals.,0,N/A,N/A,N/A
2001,WDWO-LP,N/A,DETROIT,10.5,ANALOG,KINGSLEY'S MEADOW,CORE,SYNDICATED,SAT 8:00-8:30 AM,12,1,30,2,10,"This live action animated variety series educates and informs children of values, virtues and morals through the teaching of bible stories.",0,N/A,N/A,N/A
2001,WDWO-LP,N/A,DETROIT,10.5,ANALOG,FAITHVILLE,CORE,SYNDICATED,SAT 8:30-9:00 AM,12,1,30,7,12,"Through this live action program, children are taught how to apply Biblical principals to their lives. The characters also model correct moral behavior and demonstrate the consequencea of making poor choices.",0,N/A,N/A,N/A
2001,WDWO-LP,N/A,DETROIT,10.5,ANALOG,DISCOVERY JONES,CORE,NETWORK,SAT 9:00-9:30 AM,12,1,30,8,12,"In this live action program, children are informed and educated about different regions, different professions and making important life choices.",0,N/A,N/A,N/A
2001,WDWO-LP,N/A,DETROIT,10.5,ANALOG,GOSPEL BILL,CORE,NETWORK,SAT 9:30-10:00 AM,12,1,30,6,12,"Through this live action program, children are educated and informed about positive social skills and making important choices based on Biblical principals.",0,N/A,N/A,N/A
2001,WDWO-LP,N/A,DETROIT,10.5,ANALOG,SWAMP CRITTERS,CORE,NETWORK,SAT 10:00-10:30 AM,12,1,30,3,10,"In this live action series featuring life size puppets and songs, children are informed and educated of the immportance of making good decisions based on moral values.",0,N/A,N/A,N/A
2001,WDWO-LP,N/A,DETROIT,10.5,ANALOG,THE REPPIES,CORE,NETWORK,SAT 10:30-11:00 AM,11,2,30,6,12,"In this live action program featuring life size puppets and songs, children are informed and educated about the decision making process of the important and sometimes difficult choices that children encounter.",0,N/A,N/A,N/A
2001,WDWO-LP,N/A,DETROIT,10.5,ANALOG,WORSHIP FOR KIDS,CORE,NETWORK,SAT 11:00-11:30 AM,12,1,30,4,8,"In this live action variety series, children are educated and informed of how to apply Christian values to situations in everyday life.",0,N/A,N/A,N/A
2001,WDWO-LP,N/A,DETROIT,10.5,ANALOG,KIDS LIKE YOU,CORE,SYNDICATED,SAT 11:30-12:00 PM  ,12,1,30,6,12,"In this live action variety program, children are educated and informed of a positive and energetic approach to behavorial and moral issues.",0,N/A,N/A,N/A
2001,WDWO-LP,N/A,DETROIT,10.5,ANALOG,AL DENSON,NON-CORE,SYNDICATED,SAT 11:00 PM EST/ADDITIONAL SCHEDULE M-F 5:00 PM & 5:30 PM,52,21,30,12,18,"Through interviews and musical performances, Al Denson and his guests discuss how to successfully face everyday challenges using Biblical principals.",N/A,N/A,N/A,N/A
2001,WDWO-LP,N/A,DETROIT,10.5,ANALOG,CUTTING EDGE VIDEO,NON-CORE,SYNDICATED,SAT 11:30-12:00 AM,12,1,30,13,18,"Through this mix of live action and music videos, teens are taught strong moral values and positive Christian behavior",N/A,N/A,N/A,N/A
2001,WDWO-LP,N/A,DETROIT,10.5,ANALOG,THE ZONE,NON-CORE,SYNDICATED,SUN 12:00-12:30 AM,12,1,30,13,18,"Through this live action program, audience members are challenged to consider addressing important moral choices using Christian values.",N/A,N/A,N/A,N/A
2001,WDWO-LP,N/A,DETROIT,10.5,ANALOG,ACTION HOUSE TV,NON-CORE,SYNDICATED,SUN 12:30-1:00 AM,12,1,30,13,18,"Through interviews and music videos, the audience learns how contemporary Christian singers have faced difficult challenges in their lives and relying on Biblical principals, come through them successfully.",N/A,N/A,N/A,N/A
2001,WDWO-LP,N/A,DETROIT,10.5,ANALOG,CONTACT 29:18,NON-CORE,SYNDICATED,SUN 1:00-1:30 AM,12,1,30,14,18,"Through interviews and music videos, Christians demonstrate how they have successfully overcome life's challenges using Biblical principals.In this fast paced documentary, teens are encouraged to examine their lives and consider their future.",N/A,N/A,N/A,N/A
2001,WDWO-LP,N/A,DETROIT,10.5,ANALOG,THE SEARCH,NON-CORE,NETWORK,11:00 PM EST SAT 9/29/01 (PRE-EMPTED VIRTUAL MEMORY),1,0,30,13,17,"In this movie, teen viewers are challenged to review their lives and consider their future.",99,N/A,N/A,N/A
2001,WJBK,FOX,DETROIT,3.5,ANALOG,KEEPING IT WILD,CORE,SYNDICATED,SAT 7:00-7:30 AM,13,0,30,13,16,"Describe the educational and informational objective of the program and how it meets the definition of Core Programming. The key educational objective of program is to create awareness and understanding of animals, and their interaction with their particular environment. A theme throughout this series will be the importance of protecting endangered species and the impact of human interacting with their environment and the need to protect their natural habitats. Specific experts will provide educational information related to animal behavior. Children will learn about various wild life as it relates to our planet and hopefully will make a conscious effort to support the efforts to protect endangered species ant to have a greater understanding of individual animal behavior.",99,N/A,N/A,N/A
2001,WJBK,FOX,DETROIT,3.5,ANALOG,GAME WARDEN: WILDLIFE JOURNAL,CORE,SYNDICATED,SAT 10:00-10:30 AM,13,0,30,13,16,"Describe the educational and informational objective of the program and how it meets the definition of Core Programming. ""Game Warden: Wildlife Journal"" will utilize the national parks, wildlife sanctuaries, forest preserves and our vast waterways as the backdrop for its stories about the Game Wardens and their duties, which also inclde, safety regulations for boats, snowmobiles, all terrain vehicles, and responding to emergencies such as, toxic and hazardous material spills, and natural disasters.",99,N/A,N/A,N/A
2001,WJBK,FOX,DETROIT,3.5,ANALOG,WILD ABOUT ANIMALS,CORE,SYNDICATED,"SAT 11:00-11:30 AM OTO 10/6, 12:30-1:00 PM EFF 10/13 UFN, 10:30-11:00 AM OTO 12/15",13,0,30,8,16,"Describe the educational and informational objective of the program and how it meets the definition of Core Programming. ""Wild About Animals"" is a weekly show designed to educate and inform chilcren by bringing them the most entertaining and interesting stories about the world's most fascinating animals. Each show consisting of at least four (4) or more stories which are designed to teach children about exotic and unique animals from the wild, as well to educate them further about animals they see everyday.",99,N/A,N/A,N/A
2001,WJBK,FOX,DETROIT,3.5,ANALOG,AWESOME ADVENTURES,CORE,SYNDICATED,SAT 11:30-12:00 PM,13,0,30,13,16,"Describe the educational and informational objective of the program and how it meets the definition of Core Programming. ""Awesome Adventures"" is designed to educate, inform and entertain children 13 to 16 years of age about the world around them. Each journey is a lesson in the beauty of nature, its creatures, and the people who inhabit the land. The shows are not designed to be ""preachy"" or overly pedantic, but rather the goal is to make the learning fun. The show is hosted by A.T. Montgomery.",99,N/A,N/A,N/A
2001,WJBK,FOX,DETROIT,3.5,ANALOG,NFL: UNDER THE HELMET,CORE,NETWORK,SAT 12:00-12:30 PM,13,0,30,13,16,"Describe the educational and informational objective of the program and how it meets the definition of Core Programming. ""NFL:Under the Helmet"" showcases the pro-social on and off the field activities aof the NFL's leading players and coaches. Working with the National Association for Sports and Physical Education, the program (1) educates teens about dedication, hard work, teamwork, goal setting and community service, (2) provides examples of responsible social and personal behavior, (3) demonstrates how to deal constructively with the differences among people and (4) teaches the benefits of physical activity and fitness.",99,N/A,N/A,N/A
2001,WJBK,FOX,DETROIT,3.5,ANALOG,THIS WEEK IN BASEBALL,CORE,NETWORK,SAT 12:30-1:00 PM OTO 10/6,1,0,30,13,16,"Describe the educational and informational objective of the program and how it meets the definition of Core Programming. ""This Week in Baseball"" highlights the pro-social on-and-off the field activities of MLB's leading players and coaches. Working with the National Association for Sport and Physical Education (NASPE), ""This Week in Baseball"" seeks to provide today's youth with educational messages that can have an impact on development of positive lifestyle behaviors. The program portrays the positive outcomes that result from dedication, hard work, self-discipline, teamwork, practice and personal responsibilities. The program also relates the achievements and experiences of baseball players to potential achievements in life.",99,N/A,N/A,N/A
2001,WJBK,FOX,DETROIT,3.5,ANALOG,WILD MOMENTS,CORE,SYNDICATED,"SAT 1:00-1:30 PM EFF 10/20 UFN, 11:00-11:30 AM OTO 12/15",11,0,30,13,16,"Describe the educational and informational objective of the program and how it meets the definition of Core Programming. ""Wild Moments"" show naturalist Jack Hubley and his faithful dog, Trusty, will trek through fields, forests, lakes and mountain solving mysteries of animal life and survival in the wild. ""Wild Moments"" will offer viewers the oppurtunity to learn about lfiestyles and habitats of an incredible array of mammals, birds, reptiles fish and insects - from outside their doorstep to the wild country beyond. Children will be made aware of the importance of conservation and its impact on the environment and animal diversity.",99,N/A,N/A,N/A
2001,WJBK,FOX,DETROIT,3.5,ANALOG,THE PET SHOP,CORE,SYNDICATED,SUN 7:00-7:30 AM,13,0,30,13,16,"Describe the educational and informational objective of the program and how it meets the definition of Core Programming. ""The Pet Shop"" is an engaging program for teens and their families. The knowledgeable content of Host Marc Monroe and his wonderful menagerie of animal friends will also capture the attention of younger children. Information is practical, lively and presented at just the right pace. It is an especially nice touch to see that this un-scripted program part neighborly chat and part animal kingdom offers unique advice and helpful tips on anything from housebreaking a puppy to supplementing a lizard's diet. There is a great amount to learn from animals, particularly the pets that so closely share our lives.",99,N/A,N/A,N/A
2001,WJBK,FOX,DETROIT,3.5,ANALOG,WILD ABOUT ANIMALS,NON-CORE,SYNDICATED,SUN 6:00-6:30 AM OTO 10/14,1,0,30,13,16,"Describe the educational and informational objective of the program and how it meets the definition of Core Programming. ""Wild About Animals"" is a weekly show designed to educate and inform chilcren by bringing them the most entertaining and interesting stories about the world's most fascinating animals. Each show consisting of at least four (4) or more stories which are designed to teach children about exotic and unique animals from the wild, as well to educate them further about animals they see everyday.",99,N/A,N/A,N/A
2001,WKBD,UPN,DETROIT,3.5,ANALOG,DISNEY'S RECESS,CORE,NETWORK,MON-FRI 4:30-5:00 PM,66,0,30,7,10,"The program features an animated cast of fourth-graders who often prove that some of the most important lessons are learned not on the blackboard but on the blacktop. The cast's teacher tries to infuse her students with a positive approach to learning. The kids are taught how to contend with the harsh world out there, how to be a friend, and how to stand up for themselves and others.",99,N/A,N/A,N/A
2001,WKBD,UPN,DETROIT,3.5,ANALOG,DISNEY'S RECESS,CORE,NETWORK,SUN 9:30-10:00 AM,13,0,30,7,10,"The program features an animated cast of fourth-graders who often prove that some of the most important lessons are learned not on the blackboard but on the blacktop. The cast's teacher tries to infuse her students with a positive approach to learning. The kids are taught how to contend with the harsh world out there, how to be a friend, and how to stand up for themselves and others.",99,N/A,N/A,N/A
2001,WKBD,UPN,DETROIT,3.5,ANALOG,TAMA AND FRIENDS,CORE,SYNDICATED,SAT 8:00-8:30 AM,13,0,30,5,9,This program consists of animated adventures that encourage learning and acceptance. The program uses the premise of cats and dogs getting along as a way to reinforce tolerance and appreciation for the differences in people. The show's theme offers a strong foundation for kids that promotes the concepts of cooperation and perseverance. The importance of friendship is consistent throughout every episode.,99,N/A,N/A,N/A
2001,WPXD,PAX TV,DETROIT,3,ANALOG,MIRACLE PETS,CORE,NETWORK,SAT 5:00-6:00 PM (10/6-10/13),2,0,60,13,16,"Miracle Pets is a one (1) hour live-action program designed to meet the educational and informational needs of children between the ages of 13 and 16. Each episode explores different short re-enactments of pets/animals doing heroic, extraordinary actions. Children learn positive role models, pro-social values and the importance of taking care of the pets in thier lives.",99,N/A,N/A,N/A
