2001,WPXD,PAX TV,DETROIT,3,ANALOG,MIRACLE PETS,CORE,NETWORK,MON 8:00-9:00 PM (10/15-11/26),7,0,60,13,16,"Miracle Pets is a one (1) hour live-action program designed to meet the educational and informational needs of children between the ages of 13 and 16. Each episode explores different short re-enactments of pets/animals doing heroic, extraordinary actions. Children learn positive role models, pro-social values and the importance of taking care of the pets in thier lives.",99,N/A,N/A,N/A
2001,WPXD,PAX TV,DETROIT,3,ANALOG,MIRACLE PETS,CORE,NETWORK,SAT 5:00-6:00 PM (12/8-12/15),2,0,60,13,16,"Miracle Pets is a one (1) hour live-action program designed to meet the educational and informational needs of children between the ages of 13 and 16. Each episode explores different short re-enactments of pets/animals doing heroic, extraordinary actions. Children learn positive role models, pro-social values and the importance of taking care of the pets in thier lives.",99,N/A,N/A,N/A
2001,WPXD,PAX TV,DETROIT,3,ANALOG,MIRACLE PETS,CORE,NETWORK,MON 8:00-9:00 PM (12/17-12/31),3,0,60,13,16,"Miracle Pets is a one (1) hour live-action program designed to meet the educational and informational needs of children between the ages of 13 and 16. Each episode explores different short re-enactments of pets/animals doing heroic, extraordinary actions. Children learn positive role models, pro-social values and the importance of taking care of the pets in thier lives",99,N/A,N/A,N/A
2001,WPXD,PAX TV,DETROIT,3,ANALOG,JUST DEAL,CORE,NETWORK,SUN 4:00-4:30 PM (10/7-12/30),13,0,30,13,16,"Just Deal is a half-hour live-action program, designed to meet the educational and informational needs of children between the ages of 13 and 16. The show focuses on the development of three teens who are uniquely different from one another, yet forge deep bonds of friendship through their shared interests and problems. As these three navigate their way through high school, they will deal with all the important issues of adolescence, modeling their problem-solving and decision-making for the teen audience. Topics include racial identity, understanding and accepting loss, facing failure, effective communication, conflict management, personal responsibility, service to others, trust and betrayal, academic achievement, life balance and tolerance",99,N/A,N/A,N/A
2001,WPXD,PAX TV,DETROIT,3,ANALOG,CALIFORNIA DREAMS,CORE,NETWORK,SUN 4:30-5:00 PM (10/7-12/30),13,0,30,13,16,"California Dreams is a half-hour live-action program designed to meet the educational and informational needs of children between the ages of 13 and 16. The show revolves around students at Pacific Coast High School and deals with such topics as relationships, positive self-image and outlook, leadership, service to others, fair play, acceptable behavior, reputation and consequences for one's actions. The audience will relate to the struggles and tribulations the students go through at home, at school and in their personal relationships",99,N/A,N/A,N/A
2001,WPXD,PAX TV,DETROIT,3,ANALOG,MIRACLE PETS,CORE,NETWORK,SUN 5:00-6:00 PM (10/7-12/30),13,0,60,13,16,"Miracle Pets is a one (1) hour live-action program designed to meet the educational and informational needs of children between the ages of 13 and 16. Each episode explores different short re-enactments of pets/animals doing heroic, extraordinary actions. Children learn positive role models, pro-social values and the importance of taking care of the pets in thier lives.",99,N/A,N/A,N/A
2001,WWJ,CBS,DETROIT,3,ANALOG,OSWALD,CORE,NETWORK,"SAT 7:00-7:30 AM (THRU 12/1. BEGINNING 12/9, MOVED TO SUN 7:30-8:00 AM)",13,0,30,2,5,"This series follows the adventures of Oswald, an animated octopus who experiences the world as a pre-school child would. Oswald meets his challenges by talking to his friends, listening to their advice, but coming up with his own answers. This program helps children build friendships, learn new physical skills and begin to understand their own perspectives. It also teaches tolerance, civility, problem-solving and cooperation.",99,N/A,N/A,N/A
2001,WWJ,CBS,DETROIT,3,ANALOG,DORA THE EXPLORER,CORE,NETWORK,SAT 7:30-8:00 AM,13,0,30,2,5,"In this series seven-year-old Dora and her monkey travel companion, Boots, invite the audience to join them each week on a journey in which they will have to overcome various obstacles to reach an end goal. The series uses a CD-ROM/on-line adventure game format to encourage a variety of problem-solving strategies. The objectives of this program are to assist children in developing their problem-solving skills, reinforce their emerging cognitive skills, and make computers more familiar to them by introducing and using the conventions and vocabulary of computer games.",99,N/A,N/A,N/A
2001,WWJ,CBS,DETROIT,3,ANALOG,BLUE'S CLUES,CORE,NETWORK,SAT 8A:00-8:30 AM,13,0,30,2,5,"In this series, a young adult host - together with Blue, a puppy whose personality and actions mirror those of a preschooler - brings viewers a variety of games, themes and concepts that are based on an age-appropriate educational curriculum. The program follows a narrative format, in which the host elicits contributions from the viewer to answer questions and move the action forward. The program's objectives include encouraging preschoolers to actively explore the world around them, fostering their problem-solving skills and independent reasoning, and creating a foundation of confidence and optimism for future learning.",99,N/A,N/A,N/A
2001,WWJ,CBS,DETROIT,3,ANALOG,LITTLE BILL,CORE,NETWORK,SAT 8:30-9:00 AM,13,0,30,2,5,"This is an animated series based on children's books written by Bill Cosby that examines life through the eyes of a five-year-old boy eager to understand his world. Each episode contains two stories in which ""Little Bill"" is faced with a challenge or problem - whether emotional, social or physical - he must solve. The objectives of this series are to encourage children to value themselves and the love and support of their family, friends and community, and to help them develop their social skills and ethical values by dealing with the conflicts in their lives with fairness and creativity.",99,N/A,N/A,N/A
2001,WWJ,CBS,DETROIT,3,ANALOG,FRANKLIN,CORE,NETWORK,SUN 7:00-7:30 AM,13,0,30,2,5,"Based on a series by Paulette Bourgeois and Brenda Clark, this program features the adventures of the turtle ""Franklin"" and his friends Bear, Snail, Rabbit and Goose. The objectives of the program are to present to young viewers age-appropriate moral dilemmas addressing issues such as the meaning of right and wrong, the purposes of rules and the consequences of following or not following them, and the values inherent in telling the truth, and to teach viewers important social values such as cooperation and compromise, fairness, responsibility, self-respect and respect for others.",99,N/A,N/A,N/A
2001,WWJ,CBS,DETROIT,3,ANALOG,BOB THE BUILDER,CORE,NETWORK,"SUN 7:30-8:00 AM (THRU 12/2. BEGINNING 12/8, MOVED TO SAT 7:00-7:30 AM)",13,0,30,2,5,"This series presents episodes centered around Bob, a friendly builder, and his talking machines, and follows their adventures as they work on a variety of construction projects. Bob's machines have minds of their own and act like a gang of lively children, exhibiting traits to which a young audience will relate. The objective of the program is to provide an opportunity for preschool children to explore and learn about issues such as fears, sharing, shyness, team work, self-esteem and cooperation, which are critical to their early development. This program is specifically designed to further the educational and informational needs of children, has educating and informing children as a significant purpose, and otherwise meets the definition of Core Programming as specified in the Commission's rules.",99,N/A,N/A,N/A
2001,WXYZ,ABC,DETROIT,4.5,ANALOG,DISNEY'S TEACHER'S PET,CORE,SYNDICATED,SAT 8:00-9:30 AM ET (THRU 12/8); 8:30-9:00 AM (AS OF 12/15),13,0,30,8,12,"Via a magical transformation, nine-year-old Leonard Helperman's dog ""Spot"" discovers that he is able to talk and walk upright. He seizes the opportunity to fulfill a lifelong ambition: to go to school. Dressed in some of Leonard's clothes, Spot becomes ""Scott Leadready"", reveling in the challenge of learning fourth-grade spelling, math and history. The fourth grade teacher, Mrs. Helperman, is Leonard's mother. She is a single parent. This series celebrates the privilege of being able to obtain an education. Stories teach honesty, cooperation, team work, resourcefulness, respect for rules (particularly in the school setting) and empathy. ""Spot/Scott's"" wide vocabulary exposes the audience to new vocabulary, used in context.",99,N/A,N/A,N/A
2001,WXYZ,ABC,DETROIT,4.5,ANALOG,DISNEY'S LLOYD IN SPACE,CORE,NETWORK,SAT 8:30-9:00 AM ET (THRU 12/8); SAT 11:00-11:30 AM (AS OF 12/15),13,0,30,8,12,"""Lloyd in Space"" is the story of an alien boy who attends Middle School in a galaxy far away. His mother, Nora, is the commander of the space station in Intrepidville, where Lloyd, his six-year-old sister Francine and his three buddies, Eddie, Kurt and Douglas live. Nora is a single parent. Many of the stories are set at school and invlove peer and friendship issues as well as school rules, procedures and authority conflicts. Episodes are designed to teach values, problem-solving, responsibility (as in a story about Lloyd's babysitting his younger sister, who runs away when he becomes overbearing, and several stories about taking responsibility for pets), and goal setting.",99,N/A,N/A,N/A
2001,WXYZ,ABC,DETROIT,4.5,ANALOG,DISNEY'S RECESS,CORE,NETWORK,SAT 9:00-9:30 AM,13,0,30,8,12,"""Disney's Recess"" is a collection of stories about six fourth-grade children who attend public school. These children are an ethnically diverse and gender-diverse group. Their experiences at Third Street School deliver messages about problems common to middle childhood: conflicts with authority figures, school and family rules, issues of fairness, peer pressure and coping with disappointment. A number of episodes revolve around class bullies or conflicts with teachers' favored students. Series episodes provide opportunities for parent/child discussions about values.",99,N/A,N/A,N/A
2001,WXYZ,ABC,DETROIT,4.5,ANALOG,DISNEY'S RECESS,CORE,NETWORK,SAT 9:30-10:00 AM,13,0,30,8,12,"""Disney's Recess"" is a collection of stories about six fourth-grade children who attend public school. These children are an ethnically diverse and gender-diverse group. Their experiences at Third Street School deliver messages about problems common to middle childhood: conflicts with authority figures, school and family rules, issues of fairness, peer pressure and coping with disappointment. A number of episodes revolve around class bullies or conflicts with teachers' favored students. Series episodes provide opportunities for parent/child discussions about values.",99,N/A,N/A,N/A
2001,WXYZ,ABC,DETROIT,4.5,ANALOG,LIZZIE MCGUIRE,CORE,NETWORK,SAT 10:00-10:30 AM,13,0,30,9,12,"""Lizzie McGuire"" is the story of an ingenious twelve-year-old girl who attends an ethnically diverse middle school. Her best friends are Miranda, a feisty Hispanic girl, and a boy named Gordo. Lizzie has a gifted younger brother who is frequently the source of conflict. Their parents handle their children's crises with humor and affection. Stories are realistic, revolving around school issues, rules, peer pressure, the struggle to find a comfortable identify, trust, facing one's mistakes, and the emotional ups-and-downs of pre-adolescence. Particular strengths of this series are its believability and the creation of a live action series that features a strong, positive girl in the lead role.",99,N/A,N/A,N/A
2001,WXYZ,ABC,DETROIT,4.5,ANALOG,EVEN STEVENS,CORE,NETWORK,SAT 10:30-11:00 AM,13,0,30,9,12,"""Even Stevens"" explores the day-to-day interaction between seventh grader Louis, a bright and unconventional boy, his eighth grade sister Ren, whose straight-A average and mature manner belie her vulnerability, and his two best friends. Louis is naturally funny and spontaneous. He is often the instigator of a prank or scheme-much to the embarrassment of his older sister. Ren's brains and superior organizational skills often make Louis feel clumsy and inadequate by comparison. They are loyal and loving siblings, although each marches to a very different beat. ""Even Stevens"" episodes are highly kid-relatable, focusing on family and brother-sister conflicts, responsibility, fairness, competition, goal-setting, self-esteem, problems with schoolmates and parent-child interaction.",99,N/A,N/A,N/A
2001,WXYZ,ABC,DETROIT,4.5,ANALOG,"SABRINA, THE ANIMATED SERIES",CORE,NETWORK,SAT 11:00-11:30 AM (THRU 10/13),2,0,30,8,12,"Twelve-year-old Sabrina Spellman, who is half witch and half mortal, is being raised in a non-traditional family consisting of her Uncle Quigley and two young aunts. Series episodes explore social and developmental issues such as peer pressure/competition, loyalty and friendship, responsibility, honesty, facing fears, speaking up for one's beliefs, etc. Family issues such as divorce, remarriage and household rules are also addressed.",99,N/A,N/A,N/A
2001,WXYZ,ABC,DETROIT,4.5,ANALOG,DISNEY'S THE WEEKENDERS,CORE,NETWORK,SAT 11:30-12:00 PM,8,7,30,9,12,"""The Weekenders"" introduces four twelve-year-olds who have been friends since kindergarten. They attend middle school in southern California and spend time together on weekends. Their family circumstances are diverse: Tino is the only son of a single mother, Carver is the middle child in an affluent African American family, Tish comes from an Eastern European immigrant family and Lor is the only girl among fourteen sports-minded brothers. Stories explore such topics as parent/child relations, sibling rivalry, acculturation, competition vs. compromise, responsibility, honesty, peer acceptance and loyalty.",5,N/A,N/A,N/A
2001,WXYZ,ABC,DETROIT,4.5,ANALOG,THE NEW ADVENTURES OF WINNIE THE POOH,CORE,NETWORK,SAT 12:00-12:30 PM,6,7,30,3,6,"Based on the classic ""Winnie the Pooh"" books by author A.A. Milne, ""The New Adventures of Winnie the Pooh"" depicts the everyday lives of Christopher Robin and his companions Pooh, Piglet, Rabbit, Tigger, Eeyore, Owl and Gopher. Series episodes deliver strong messages about honesty, responsibility, persistence, cooperative effort, friendship and caring. Many stories are designed to help young children distinguish between fantasy and reality and overcome common childhood fears. (*Note-10/20/01 episode was partially pre-empted for live breaking ABC News coverage of a briefing at the Pentagon)",2,N/A,N/A,N/A
2001,WXYZ,ABC,DETROIT,4.5,ANALOG,MARY-KATE AND ASHLEY IN ACTION,CORE,NETWORK,SAT 11:00-11:30 AM ET (AS OF 10/20); SAT 8:00-8:30 AM (AS OF 12/15),11,0,30,9,11,"""Mary-Kate and Ashley in Action"" features two well-known, real-life siblings in a fanciful scenario. They play actors performing roles in a weekly movie about two young special agents whose adventures take them all over the world. Their sister ""team"" relationship is one in which cooperation, logical deduction, inventiveness and humor triumph. Mary-Kate and Ashley's friendship with a fellow team member, Chinese-American sicteen-year-old Rod Choi, is a close one, as is their relationship with Hispanic team member Ivan Quintero. Ivan is extremely gifted at technical and mathematical matters; his electronic inventions are a great asset to the team. In addition to problem-solving strategies each episode teaches children values such as honesty, perseverence, kindness and respect for differences. As girls engaged in active, adventurous stories Mary-Kate and Ashley Olsen are particularly good role models for our school-aged audience.",99,N/A,N/A,N/A
2001,WXYZ,ABC,DETROIT,4.5,ANALOG,CHICKEN SOUP FOR THE SOUL,CORE,SYNDICATED,SAT 7:00-7:30 AM,13,0,30,13,16,"Based on the award winning series of books, the television series, dramatizes true-life stories of real people who meet life challenges with hope, determination and ingenuity. The program consists of a series of individual stories that present believable characters with specific dilemmas which unfold as characters work through the problems to realistic solutions. The objectives of the program are to provide 13 to 16 year old viewers with examples of young people in modern situations that involve action choices, to identify and select positive alternatives when facing personal, interpersonal and social dilemmas, and to teach young people that commitment and personal effort make it possible to be better people.",99,N/A,N/A,N/A
2001,WXYZ,ABC,DETROIT,4.5,ANALOG,JACK HANNA'S ANIMAL ADVENTURES,CORE,SYNDICATED,SAT 7:30-8:00 AM,13,0,30,13,16,"Jack Hanna's Animal Adventures is a live action program designed to meet the educational and informational needs of children. In each episode the cameras follow Jack as he spends time with nature's creatures across the continents. Jack talks with people that are knowledgeable about each animal and habitat, teaching as he goes. Each episode is designed to reveal to children the world around them in a way that presents positive role models and pro-social values within an environmentally responsible universe.",99,N/A,N/A,N/A
2001,WXYZ,ABC,DETROIT,4.5,ANALOG,"BOO! TO YOU, TOO, WINNIE THE POOH",NON-CORE,NETWORK,"TUES 10/30, 8:30-9:00 PM",1,0,30,3,6,"Piglet discovers unexpected courage, resourcefulness and self-esteem when he forces himself to conquer fears of imaginary creatures on Halloween night. His friends also learn that helping someone else---in this case their small friend Piglet--is more satisfying than Halloween revelry or trick-or-treating.",99,N/A,N/A,N/A
2001,WXYZ,ABC,DETROIT,4.5,ANALOG,A WINNIE THE POOH THANKSGIVING,NON-CORE,NETWORK,"FRI 11/16, 8:30-9:00 PM",1,0,30,3,6,"Facing disappointment with grace, exercising resourcefulness and creativity, working as a team and comforting a friend are demonstrated in this story. Each of those who gathers around the table for a bounteous but unconventional Thanksgiving feast realizes that Thanksgiving is not about certain foods or decorations but is about family, friends and acknowledging one's blessings.",99,N/A,N/A,N/A