1999,WTHR,NBC,"Indianapolis, IN",3.42,Analog,NBA: Inside Stuff,Core,Network,Saturdays 12:30-1PM,13,3,30,13,16,"The educational objective of this program is to introduce the teen audience to the pro-social, off-court activities of basketball players and other individuals, and to individuals who have overcome various obstacles in order to achieve their goals. The program segments are based on a curriculum inspired by the U.S. Department of Education's Goals 2000, with particular focus on messages encouraging the following values: school completion, community service, cooperation, tolerance of differences,healthful practices and athletics, peaceful conflict resolutions and global awareness. These educational and informational messages are conveyed primarily through real life examples, interviews and commentary by the program's hosts.",N/A,N/A,N/A,N/A
1999,WTHR,NBC,"Indianapolis, IN",3.42,Analog,Popular Mechanics for Kids,Core,Syndicated,Saturdays 10-10:30AM,13,0,30,8,12,"Program targets 8-12 year-olds with interest in how things work, examining everything from the relationship of mechanics to computers to the engineering of tunnels and bridges. The series seeks to educate proactively as it entertains.",99,N/A,N/A,N/A
1999,WTHR,NBC,"Indianapolis, IN",3.42,Analog,City Guys (2),Core,Network,Saturdays 11:30-12PM,13,1,30,13,16,"The educational objective of this program is to demonstrate how the knowledge of one or more characters in the story moves from one level to a more informed or higher level of knowledge by the end of each episode. This change in knowledge conveys an educational message to the audience which may fall into one or more categories - intellectual-cognitive and/or socio-emotional. The message will always be integral to the plot and present throughout the script. This objective is achieved in this series by exploring the pressures of living in a big city environment where situations are sometimes so difficult and challenging, kids have to learn sophisticated and responsible decision-making to be safe and stay focused. The series follows the encounters and problem-solving of two young men through an eventful school year at Manhattan High and shows teens how to work with their principal, family and friends to be successful.",N/A,N/A,N/A,N/A
1999,WTHR,NBC,"Indianapolis, IN",3.42,Analog,One World,Core,Network,Saturdays 12-12:30PM,12,2,30,13,16,"The educational objective of this program is to demonstrate how the knowledge of one or more characters in the story moves from one level to a more informed or higher level of knowledge by the end of each episode. This change in knowledge conveys an educational messsage to the audience which may fall into one or more categories -- intellectual-cognitive and/or socio-emotional. The message will always be integral to the plot and present throughout the script. This objective is achieved through this series by exploring socio-emotional themes of identity, self-worth, social reciprocity, service to others and acceptance of differences. Through the characters in the show, our audience will see examples of different approaches to resolving problems caused by these issues.",N/A,N/A,N/A,N/A
1999,WTHR,NBC,"Indianapolis, IN",3.42,Analog,High School Sports Show,Core,Syndicated,Sundays 11-11:30AM,12,1,30,13,16,"News magazine featuring pro-social, off-the-field activities of student athletes, coaches, student mentors and student families. An expert educational consultant works with producers and writers to insure that segments are based on a curriculum inspired by the U. S. Department of Education’s Goal 2000, with particular focus on messages encouraging the following values: school completion, community service, cooperation, tolerance of differences, healthful practices and athletics, peaceful conflict resolution and global awareness. These educational and informational messages are conveyed primarily through real life examples and interviews. Program has a local host and features local athletes and events.",N/A,N/A,N/A,N/A
1999,WTHR,NBC,"Indianapolis, IN",3.42,Analog,The Brain Game,Core,Local,Sundays 11:30-12PM,13,0,30,13,16,"Weekly academic quiz show pairing area high schools in an elimination competition, testing participants’ general knowledge in many subject areas. Produced by WTHR in association with the University of Indianapolis during the regular school year to encourage, promote and recognize academic achievement.",99,N/A,N/A,N/A
1999,WTHR,NBC,"Indianapolis, IN",3.42,Analog,City Guys (1),Non-Core,Network,Saturdays 10:30-11AM & 12-12:30PM,3,0,30,13,16,"The educational objective of this program is to demonstrate how the knowledge of one or more characters in the story moves from one level to a more informed or higher level of knowledge by the end of each episode. This change in knowledge conveys an educational message to the audience which may fall into one or more categories - intellectual-cognitive and/or socio-emotional. The message will always be integral to the plot and present throughout the script. This objective is achieved in this series by exploring the pressures of living in a big city environment where situations are sometimes so difficult and challenging, kids have to learn sophisticated and responsible decision-making to be safe and stay focused. The series follows the encounters and problem-solving of two young men through an eventful school year at Manhattan High and shows teens how to work with their principal, family and friends to be successful.",99,N/A,N/A,N/A
1999,WTTK,WB,"Indianapolis, IN",3,Analog,Detention,Core,Network,Sundays 9-9:30AM,13,0,30,6,9,"The educational and informational objective of ""Detention"" is to teach kids, 6-9 years of age, general social skills they will need to be able to interact with others. Subjects include sharing, differences between people, conflict resolution and how to respect others and yourself. This show meets the definition of core porgramming by being a regularly scheduled 30 minute daily program that airs between 7:00 AM and 10:00 PM with program guide publishers instructed that this is a instructional/educational program indended for children aged 4 to 7 years of age.",99,N/A,N/A,N/A
1999,WTTK,WB,"Indianapolis, IN",3,Analog,Histeria,Core,Network,Mon-Fri 7:30-8AM,66,0,30,6,9,"The educational and informational objective of ""Histeria"" is to give youngsters a sense of where they came from and who they are, thereby enhancing their self-acceptance and self-esteem. By analyzing past motivations, and their results, youngesters can gain a basis for present-day performance and decision-making. This show meets the definition of being a regularly scheduled 30 minute daily program that airs between 7:00AM and 10:00PM with program guide publishers instructed that this is a educational/informational program intended for children aged 6 to 9 years of age.",99,N/A,N/A,N/A
1999,WTTV,WB,"Indianapolis, IN",3,Analog,Detention,Core,Network,Sundays 9-9:30AM,13,0,30,6,9,"The educational and informational objective of ""Detention"" is to teach kids, 6-9 years of age, general social skills they will need to be able to interact with others. Subjects include sharing, differences between people, conflict resolution and how to respect others and yourself. This show meets the definition of core porgramming by being a regularly scheduled 30 minute daily program that airs between 7:00 AM and 10:00 PM with program guide publishers instructed that this is a instructional/educational program indended for children aged 4 to 7 years of age.",99,N/A,N/A,N/A
1999,WTTV,WB,"Indianapolis, IN",3,Analog,Histeria,Core,Network,Mon-Fri 7:30-8AM,66,0,30,6,9,"The educational and informational objective of ""Histeria"" is to give youngsters a sense of where they came from and who they are, thereby enhancing their self-acceptance and self-esteem. By analyzing past motivations, and their results, youngesters can gain a basis for present-day performance and decision-making. This show meets the definition of being a regularly scheduled 30 minute daily program that airs between 7:00AM and 10:00PM with program guide publishers instructed that this is a educational/informational program intended for children aged 6 to 9 years of age.",99,N/A,N/A,N/A
1999,WXIN-TV,FOX,"Indianapolis, IN",3.5,Analog,Scholastic's The Magic Schoolbus,Core,Network,Mon-Fri 2:30-3PM,64,2,30,6,9,THE EDUCATIONAL AND INFORMATIONAL OBJECTIVE OF THE SERIES IS TO MOTIVATE CHILDREN'S INTEREST IN SCIENCE; INTRODUCE SCIENCE IDEAS; INSPIRE POSITIVE ATTITUDES TOWARD SCIENCE AND EDUCATION; AND MODEL AGE APPROPRIATE SCIENCE PROBLEM SOLVING BEHAVIOR.,N/A,N/A,N/A,N/A
1999,WXIN-TV,FOX,"Indianapolis, IN",3.5,Analog,Sherlock Holmes in the 22nd Century,Core,Network,Saturdays 8-8:30AM & Mon 4-4:30 PM,16,1,30,9,11,"THE SERIES IS DESIGNED TO BUILD PROBLEM-SOLVING AND INFORMATIONAL MANAGEMENT SKILLS AND TO MODEL THE PRO-SOCIAL VALUES AND BEHAVIORS ASSOCIATED WITH ENDURING FRIENDSHIPS AND EFFECTIVE TEAMWORK. PROBLEM SOLVING THEMES ARE ILLUSTRATED IN EACH EPISODE WHICH ALSO DEMONSTRATE FUNDAMENTAL PRINCIPLES OF GATHERING, EVALUATING, AND INTERPRETING INFORMATION AND USING IT TO IMAGINE, PRESENT AND TEST PLAUSIBLE SCENARIOS.",N/A,N/A,N/A,N/A
1999,WXIN-TV,FOX,"Indianapolis, IN",3.5,Analog,NFL Under the Helmet,Core,Network,Saturdays 11-11:30AM,13,0,30,13,16,"NFL Under the Helmet showcases the pro-social on and off the field activities of the NFL's leading players and coaches. Working with the National Association for Sports and Physical Education, the program (1) educates teens about dedication, hard work, teamwork, goal setting, and community service, (2) provides examples of responsible social and personal physical activity and fitness, (3) demonstrates how to deal constructively with the differences among people, and (4) teaches the benefits of physical activity and fitness.",99,N/A,N/A,N/A