2002,KTBN,TBN,Los Angeles,4.45,Analog,COLBY'S CLUBHOUSE,Core,Network,Saturday 8am,12,1,30,6,12,COLBY'S CLUBHOUSE educates and informs children between the ages of 6-12 about how to successfully deal with everyday situations and challenges using Bible principles.,0,N/A,N/A,N/A
2002,KTBN,TBN,Los Angeles,4.45,Analog,KNOCK KNOCK CLUB,Core,Network,Saturday 8:30am,12,1,30,2,7,"The KNOCK KNOCK CLUB educates and informs children ages 2 - 7 about the world, as well as teaching math, language and basic problem solving skills.",0,N/A,N/A,N/A
2002,KTBN,TBN,Los Angeles,4.45,Analog,FAITHVILLE,Core,Network,Saturday 9am,12,1,30,4,16,FAITHVILLE educates and informs children ages 4-16 about the value of both teamwork and the importance of the individual within the community.,0,N/A,N/A,N/A
2002,KTBN,TBN,Los Angeles,4.45,Analog,CHERUB WINGS,Core,Network,Saturday 9:30am,12,1,30,3,7,CHERUB WINGS educates and informs children between the ages of 3 - 7 by teaching practical living skills with important values through Bible stories and songs that children love.,0,N/A,N/A,N/A
2002,KTBN,TBN,Los Angeles,4.45,Analog,WWJD?,Core,Network,Saturday 10:30am,10,3,30,11,16,"WWJD? educates and informs youth ages 11 to 16 as teens discuss how to successfully deal with the issues they face today such as drugs, dating and peer pressure.",0,N/A,N/A,N/A
2002,KTBN,TBN,Los Angeles,4.45,Analog,GREATEST HEROES AND LEGENDS OF THE BIBLE,Core,Network,Saturday 11am,12,1,45,10,16,GREATEST HEROES & LEGENDS OF THE BIBLE educates and informs youth ages 10 to 16 through animated Bible stories that promote important character building values.,0,N/A,N/A,N/A
2002,KTBN,TBN,Los Angeles,4.45,Analog,DAVEY AND GOLIATH PERMANENT TIME SLOT A/O 11-23-02,Core,Network,Saturday 7am,6,0,30,3,9,DAVEY AND GOLIATH educates and informs children between the ages of 3 - 9 by teaching important life skills based on positive and practical Bible principles.,99,N/A,N/A,N/A
2002,KTBN,TBN,Los Angeles,4.45,Analog,KIDS AGAINST CRIME,Non-core,Network,Saturday 2:30am,11,2,30,5,12,KIDS AGAINST CRIME educates and informs children between 5 - 12 by exploring the real-life crimes committed against and by youth and the penalties for those who commit these crimes.,N/A,N/A,N/A,N/A
2002,KTBN,TBN,Los Angeles,4.45,Analog,KIDS LIKE YOU,Non-core,Network,Saturday 3am,12,1,30,6,12,KIDS LIKE YOU educates and informs children between the ages of 6-12 by presenting challenging situations with solutions that develop character.,N/A,N/A,N/A,N/A
2002,KTBN,TBN,Los Angeles,4.45,Analog,CIRCLE SQUARE,Non-core,Network,Saturday 3:30am,12,1,30,4,12,CIRCLE SQUARE educates and informs children between the ages of 4-12 by presenting biblically based values and morals used for problem solving in everyday situations.,N/A,N/A,N/A,N/A
2002,KTBN,TBN,Los Angeles,4.45,Analog,FLYING HOUSE,Non-core,Network,Saturday 4am,12,1,30,5,10,FLYING HOUSE educates and informs children ages 5 - 10 by reaching Bible stories that highlight important character traits such as honesty and courage.,N/A,N/A,N/A,N/A
2002,KTBN,TBN,Los Angeles,4.45,Analog,SUPERBOOK,Non-core,Network,Saturday 4:30am,12,1,30,5,10,"SUPERBOOK educates and informs children between the ages of 5 - 10 by teaching Bible stories that highlight the important character traits children will need in life such as courage, loyalty and responsiblity.",N/A,N/A,N/A,N/A
2002,KTBN,TBN,Los Angeles,4.45,Analog,JOY JUNCTION,Non-core,Network,Saturday 5am (PT),12,1,30,8,12,JOY JUNCTION educates and informs children ages 8 - 12 by teaching Bible history and the development of positive social and moral values.,N/A,N/A,N/A,N/A
2002,KTBN,TBN,Los Angeles,4.45,Analog,GOSPEL BILL,Non-core,Network,Saturday 5:30am,12,1,30,5,12,GOSPEL BILL educates and informs children between the ages of 5 - 12 byteaching positive social skills and self awareness based on biblical principles.,N/A,N/A,N/A,N/A
2002,KTBN,TBN,Los Angeles,4.45,Analog,FAITHVILLE,Non-core,Network,Saturday 6am,12,1,30,4,16,FAITHVILLE educates and informs children between the ages of 4 - 16 about the value of both teamwork and the importance of the individual within the community.,N/A,N/A,N/A,N/A
2002,KTBN,TBN,Los Angeles,4.45,Analog,JANICE'S ATTIC,Non-core,Network,Saturday 6:30am,12,1,30,4,8,"JANICE'S ATTIC educates and informs children between the ages of 4 - 8 about nature, personal health and the value of positive character qualities.",N/A,N/A,N/A,N/A
2002,KTBN,TBN,Los Angeles,4.45,Analog,GREATEST HEROES AND LEGENDS OF THE BIBLE,Non-core,Network,Friday 4pm & Sunday 1:30am,16,10,45,11,16,GREATEST HEROES & LEGENDS OF THE BIBLE educates and informs youth ages 10 - 16 through animated Bible stories that promote important character building values.,2,N/A,N/A,N/A
2002,KTBN,TBN,Los Angeles,4.45,Analog,VIRTUAL MEMORY,Non-core,Network,Thursday 11pm & Saturday 9pm,19,7,30,13,17,VIRTUAL MEMORY is a Bible trivia show that educates and informs kids between the ages of 13-17 by affirming positive social skills through biblical facts and principles.,N/A,N/A,N/A,N/A
2002,KTBN,TBN,Los Angeles,4.45,Analog,2WORLDS,Non-core,Network,Saturday 11:30pm,5,8,30,11,16,2WORLDS educates and informs youth aages 11-16 by promoting critical thinking skills and self-esteem as young people evaluate their life experiences and discuss affective answers to the issues they face.,N/A,N/A,N/A,N/A
2002,KTBN,TBN,Los Angeles,4.45,Analog,WWJD?,Non-core,Network,Saturday 1am,8,5,30,11,16,"WWJD? educates and informs youth ages 11 to 16 as teens discuss how to successfully deal with the issues they face today such as drugs, dating and peer pressure.",N/A,N/A,N/A,N/A
2002,KTBN,TBN,Los Angeles,4.45,Analog,THE KID'S CLUB,Non-core,Network,"Saturday, 10-5-02 12 pm",1,0,30,3,9,THE KID'S CLUB educates and informs children between the ages of 3-9 about history through the Bible as well as teaching children about safety and offering exercise instruction.,99,N/A,N/A,N/A
2002,KTBN,TBN,Los Angeles,4.45,Analog,BEN & EDDIE,Non-core,Network,Saturday 12-21-02 2am,1,0,60,2,6,"BEN & EDDIE educates and informs children ages 2-6 by cutting to the heart of pressing issues kids face such as how to deal with fear, disappointment, forgiveness and loneliness.",99,N/A,N/A,N/A
2002,KTBN,TBN,Los Angeles,4.45,Analog,THE LEGEND OF THE CANDY CANE,Non-core,Network,Tuesday 12-24-02 8:30am,1,0,43,4,8,THE LEGEND OF THE CANDY CANE educates and informs children between the ages of 4-8 by teaching important life skills and character building values and dealing with daily life challenges.,99,N/A,N/A,N/A
2002,KTBN,TBN,Los Angeles,4.45,Analog,IT IS A GOD THING,Non-core,Network,Saturday 11-30-02 10:30am,1,0,30,6,13,IT IS A GOD THING educates and informs children ages 6-13 by teaching the consequences of actions and imparting valuable life lessons through biblical facts and principles.,99,N/A,N/A,N/A
2002,KTBN,TBN,Los Angeles,4.45,Analog,BEN & EDDIE,Non-core,Network,Wednesday 12-25-02 2:30am,1,0,60,2,6,"BEN & EDDIE educates and informs children ages 2-6 by cutting to the heart of pressing issues kids face such as how to deal with fear, disappointment, forgiveness and loneliness.",99,N/A,N/A,N/A
2002,KTLA,WB,Los Angeles,3.5,Analog,CITY GUYS,Core,Syndicated,M-Fr 10/1/2002-12/31/2002 2:30P,64,2,30,13,16,"The educational objective of this show is to demonstrate how the knowledge of the characters moves from one level to a higher, more informed level of knowledge. This change in knowledge conveys an educational message which is intellectual-cognitive and/or socio-emotional. The series explores the pressures of living in a big city environment where situations are so challenging that kids have to learn responsible decision-making to be safe and stay focused.",2,N/A,N/A,N/A
2002,KTLA,WB,Los Angeles,3.5,Analog,BABY LOONEY TUNES,Core,Syndicated,SU 10/6/2002-12/29/2002 10A,13,0,30,2,6,"The educational objective of this show is to help children gain meaningful life skills and behaviors, such as following directions, being a member of a team, making new friends and dealing with being sick. This will better equip them to take on a functional role in their environment. The show also provides practice to children on fundamental knowledge-based learning and skills inlcuding the alphabet, numbers, colors and elementary science.",99,N/A,N/A,N/A
2002,KTLA,WB,Los Angeles,3.5,Analog,WILD AMERICA,Core,Syndicated,Su 10/6/2002-12/29/2002 10:30A,13,0,30,13,16,The key educational objective of this program is to create awareness and understanding of animals and their interaction with their particular environment. The role that humans play interacting with animals in the wild is also explored. Program seeks to inform us of the importance of protecing endangered species and their habitats.,99,N/A,N/A,N/A
2002,KTTV,Fox,Los Angeles,3.2,Analog,SHERLOCK HOLMES IN THE 22ND CENTURY,Core,Network,Saturdays at 7am,13,0,30,6,11,"The series is designed to build problem-solving and informational management skills and to model the pro-social values and behaviors associated with enduring friendships and effective teamwork. Problem solving themes are illustrated in each episode which also demonstrate fundamental principles of gathering, evaluating, and interpreting information and using it to imagine, present and test plausible scenarios. It is the intent of the series to motivate children to see critical thinking and team problem-solving as exciting, fun and within their capacity. The program is regularly scheduled and airs between the hours of 7:00 am and 10:00 pm. The program is 30 minutes in length, and is identified as an educational and informational show, targeted to 9 to 11 year olds, at the beginning of each broadcast and in listings provided to publishers of program guides",99,N/A,N/A,N/A
2002,KTTV,Fox,Los Angeles,3.2,Analog,SHERLOCK HOLMES IN THE 22ND CENTURY,Core,Network,Saturdays at 7:30am,13,0,30,6,11,"The series is designed to build problem-solving and informational management skills and to model the pro-social values and behaviors associated with enduring friendships and effective teamwork. Problem solving themes are illustrated in each episode which also demonstrate fundamental principles of gathering, evaluating, and interpreting information and using it to imagine, present and test plausible scenarios. It is the intent of the series to motivate children to see critical thinking and team problem-solving as exciting, fun and within their capacity. The program is regularly scheduled and airs between the hours of 7:00 am and 10:00 pm. The program is 30 minutes in length, and is identified as an educational and informational show, targeted to 9 to 11 year olds, at the beginning of each broadcast and in listings provided to publishers of program guides.",99,N/A,N/A,N/A
2002,KTTV,Fox,Los Angeles,3.2,Analog,STARGATE-INFINITY,Core,Network,Saturdays at 8am,13,0,30,9,11,"In every episode, the Stargate Explorers enter another new world. About the only things they can be sure of are that they will encounter life forms and cultures very different from their own, that they will face problems that require functioning smoothly as a team, and that a team is only as strong as the character and abilities of its individual members. At its core, “Stargate-Infinity” explores issues, attitudes, and behaviors important to learning how to get along with others – whether those others are from different races, cultures, and species, or from their own team of trainees. The young explorers serve as models for the young audience. As the cadets learn hard lessons about such things as trying to see the world from the perspective of other cultures, the positive benefits in diversity, or how to mesh their own strengths and abilities with those of others on the team, so too do young viewers. The series examines fundamental issues about how and why to get along with others who may be very different from oneself, and about the kinds of abilities and strength of character necessary to be a good Stargate Explorer – and a good person. The program is regularly scheduled and airs between the hours of 7:00 am and 10:00 pm. The program is 30 minutes in length, and is identified as an educational and informational show, targeted to 9 to 11 year olds, at the beginning of each broadcast and in listings provided to publishers of program guides.",99,N/A,N/A,N/A
2002,KTTV,Fox,Los Angeles,3.2,Analog,UNDER THE HELMET,Core,Network,Saturdays at 12pm (10/5-12/21) and at 9am (12/28),13,1,30,13,16,"NFL “Under The Helmet” showcases the pro-social on and off the field activities of the NFL’s leading players and coaches. Working with the National Association for Sports and Physical Education (NASPE), the program (1) educates teens about dedication, hard work, teamwork, goal setting and community service, (2) provides examples of responsible social and personal behavior, (3) demonstrates how to deal constructively with the differences among people, and (4) teaches the benefits of physical activity and fitness. The program is regularly scheduled and airs between the hours of 7:00 am and 10:00 pm. The program is 30 minutes in length, and is identified as an educational and informational show, targeted to teens (13-16 year olds), at the beginning of each broadcast and in listings provided to publishers of program guides.",1,N/A,N/A,N/A
2002,KTTV,Fox,Los Angeles,3.2,Analog,THE PET SHOP,Core,Syndicated,Saturdays at 12:30pm (10/5-12/21),12,0,30,13,16,"Host Rob Monroe helps children to understand responsibility through his unique way of communicating and caring for a variety of pets. Marc Morrone guides viewers through the fun and frenetic world of pets. With unique advice and helpful hints on anything, from supplementing a lizard's diet with peach baby food or housebreaking a puppy, this modern-day Dr. Doolittle presents a warm and unscripted program that's part neighborly chat, part animal kingdom insight. The quirky personality of Marc Morrone and his wealth of useful information will help pet lovers of all ages, especially children, to better understand and care for all creatures great and small.",99,N/A,N/A,N/A
2002,KTTV,Fox,Los Angeles,3.2,Analog,WILD MOMENTS,Core,Syndicated,Saturdays at 1pm,10,0,30,12,17,"Outdoorsman Jack Hubley and his faithful companion Trusty the dog hike fields, forests and deserts to bring a close up view of nature to their viewers. Wild Moments is a fresh approach to wildlife television that shows Mother Nature at her best, offering viewers fun, entertaining and informative programming. Wild Moments features the lifestyles and habitats of an incredible array of mammals, birds, reptiles, fish and insects – from the backyard to the fields and forests beyond -introducing viewers to their fuzzy neighbors along the way. Jack Hubley’s good-natured humor and passion for the animal kingdom help him convey his contagious excitement and desire to share his special knowledge of wildlife. The program is regularly scheduled and airs between the hours of 7:00 am and 10:00 pm. The program is 30 minutes in length, and is identified as an educational and informational show, targeted to 13 to 16 year olds, at the beginning of each broadcast and in listings provided to publishers of program guides.",99,N/A,N/A,N/A
2002,KTTV,Fox,Los Angeles,3.2,Analog,SCOPE,Core,Syndicated,Saturdays at 1:30pm (10/19-12/14) and 2pm (12/28),10,0,30,12,17,"Scope is a series developed to enlighten and educate children on modern technologies which shape educational development. The series sparks interest in independent exploration of the different topics presented and supports fundamental values conducive to higher education. This is a comprehensive variety of ideas, revelations and solutions.",99,N/A,N/A,N/A
2002,KVEA,Telemundo,Los Angeles,4.12,Analog,NINI'S TREEHOUSE,Core,Network,Saturdays: 7:00 AM,13,0,30,3,6,"Propelled by his own wonderful imagination, Nini takes children on enchanting journey in OOOberryland, encouraging friendship, learning, cooperation, investigative skills, critical thought, organizing knowledge and love of reading. Every episode concludes with a problem solved, a friendship strengthened, a giggle and a laugh.",99,N/A,N/A,N/A
2002,KVEA,Telemundo,Los Angeles,4.12,Analog,AGUA VIVA,Core,Network,Saturdays: 7:30 AM,13,0,30,3,6,"Agua Viva is an entertainment, educational and musical program that tells the adventures of a brother and sister whose toys come to life in Agua Viva. It's a beautiful place where they not only have fun, but also have opportunity to play, create and learn together with their friends who help them understand the importance of love, honesty and friendship. As they confront daily problems, they develop good character and a positive attitude towards life.",99,N/A,N/A,N/A
2002,KVEA,Telemundo,Los Angeles,4.12,Analog,LAS TRES MELLIZAS,Core,Network,Saturdays: 8:00 AM,13,0,30,4,8,"The enchanting adventures of a set of triplets who embark on adventures, battle villians and discover secrets held in great classics of literature and fairy tales. It teaches the value of friendship, consideration, social themes and ecological themes found in such children's classics of literature.",99,N/A,N/A,N/A
2002,KVEA,Telemundo,Los Angeles,4.12,Analog,BIZBIRIJE,Core,Network,Saturdays: 8:30 AM,13,0,30,6,9,"Live-action, kid hosted show with a variety of segments that foster cognitive and social development. Winner of seven international awards, Bizbirije encourages children to create new ideas while having fun when engaging in art projects, magic tricks, songs, science experiments and ideas to save the planet.",99,N/A,N/A,N/A
2002,KVEA,Telemundo,Los Angeles,4.12,Analog,NICO,Core,Network,Saturdays: 9:00 AM (through 10/19/02); Sundays 8:00 AM (as of 10/27/02),13,0,30,8,12,"Nico is a series designated to make children think about the rehabilitation and integration of disabled people in modern society, combining such messages with the adventure which each episode presents. From historical backgrounds to scientific and medical facts the world of the blind is told in an entertaining, light-hearted way that all children can relate to and it teaches children that blind kids are just like any other kid.",99,N/A,N/A,N/A
2002,KVEA,Telemundo,Los Angeles,4.12,Analog,TOONIMALS,Core,Network,Saturdays: 9:30 AM (through 10/19/02); Sundays 8:30 (as of 10/27/02),13,0,30,8,12,"Toonanimals is a series about animals seen through the amused eyes of animals themselves. Ollie is the wise owl and his friends will show you some o the most unusual and least known phenomenas of the animal world in a style which is original, modern, colorful and self-assured. Strange facts, anecdotes, records, events, stories--its the definitive study of animals in a wildly amusing series.",99,N/A,N/A,N/A
2002,KVEA,Telemundo,Los Angeles,4.12,Analog,JUANA LA IGUANA,Core,Network,Sundays: 7:00 AM,13,0,30,4,8,"Juana la Iguana is a series of entertainment, educational and musical programs that tell the adventures of a group of children with an iguana named Juana. With the wink of an eye, Juana transports the children to her house, a fantastic place where everything is possible and from there they travel around the world. In their trips, Juana transmits to the children, values such as friendship, teamwork and the importance of non-violent conflict resolution.",99,N/A,N/A,N/A
2002,KVEA,Telemundo,Los Angeles,4.12,Analog,DRAGON TALES,Core,Network,Sundays: 7:30 AM,13,0,30,4,8,Dragon Tales is designed to increase children's collection of strategies to deal with the everyday challenges of growing up. It encourages young children to pursue the challenging experiences that support their growth and development. It helps young children recognize that there are many ways to approach and learn from the challenging experiences in their lives and that to try and succeed fully is a natural and valuable part of learning.,99,N/A,N/A,N/A
2002,KVEA,Telemundo,Los Angeles,4.12,Analog,JACKIE CHAN ADVENTURES,Core,Network,Sundays: 8:00 AM (through 10/20/02),3,0,30,8,12,"Jackie Chan is not a ""Superman,"" he is a somewhat ordinary man, of average stature, who speaks plainly. He is however, super in the way each of us has the power to be. By means of Jackie's overarching empathy and concern for others, his underlying strength of character, courage, ingenuity, hard work and perseverance, he is able to vanquish opponents and achieve amazing goals. By viewing the way in which Jackie Chan meets life's challenges, children may be inspired to make the most of their unique abilities, to act proactively and heroically, and to fulfill their own potential for helping.",99,N/A,N/A,N/A
2002,KVMD,N/A,Los Angeles,3,Analog,IMAGINELAND,Core,Syndicated,MONDAY THRU FRIDAY 1:00 P.M.,66,0,30,4,12,"IMAGINELAND IS A MAGICAL WORLD WITH A CAST OF IRRESISTIBLE CHARACTERS THAT CHILDREN OF ALL NATIONALITIES & AGES WILL FALL IN LOVE WITH. THE SHOW IS SET IN A COUNTRYSIDE SOME CHILDREN CAN ONLY DREAM ABOUT. THE SUN SHINES, THE AIR IS CLEAN AND THE VALUES ARE PURE.",99,N/A,N/A,N/A
2002,KVMD,N/A,Los Angeles,3,Analog,COOKIN' WITH CUTTY,Core,Syndicated,SATURDAY 7:00 A.M.,13,0,30,6,12,"THE CUTTY MISSION IS TO ENCOURAGE GOOD HEALTH, NUTRITION AND FITNESS HABITS TO CHILDREN AROUND THE WORLD, WITH THE HOPES THEY WILL CARRY THEM INTO ADULTHOOD. COOKIN' WITH CUTTY INFORMS AND EDUCATES CHILDREN, PARENTS, AND FAMILITIES THROUGH THE EASIEST LEARNING METHODS ON EARTH, ...FUN.",99,N/A,N/A,N/A
2002,KWHY,N/A,Los Angeles,3.04,Analog,EL DESVAN DE TIO IVAN,Core,Local,MWF: 7:00 AM,39,0,30,5,8,"Tio Ivan is a live character who shares a series of adventures with his best friend, a life size puppet sheep dog. Whether at home or in the community, stories and other values are at the center of each segment.",99,N/A,N/A,N/A
2002,KWHY,N/A,Los Angeles,3.04,Analog,CUARTO DE LOS TRIQUES,Core,Local,Tu and Thurs: 7:00 AM,27,0,30,7,11,"Cuarto de los Triques takes place in a room full of trinkets, knick-knacks and gadgets that have a life of their own. A boy names Jorge and his best friend, a robot names Desperdicop, present scientific and cultural topics with their experiments, rafts, stories aned other unusual activities.",99,N/A,N/A,N/A
2002,KWHY,N/A,Los Angeles,3.04,Analog,JUANA LA IGUANA,Core,Syndicated,Sundays: 2:00 PM,13,0,30,4,8,"Juana La Iguana is a series of entertainment, educational and musical episodes that describe the adventures ofa a group of children with an iguana named Juana. With the wink of an eye, Juana transports the children to her house, a fantastic place where everthing is possible. From there, they travel around the world. In their trips, Juana transmits to the children values such as friendship, teamwork and the importance of non-violent conflict resolution.",99,N/A,N/A,N/A
2002,KXLA,N/A,Los Angeles,3,Analog,NASA CONNECTION,Core,Syndicated,MONDAYS @ 2:00pm,14,0,60,8,16,"Program created by NASA. Each program has 3 components: 1)a 30 minute commercial free program. 2) an educator guide including a hands-on activity. 3) interactive web activities. The program focuses on NASA research - past, present and future in a magazine style format, designated to create an interest and educate kids in mathematics, science, technology and all the different aspects related with NASA. It also serves as a mechanism for parents in the education of children.",99,N/A,N/A,N/A
2002,KXLA,N/A,Los Angeles,3,Analog,ANIMAL RESCUE,Core,Syndicated,Fridays @ 2:00pm,12,0,30,1,9,Animal Rescue showcases spectacular rescues of all types of animals and focuses on the work of dedicated individuals who treat the various creatures of the animal kingdom. All stories are authentic and contain actual video of recues. It contains safety tips and real life in-the-field experiences of professional and ordinary people taking care of treating and helping different animals.,99,N/A,N/A,N/A
2002,KXLA,N/A,Los Angeles,3,Analog,ZEBBY ZOO,Core,Syndicated,Tuesdays @ 2:30pm (10/1 - 12/31),14,0,30,2,10,"Follows the adventures of Zebby, the talking Zebra, and his friends. Introduces younger children to good values, fitness and health, basic spelling and arithmetic and home neighborhood safety.",99,N/A,N/A,N/A
2002,KXLA,N/A,Los Angeles,3,Analog,IMAGINELAND,Core,Syndicated,Wednesdays @ 2pm,13,0,30,4,12,"Imagineland is a magical world with a cast of irresistible characters that children of all nationalities and ages will fall in love with. The show is set in a countryside that some children can only dream about. The sun shines, the air is clean and the values are pure.",99,N/A,N/A,N/A
2002,KXLA,N/A,Los Angeles,3,Analog,JACK HANNA'S ANIMAL ADVENTURE,Core,Syndicated,Wednesdays @ 2:30pm,13,0,30,10,16,"In each episode the camera follows Jack as he spends time with nature's creatures across the continents. Jack talks with people that are knowledgeable about each animal and habitat, teaching as he goes. Each episode is designed to reveal to children the world around them in a way that presents positive role models and prosocial values within an environmentally responsible universe.",99,N/A,N/A,N/A