2002,KHIZ-TV,N/A,Los Angeles,3,Analog,POOCHINI,Core,Syndicated,Tuesdays @ 5 p.m.,14,0,30,3,8,"Poochini is an animated series about a dog that goes from being a high class pampered pooch to living with a middle class family. He learns that he must depend on himself and his instincts. He must understan the reality of his situation, but remain open, flexible, and he demonstrates a willingness to depart from expectations. Poochini points out the positive value of accepting oneself and one's situations for what they are, while at the same time doing one's utmost to improve both.",99,N/A,N/A,N/A
2002,KHIZ-TV,N/A,Los Angeles,3,Analog,SO YOU WANT TO BE?,Core,Syndicated,Wednesdays @ 5 p.m.,14,0,30,7,13,An upbeat and interactive sreies for young people who want to explore career possibilities. Hosts Jeff & Melody visit professionals in their work enviroment to obtain insight to the professionals' job description and what it takes to get where they are.,99,N/A,N/A,N/A
2002,KHIZ-TV,N/A,Los Angeles,3,Analog,BLINKY BILL,Core,Syndicated,Thursdays @ 5 p.m.,13,0,30,5,13,Teaches children good values such as kindness and friendship. Utilizes animation and humor to instill these qualities into children.,99,N/A,N/A,N/A
2002,KHIZ-TV,N/A,Los Angeles,3,Analog,ANIMAL RESCUE,Core,Syndicated,Thursdays @ 8 p.m.,13,0,30,5,16,"Teaches children respect and compassion for animals and living creatures. Teaches about animal behavior, development, and habitat.",99,N/A,N/A,N/A
2002,KHIZ-TV,N/A,Los Angeles,3,Analog,REAL LIFE 101,Core,Syndicated,Fridays @ 5 p.m.,13,0,30,13,17,Jobs and careers are explored in an energetic style presentation to educate and inform teenage audiences. Co-host approach allows for interchange of questions and responses.,99,N/A,N/A,N/A
2002,KHTV,N/A,Los Angeles,3,Analog,SUPER BOOK (SPANISH LANGUAGE),Core,Syndicated,Mon - Fri 7:00AM,66,0,30,3,6,"Superbook is a weekly educational series for ages 3 and up designed to entertain and educate various age groups on historical and biblical events. Superbook focuses on positive behavioral and cognitive messages portrayed by the re-telling of these events. Children are able to understand history from a different dimension and relate to the animated characters. From a developmental perspective, the ability to educate young children with Superbook is made easy by taking advantage of the visual and educative appeal of the characters. Children are reinforced and motivated by lessons of love, faithfulness, honesty, and integrity. 1) It is specifically designed to meet the educational and informational needs of children under the age of 16. 2) It airs during core hours. 3) It is regularly scheduled. 4) It is 30 minutes in length.",99,N/A,N/A,N/A
2002,KHTV,N/A,Los Angeles,3,Analog,FLYING HOUSE (SPANISH LANGUAGE),Core,Syndicated,Sundays at 8:30am,13,0,30,3,10,"Flying House is a weekly educational series designed for children ages 3-10. It has been uniquely produced to provide entertainment and education for the entire family by using intriguing characters to reinforce positive values, teach behavior modificiation skills, and illustrate stories based on history. Flying House uses the creativity of animation to educate school age children on historical events and expand their ability to memorize these events. 1) It is specifically designed to meet the educational and informational needs of children under the age of 16. 2) It airs during core hours. 3) It is regularly scheduled. 4) It is 30 minutes in length.",99,N/A,N/A,N/A
2002,KJLA,N/A,Los Angeles,3,Analog,SO YOU WANT TO BE?,Core,Syndicated,Monday @ 4:00 pm,13,0,30,7,13,"An upbeat series that allows children to gain a realistic insight into professions that may be of interest to them in the years ahead. There is not much material on elementary career development with the scope and depth this program offers. From aircraft pilot, banker or marine biologist to travel agent, reporter and chef. A pair of different professions are highlighted in each show with the quality, relevance, and interesting presentation for young children.",99,N/A,N/A,N/A
2002,KJLA,N/A,Los Angeles,3,Analog,DESTINATION TOMORROW,Core,Syndicated,Monday @ 4:30 pm,13,0,30,8,16,"Destination Tomorrow is a program created by NASA, each program has 3 components: 1): a 30 minutes commercial free program. 2): an educator guide including a hands-on activity 3): an interactive web activities. Focuses on NASA research, past, present & future in a magazine style format, designed to create a heighten interest for kids 8 to 16 years in mathematics, science, technology and NASA. Also serve as mechanism for parents in the education of children.",99,N/A,N/A,N/A
2002,KJLA,N/A,Los Angeles,3,Analog,CRITTER GITTERS,Core,Syndicated,Tuesday @ 4:00 pm,14,0,30,9,14,"A search and rescue 911 themed animal adventure series with an entertaining twist of investigative and detective “super sleuthing” by a group neighborhood kids, a couple of veterinarians and zany professor. Action and stimulating story lines combined with kids’ natural love and curiosity of animals. This program promotes and teaches teamwork, cooperation, problem solving, knowledge of animals and positive role models.",99,N/A,N/A,N/A
2002,KJLA,N/A,Los Angeles,3,Analog,IMAGINELAND,Core,Syndicated,Tuesday @ 4:30 pm,14,0,30,4,12,"Imagineland is a magical world with a cast of irresistible characters that children of all nationalities & ages will fall in love with. The show is set in a countryside some children can only dream about. the sun shines,the air is clean and the values are pure.",99,N/A,N/A,N/A
2002,KJLA,N/A,Los Angeles,3,Analog,DID YOU EVER WONDER?,Core,Syndicated,Wednesday @ 4:00 pm,2,0,30,6,12,This nationally acclaimed FCC children's series provides answers to the why’s and how's on a wide verity of topics that are educational and have interest to kids ages six to twelve.,99,N/A,N/A,N/A
2002,KJLA,N/A,Los Angeles,3,Analog,POOCHINI,Core,Syndicated,Wednesday @ 4:00 pm,11,0,30,8,13,"Poochini” is a colorful character who has gone from “riches to rags”, but comes to grip with the fact that he is now an ordinary dog who must depend upon himself and his own instincts to survive in the world. He is proud to pass along a bit of his knowledge and discoveries to his young viewers. Each episode in the series includes three different stories.",99,N/A,N/A,N/A
2002,KJLA,N/A,Los Angeles,3,Analog,REAL LIFE 101,Core,Syndicated,Wednesday @ 4:30 pm,13,0,30,10,16,The concept for Real Life 101 is bold yet simple. Real life jobs and careers are explored in an energetic style as an education and information (E/I) presentation for teenage viewers. The careers and people chosen to reflect those categories offer a vital inside look at what it would really be like to choose that particular profession. A cohost approach allows for interchange of questions and responses adding viewer stimulation and insight.Fresh fast-paced entertainment and direction for teens that utilizes today's music and humor to provide career guidance. encourages young people to follow their dreams.,99,N/A,N/A,N/A
2002,KMEX-TV,Univision programming service*,Los Angeles,3,Analog,PLANETA U,Core,Network,SU 08:30AM; SA 08:30AM,26,0,90,6,11,"Planeta U is an hour and a half hour program consisting of the one hour academic Plaza Sesamo program and a half hour program, Mimi and Mr. Bob, which talks to children about morals and social values. Plaza Sesamo: Provides reading readiness training, early mathematics skills, education in health, hygiene and nutrition, and provides encouragement and stimulation for academic success. Produced by CTW specifically for a Spanish-language audience. Mimi and Mr. Bob: Mimi lives with her mother and father in a diverse neighborhood and her interactions with her friends illustrate different themes and lessons. Some of the issues discussed in current episodes include resisting peer pressure, recognizing the consequences of your actions, interacting responsibly with the environment, and the importance of friendship.",99,N/A,N/A,N/A
2002,KNBC,NBC,Los Angeles,3,Analog,PREHISTORIC PLANET,Core,Network,"Saturday, 8:00AM - 8:30AM ",13,0,30,9,14,"PREHISTORIC PLANET is based on the award-winning BBC/Discovery series “Walking with Dinosaurs.” It begins over 200 million years ago with the Triassic Period. Over several weeks, the audience travels through time to the Jurassic, Early Cretaceous and Mid-Cretaceous Periods, which ended 65 million years ago. The dawn of the mammals is then covered, with the series ending just a few million years ago. The objectives of this show are to: · Expose the audience to a re-creation of the prehistoric world and explain how the animal kingdom might have lived day by day. · Expose learners to content that will enable them to differentiate and match species to eras, to habitat, and to their respective behavior patterns. · Expose the audience to information on how and why certain prehistoric beasts were the precursors of species alive today. · Expose the audience to basic concepts of the life cycle, the food chain, and the process of species survival vs. extinction. · Expose the audience to content on the development of the Earth’s geography and the relationship of weather, geography, and natural events to the development of different animal species.",99,N/A,N/A,N/A
2002,KNBC,NBC,Los Angeles,3,Analog,CROC FILES,Core,Network,"Saturday, 8:30AM - 9:00AM",13,0,30,9,14,"CROC FILES takes the audience on world-wide travels with naturalist, adventurer and story-teller Steve Irwin of the Australian Zoo. In humorous and adventuresome episodes, Steve, with his wife Terri and a small crew, travel to different locales to film a wide variety of animal species. The objectives of this show are to: · Expose the audience to the habitat, behavior patterns and, in most cases, the dangers of most types of non-domesticated animals. · Demonstrate to the audience how to be safe around wild animals, particularly dangerous predators and poisonous snakes. · Inform the audience about the life cycle, eating habits and social behavior of different animals. · Inform the audience about conservation issues and the relationship and importance of different animals to specific ecosystems.",99,N/A,N/A,N/A
2002,KNBC,NBC,Los Angeles,3,Analog,OPERATION JUNKYARD,Core,Network,"Saturday, 9:00AM - 9:30AM",13,0,30,9,14,"OPERATION JUNKYARD is a reality show that creates teams of kids who are interested in building and inventing, and puts the teams in competitive engineering challenges. The over-arching goal of the program is to show how the basic principles of engineering are accessible to anyone who wants to know “how things work.” Specific objectives are to communicate to the audience how teams can work successfully under pressure to create working machines and to demonstrate the use of recyclable objects to create something completely different from the object’s original purpose. In each episode, two groups of four kids form teams that actually work under defined time pressures and information limitations. They have to create, from the junk on an “Operation Junkyard” bus, working machines that spray water, float on water, catapult balls, scoop mud, lift objects or even fill pies. The engineering is diagrammed for the audience to track each team’s progress, and the underlying concepts of the project are explained in everyday terms. After each machine is built, a rousing and sometimes hilarious competition is held to see which contraption succeeds in fulfilling its purpose.",99,N/A,N/A,N/A
2002,KNBC,NBC,Los Angeles,3,Analog,ENDURANCE,Core,Network,"Saturday, 9:30AM - 10:00AM",13,0,30,9,14,"ENDURANCE is an engrossing program that shows the target audience,with typical kids ages 12-16, succeeding at several different physical, intellectual and strategic challenges in order to win a fabulous travel prize. The audience will be exposed to historical information about great feats of endurance, from Houdini’s escape artistry to Sir Edmund Hillary’s ascent of Mount Everest. Each of the 12 competitive challenges is a metaphor for one of these feats of endurance. In addition, there are strategic challenges based on ten character traits that are important for success. Contestants must estimate probabilities and beat the odds. Overall, the competition balances luck or fate against personal effort so that the contestants learn to balance intellect with intuition in developing their winning strategy. Narration and interviews during each episode trace the emotional growth and insights of the contestants, with an emphasis on how the experience of protracted competition and teamwork teaches both social skills and life skills for achieving success with your goals.",99,N/A,N/A,N/A
2002,KNBC,NBC,Los Angeles,3,Analog,SCOUT'S SAFARI,Core,Network,"Saturday, 10:00AM - 10:30AM",11,2,30,9,14,"SCOUT’S SAFARI follows the development of 14-year-old Scout Lauer, whose divorced parents have to quickly move Scout from her father’s home in New York City to her mother’s home on a game reserve in South Africa. The overarching goal of the series is for our main character, Scout, to model a learning process for the audience that charts her socio-emotional growth as she adjusts to a completely new life in South Africa. By the end of each episode, Scout will have moved from one level of knowledge to a higher level of knowledge or insight. Specific objectives are to show how Scout makes a good transition into her blended family with a stepfather and new brother, makes new friends in a completely different system, understands different religious and cultural belief systems, and defines a place for herself where she feels secure and confident about her future. As the first children’s show actually filmed on location in an African animal reserve, “Scout’s Safari” will expose the audience to factually accurate content about threats to the natural environment and preserving animal species in their natural",2,N/A,N/A,N/A
2002,KNBC,NBC,Los Angeles,3,Analog,STRANGE DAYS AT BLAKE HOLSEY HIGH,Core,Network,"Saturday, 10:30AM - 11:00AM",10,3,30,9,14,"STRANGE DAYS AT BLAKE HOLSEY HIGH focuses on a group of five young teens who are students at a very unusual boarding school. Strange phenomena happen at the school, and our kids are members of a science club that decides, with the help of their professor, to figure it all out. The initiator of many of their investigative processes is the newest student to the school, Josie Trent. In exploring the larger mystery of why the phenomena occur, our kids also deal with issues relating to their socio-emotional development. The educational goal of the program is to embed scientific content in a narrative story with strong socio-emotional messages. In each episode, one of the main characters models a learning process that relates to their social competence. Each episode also explores science content that relates to resolving an immediate problem or some aspect of the larger mystery. Specific objectives are to expose the audience to content about the physical sciences, such as black holes, worm holes, vortexes, gravity, electricity, satellite transmissions and radio frequencies. Through the characters’ experiments, the audience is exposed to the scientific method, hypothesis testing and analysis of data. Other objectives are to model the development of group cohesion, teamwork, and social competence within the group and between the group and other significant people in their lives.",3,N/A,N/A,N/A
2002,KNET,N/A,Los Angeles,3.5,Analog,SUPER BOOK (SPANISH LANGUAGE),Core,Syndicated,"M-F 7:00 AM,Sat 7:30 AM,Sat 7:00AM",69,1,30,3,10,"Superbook is a weekly educational series for ages 3 and up designed to entertain and educate various age groups on historical and biblical events. Superbook focuses on positive behavioral and cognitive messages portrayed by the re-telling of these events. Children are able to understand history from a different dimension and relate to the animated characters. From a developmental perspective, the ability to educate young children with Superbook is made easy by taking advantage of the visual and educative appeal of the characters. Children are reinforced and motivated by lessons of love, faithfulness, honesty, and integrity. 1) It is specifically designed to meet the educational and informational needs of children under the age of 16. 2) It airs during core hours. 3) It is regularly scheduled. 4) It is 30 minutes in length.",0,N/A,N/A,N/A
2002,KNET,N/A,Los Angeles,3.5,Analog,FLYING HOUSE (SPANISH LANGUAGE),Core,Syndicated,"Sat 7:00AM & 7:30 AM, 12/7-28 only 7:30 AM",22,0,30,3,10,"Flying House is a weekly educational series designed for children ages 3-10. It has been uniquely produced to provide entertainment and education for the entire family by using intriguing characters to reinforce positive values, teach behavior modificiation skills, and illustrate stories based on history. Flying House uses the creativity of animation to educate school age children on historical events and expand their ability to memorize these events. 1) It is specifically designed to meet the educational and informational needs of children under the age of 16. 2) It airs during core hours. 3) It is regularly scheduled. 4) It is 30 minutes in length.",99,N/A,N/A,N/A
2002,KPXN,PAX TV,Los Angeles,3,Analog,MIRACLE PETS,Core,Network,Fridays / October 4th - December 27th - 1:00 p.m. PT,13,0,60,13,16,"Miracle Pets is a one (1) hour live-action program. This show is designed to meet the educational and informational needs of children between the ages of 13 and 16. Each episode explores different short re-enactments of pets/animals doing heroic, extraordinary actions. Children learn postive role models, pro-social values and the importance of taking care of the pets in their lives.",99,N/A,N/A,N/A
2002,KPXN,PAX TV,Los Angeles,3,Analog,UNBELIEVABLE ANIMAL RESCUES,Core,Network,Sundays / October 6th - October 27th - 5:00 p.m. PT,4,0,60,13,16,"Unbelievable Animal Rescues is a one (1) hour live-action program. This show is designed to meet the educational and informational needs of children between the ages of 13 and 16. Each episode explores different short re-enactments of pets/animals resuing people and other animals from danger. Children learn positive role models, pro-social values, safety and animal protection.",99,N/A,N/A,N/A
2002,KPXN,PAX TV,Los Angeles,3,Analog,MIRACLE PETS,Core,Network,Sundays / November 3rd - December 29th - 5:00 p.m. PT,9,0,60,13,16,"Miracle Pets is a one (1) hour live-action program. This show is designed to meet the educational and informational needs of children between the ages of 13 and 16. Each episode explores different short re-enactments of pets/animals doing heroic, extraordinary actions. Children learn postive role models, pro-social values and the importance of taking care of the pets in their lives.",99,N/A,N/A,N/A
2002,KPXn,PAX TV,Los Angeles,3,Analog,MIRACLE PETS,Core,Network,Sundays / October 6th - December 29th - 6:00 p.m. PT,13,0,60,13,16,"Miracle Pets is a one (1) hour live-action program. This show is designed to meet the educational and informational needs of children between the ages of 13 and 16. Each episode explores different short re-enactments of pets/animals doing heroic, extraordinary actions. Children learn postive role models, pro-social values and the importance of taking care of the pets in their lives.",99,N/A,N/A,N/A
2002,KRCA,N/A,Los Angeles,3,Analog,EL NUEVO MUNDO SALVAJE CON LORNE GREEN,Core,Syndicated,"Monday - Saturday, 7am - 7:30 am",79,0,30,10,16,"This program is educational and intended to inform children 16 years of age and under. It airs at 7AM Monday through Saturday, 30 minutes in length. The series is an award winning wildlife program of up close looks where civilazation and wilderness meet, revealing both the best and the worst of the laws of nature and teaching children about animals and the environment.",99,N/A,N/A,N/A
2002,KSCI,N/A,Los Angeles,3,Analog,KISS!KISS!KISS!,Core,Syndicated,Monday-Thursday 8:00am-8:30am,52,0,30,4,6,"Educational and Informational Objective: This program combines live action with animation and music (sing-alongs) to provide education and instruction in a variety of areas of value to children in the age group (both scholastic and practical skills). This program is in Korean. Based on content, airtime and length, the program meets points 1-4. It is included in this form to meet point 5 and is reported to program publishers as educational to meet point 6.",99,N/A,N/A,N/A
2002,KSCI,N/A,Los Angeles,3,Analog,PONKIKKEES,Core,Syndicated,Fridays 8:00am-9:00am,13,0,60,3,8,"Educational and informational objective: This program is in Japanese with Japanese subtitling for hearing-impaired viewers and incorporates animation, puppets, musical sing-alongs, children and various lively hosts to teach children viewers about a wide variety of subjects including family values, behavior, exercise, basic math and language skills. This program meets all the points (1-6) as required.",99,N/A,N/A,N/A
2002,KSFV,N/A,Los Angeles,3,Analog,SUPER BOOK (SPANISH LANGUAGE),Core,Syndicated,"M-Fri 3:30 PM Oct 1 - Oct 31, 2002",23,0,30,3,10,"Superbook is a weekly educational series for ages 3 and up designed to entertain and educate various age groups on historical and biblical events. Superbook focuses on positive behavioral and cognitive messages portrayed by the re-telling of these events. Children are able to understand history from a different dimension and relate to the animated characters. From a developmental perspective, the ability to educate young children with Superbook is made easy by taking advantage of the visual and educative appeal of the characters. Children are reinforced and motivated by lessons of love, faithfulness, honesty, and integrity. 1) It is specifically designed to meet the educational and informational needs of children under the age of 16. 2) It airs during core hours. 3) It is regularly scheduled. 4) It is 30 minutes in length.",99,N/A,N/A,N/A
2002,KSFV,N/A,Los Angeles,3,Analog,FLYING HOUSE (SPANISH LANGUAGE),Core,Syndicated,M-F 3:30PM 11/1-12/31/02 & Sat 7:00AM,56,0,30,3,10,"Flying House is a weekly educational series designed for children ages 3-10. It has been uniquely produced to provide entertainment and education for the entire family by using intriguing characters to reinforce positive values, teach behavior modificiation skills, and illustrate stories based on history. Flying House uses the creativity of animation to educate school age children on historical events and expand their ability to memorize these events. 1) It is specifically designed to meet the educational and informational needs of children under the age of 16. 2) It airs during core hours. 3) It is regularly scheduled. 4) It is 30 minutes in length.",99,N/A,N/A,N/A
2002,KSKJ-CA,N/A,Los Angeles,7.01,Analog,NEW ZOO REVUE SERIES,Core,Syndicated,MON-SUN 6:00-7:00 A.M. P.T.,84,0,60,3,10,"The story of five characters Henrietta the hippo, Freddie the Frog, Charlie the Owl, Emma Jo, and Doug as they use laughter and song to triumph over everyday life challenges and struggles. Series episodes features Health, School, and Knowledge.",99,N/A,N/A,N/A
2002,KSKJ-CA,N/A,Los Angeles,7.01,Analog,THE NEW ZOO REVUE SERIES,Non-core,Syndicated,MON-SUN 6:00-7:00 A.M. P.T.,84,0,60,3,10,"Five charactors teach the meaning of patience, advice , and responibility through situations with song and dance. Series episodes feature Health,School, and Knowledge.",99,N/A,N/A,N/A
2002,KSKP-CA,N/A,Los Angeles,7.01,Analog,NEW ZOO REVUE SERIES,Core,Syndicated,MON-SUN 6:00-7:00 A.M. P.T.,84,0,60,3,10,"The story of five characters Henrietta the hippo, Freddie the Frog, Charlie the Owl, Emma Jo, and Doug as they use laughter and song to triumph over everyday life challenges and struggles. Series episodes features Health, School, and Knowledge.",99,N/A,N/A,N/A
2002,KSKP-CA,N/A,Los Angeles,7.01,Analog,THE NEW ZOO REVUE SERIES,Non-core,Syndicated,MON-SUN 6:00-7:00 A.M. P.T.,84,0,60,3,10,"The story of five characters Henrietta the hippo, Freddie the Frog, Charlie the Owl, Emma Jo, and Doug as they use laughter and song to triumph over everyday life challenges and struggles. Series episodes features Health, School, and Knowledge.",99,N/A,N/A,N/A
2002,KSKT-CA,N/A,Los Angeles,7.01,Analog,NEW ZOO REVUE SERIES,Core,Syndicated,MON-SUN 6:00-7:00 A.M. P.T.,84,0,60,3,10,"The story of five characters Henrietta the hippo, Freddie the Frog, Charlie the Owl, Emma Jo, and Doug as they use laughter and song to triumph over everyday life challenges and struggles. Series episodes features Health, School, and Knowledge.",99,N/A,N/A,N/A
2002,KSKT-CA,N/A,Los Angeles,7.01,Analog,THE NEW ZOO REVUE SERIES,Non-core,Syndicated,MON-SUN 6:00-7:00 A.M. P.T.,84,0,60,3,10,"The story of five characters Henrietta the hippo, Freddie the Frog, Charlie the Owl, Emma Jo, and Doug as they use laughter and song to triumph over everyday life challenges and struggles. Series episodes features Health, School, and Knowledge.",99,N/A,N/A,N/A
2002,KTBN,TBN,Los Angeles,4.45,Analog,KIDS LIKE YOU - PERMANENTLY REPLACED BY DAVEY AND GOLIATH A/O 11-23-02,Core,Network,Saturday 7am,6,1,30,6,12,KIDS LIKE YOU educates and informs children between the ages of 6-12 by presenting challenging situations with solutions that develop character.,0,N/A,N/A,N/A
2002,KTBN,TBN,Los Angeles,4.45,Analog,THE REPPIES,Core,Network,Saturday 7:30am & 10am,24,2,30,3,9,THE REPPIES educates and informs children between the ages of 3 - 9 on valuable life lessons as it explores the decision making process of the important and sometimes difficult choices that children encounter.,0,N/A,N/A,N/A
