Year,Call Sign,Network Affiliation,Nielsen DMA,Ave. # of Analog hours,Analog or Digital,Title of Program,Core or Non-core,Origin of Program,Regular schedule of Program,Total times aired,Number of pre-emptions,Length of Program (in minutes),Age of Target Audience From,Age of Target Audience To,Description of Program,Number of pre-emptions rescheduled,Ave. # of hours of all digital programming per week,Ave. # of hours per week of digital Core Programming per week,Y or N to Q 11 in Digital Core Programming: At least 50% of the Core Programming had not already aired within the previous seven days
2002,KABC-TV,ABC-TV,Los Angeles,3,Analog,DISNEY'S TEAMO SUPREMO,Core,Network,Saturdays/7:00-7:30 AM PT,10,3,30,7,10,"“Disney's Teamo Supremo” feature three elementary school children who are superheroes. Crandall, Brenda and Hector (a Hispanic boy) possess high-tech tools, which give them extraordinary physical powers. These enable them to help the state Governor and Chief of Police to restore law and order threatened by villains or criminals and those who would exploit the innocent or weak. Working as a team, the children use their wits to foil and apprehend evildoers, yet they must still do their homework and finish household chores when a Teamo adventure is done! The series features plots that depict flexible thinking, problem solving and positive values. Among the values that this series explores are: facing fears and self-doubt, standing up for one’s beliefs, dealing with peer pressure, relating to authority, dealing with rules/fairness, appreciating differences, maintaining loyalty to family, and persevering. Note: The episode rescheduled for 10/26/02 at 4:00 PM was joined in progress 19:59 late due to an unanticipated overrun in the college football game that preceded it.",3,N/A,N/A,N/A
2002,KABC-TV,ABC-TV,Los Angeles,3,Analog,DISNEY'S RECESS,Core,Network,Saturdays/7:30-8:00 AM PT,10,3,30,8,12,"""Disney's Recess"" is a collection of stories about six fourth-grade children who attend public school. These children are an ethnically diverse and gender-diverse group. Their experiences at Third Street School deliver messages about problems common to middle childhood: conflicts with authority figures, school and family rules, issues of fairness, peer pressure and coping with disappointment. A number of episodes revolve around class bullies or conflicts with teachers' favored students. Series episodes provide opportunities for parent/child discussions about values.",3,N/A,N/A,N/A
2002,KABC-TV,ABC-TV,Los Angeles,3,Analog,DISNEY'S FILLMORE,Core,Network,Saturdays/8:00-8:30 AM PT,10,3,30,9,12,"“Fillmore!” is a detective series that takes place in a middle school. The stars of the stories are the members of X Middle School’s Safety Patrol, a multi-ethnic group of youth who wear the orange sash and badge of peer authority. They investigate and foil misdeeds in the school setting. Cornelius Fillmore, a boy with a history of disciplinary problems, upon entering X Middle School, resolved to change his ways. He joined the Safety Patrol, focusing keen problem-solving skills and physical prowess in service of order and fairness. His Safety Patrol partner, the brilliant Ingrid Third, had also had disciplinary problems. She had attended a number of schools. Ingrid and Fillmore work to detect clues as to the identity of perpetrators of school mischief such as bullying, cheating, theft, graffiti, scams, and prejudicial behavior. Series episodes illustrate developmentally appropriate issues, among which are competition and peer pressure, coping with change, improving relationships with teachers and administrators, and dealing with family rules. Within the mystery plots are woven messages about honor, conscience and trust.",3,N/A,N/A,N/A
2002,KABC-TV,ABC-TV,Los Angeles,3,Analog,DISNEY'S RECESS,Core,Network,Saturdays/8:30-9:00 AM PT,10,3,30,8,12,"""Disney's Recess"" is a collection of stories about six fourth-grade children who attend public school. These children are an ethnically diverse and gender-diverse group. Their experiences at Third Street School deliver messages about problems common to middle childhood: conflicts with authority figures, school and family rules, issues of fairness, peer pressure and coping with disappointment. A number of episodes revolve around class bullies or conflicts with teachers' favored students. Series episodes provide opportunities for parent/child discussions about values.",3,N/A,N/A,N/A
2002,KABC-TV,ABC-TV,Los Angeles,3,Analog,LIZZIE MCGUIRE,Core,Network,Saturdays/9:00-9:30 AM PT,10,3,30,9,12,"""Lizzie McGuire"" is the story of an ingenious twelve-year-old girl who attends an ethnically diverse middle school. Her best friends are Miranda, a feisty Hispanic girl, and a boy named Gordo. Lizzie has a gifted younger brother who is frequently the source of conflict. Their parents handle their children's crises with humor and affection. Stories are realistic, revolving around school issues, rules, peer pressure, the struggle to find a comfortable identity, trust, facing one's mistakes, and the emotional ups-and-downs of pre-adolescence. Particular strengths of this series are its believability and the creation of a live action series that features a strong, positive girl in the lead role.",3,N/A,N/A,N/A
2002,KABC-TV,ABC-TV,Los Angeles,3,Analog,THE PROUD FAMILY,Core,Network,Saturdays/9:30-10:00 AM PT,10,3,30,10,13,"“The Proud Family” revolves around the daily activities of fourteen-year-old Penny Proud and her African-American family consisting of parents Trudy Proud (a veterinarian) and Oscar Proud (self-employed businessman), a no-nonsense Grandmother Suga Mama who resides with the family, twin sisters BeBe and CeCe. Penny’s friends Dijonay and Sticky, and the neighboring Boulevardez family, whose daughter, La Cienega, is Penny’s rival. Teachers and classmates also populate the stories. The majority of the characters in this children’s series are ethnic minorities. Penny faces the struggles of adolescence along with the challenge of balancing academic life (middle school) and home obligations. Series episodes explore issues particularly relevant to 10 to 13 year olds: maintaining social relationships, overcoming self-doubt, standing up for one’s beliefs, dealing with peer pressure, relating to authority and rules, assuming responsibility, appreciating differences (gender, race, and generational), maintaining loyalty to family, and cultivating values such as honesty and persistence.",3,N/A,N/A,N/A
2002,KABC-TV,ABC-TV,Los Angeles,3,Analog,"BOO! TO YOU, TOO, WINNIE THE POOH!",Non-core,Network,10/25/2002 / 8:30-9:00 PM PT,1,0,30,3,6,Pooh and the gang endure a wild adventure through the 100 Acre Wood as they help Piglet overcome his fear of Halloween.,99,N/A,N/A,N/A
2002,KABC-TV,ABC-TV,Los Angeles,3,Analog,A WINNIE THE POOH THANKSGIVING,Non-core,Network,11/21/2002 / 8:30-9:00 PM PT,1,0,30,3,6,"This special follows Pooh and the gang's antics on a wild search for the ingredients for a perfect Thankgiving feast. When the search goes awry, Pooh and his pals frantically assemble a hysterically untraditional holiday dinner - and ultimately learn that Thanksgiving is about being thankful for what you have, not what you think you should have.",99,N/A,N/A,N/A
2002,KABC-TV,ABC-TV,Los Angeles,3,Analog,THE AMERICAN ATHLETE,Non-core,Syndicated,Saturday's 5:30-6:00AM-PT plus misc. times as a second run on Saturday or Sunday when possible.,19,1,30,8,16,The American Athlete is a program designated to excite older children and teenagers into the world of sports. Interviews with major sports figures and interactivity with ost: Byron Allen highlight the program.,1,N/A,N/A,N/A
2002,KAZA,Azteca America,Los Angeles,3,Analog,CHATO Y SUS AMIGOS,Core,Network,Sat/Sun 7A-830A,26,0,90,2,7,"The educational and informational purpose of ""Chato y Sus Amigos"" is to teach children, utilizing puppets, about values, such as friendship, caring about family and nature. In addition, it strengthens math skills, such as counting, addition, subtraction, multiplication and divisiion, and identification of geometric figures.",99,N/A,N/A,N/A
2002,KCAL,N/A,Los Angeles,3,Analog,CRITTER GITTERS,Core,Syndicated,"Saturday, 7:00am",13,0,30,9,14,"In this series, a group of neighborhood kids join forces with two veterinarians and an inventive professor to become a search and rescue unit, a detective agency and a police force for animals. The ""Critter Gitters"" solve moral and ethical dilemas that face children in everyday life.",99,N/A,N/A,N/A
2002,KCAL,N/A,Los Angeles,3,Analog,WILD ABOUT ANIMALS,Core,Syndicated,"Saturday, 2:30pm and Sunday , 1:30pm",24,2,30,13,16,"""Wild About Animals"" is a magazine series designed to educate and inform children. Host, Mariette Hartly, brings them interesting and entertaining stories about the world's most fascinating animals. Each episode consists of at least four stories designed to teach children about the exotic and unique animals from the wild, as well as to educate them further about animals they see everyday.",2,N/A,N/A,N/A
2002,KCAL,N/A,Los Angeles,3,Analog,AWESOME ADVENTURES,Core,Syndicated,"Saturday, 2:00pm",12,1,30,13,16,"""Awesome Adventures"" is designed to educate, inform, and entertain children 16 and under about the world around them. Each journey is a lesson in the beauty of nature, its creatures, and the people who inhabit the land. The show is designed to make learning fun.",1,N/A,N/A,N/A
2002,KCAL,N/A,Los Angeles,3,Analog,JACK HANNA'S ANIMAL ADVENTURE,Core,Syndicated,"Sunday, 1pm and 2pm",23,3,30,13,16,"""Jack Hanna's Animal Adventures"" is a live-action program. In each episode the camera follows Jack as he spends time with nature's creatures across the continents. Jack talks with people that are knowledgeable about each animal and habitat. He teaches and reveals to children the world around them in a way that presents positive animal role models and pro-social values within an environmentally responsible universe.",3,N/A,N/A,N/A
2002,KCBS,CBS,Los Angeles,3,Analog,BLUE'S CLUES,Core,Network,"SATURDAY, 7-7:30AM",13,0,30,2,5,"In this series, a young adult host - together with Blue, a puppy whose personality and actions mirror those of a preschooler - brings viewers a variety of games, themes and concepts that are based on an age-appropriate educational curriculum. The program follows a narrative format, in which the host elicits contributions from the viewer to answer questions and move the action forward. The program's objectives include encouraging preschoolers to actively explore the world around them, fostering their problem-solving skills and independent reasoning, and creating a foundation of confidence and optimism for future learning. This program is specifically designed to further the educational and informational needs of children, has educating and informing children as a significant purpose, and otherwise meets the definition of Core Programming as specified in the Commission's rules.",99,N/A,N/A,N/A
2002,KCBS,CBS,Los Angeles,3,Analog,DORA THE EXPLORER,Core,Network,"SATURDAY, 7:30-8AM",13,0,30,2,5,"In this series seven-year-old Dora and her monkey travel companion Boots invite the audience to join them each week on a journey in which they will have to overcome various obstacles to reach an end goal. The series uses a CD-ROM/on-line adventure game format to encourage a variety of problem-solving strategies. The objectives of this program are to assist children in developing their problem-solving skills, reinforce their emerging cognitive skills, and make computers more familiar to them by introducing and using the conventions and vocabulary of computer games. This program is specifically designed to further the educational and informational needs of children, has educating and informing children as a significant purpose, and otherwise meets the definition of Core Programming as specified in the Commission's rules.",99,N/A,N/A,N/A
2002,KCBS,CBS,Los Angeles,3,Analog,HEY ARNOLD!,Core,Network,"SATURDAY, 8-8:30AM",13,0,30,6,11,"This series revolves around the adventures of nine-year-old Arnold, who lives in his grandparents' boarding house, where he must interact with a group of eccentric boarders, as well as with his friends and other neighborhood children. Arnold uses his creativity, resourcefulness and calm to deal with the issues presented by life as a fourth grader in the big city. The objectives of this series are to help elementary school aged children to acquire better personal and social development skills through life-lessons, themes and stories that will cause them to think, assess, explore and monitor their own behavior, and to introduce them to a variety of people and issues in order to provide them with a springboard for understanding experiences in their own lives. This program is specifically designed to further the educational and informational needs of children, has educating and informing children as a significant purpose, and otherwise meets the definition of Core Programming as specified in the Commission's rules.",99,N/A,N/A,N/A
2002,KCBS,CBS,Los Angeles,3,Analog,THE WILD THORNBERRYS,Core,Network,"SATURDAY, 8:30-9AM",13,0,30,6,11,"This program follows the travels of Eliza Thornberry, whose parents produce nature documentaries and wander the globe in search of exotic places, plants and animals. Eliza has the ability to talk to animals, and her special gift allows her to see and understand the natural world in a very close and personal way. The objectives of the program are to help children learn concepts related to plants, animals and general ecology, and to experience the family interactions of children with parents who are committed to intellectual pursuits and have unique lifestyles. This program is specifically designed to further the educational and informational needs of children, has educating and informing children as a significant purpose, and otherwise meets the definition of Core Programming as specified in the Commission's rules.",99,N/A,N/A,N/A
2002,KCBS,CBS,Los Angeles,3,Analog,AS TOLD BY GINGER,Core,Network,"SATURDAY, 9-9:30AM & SATURDAY, 9:30-10AM",9,4,30,6,11,"This series is about the life of junior high school students as seen through the eyes of Ginger, a sixth grader who attempts to navigate between the worlds of popular and unpopular cliques. Ginger's analytic nature allows her to critique the prevailing social hierarchy, while also understanding the desire to be accepted. The objective of the program is to assist children in analyzing, interpreting and successfully negotiating early individual and group experiences that they may have in their families, schools and communities. This program is specifically designed to further the educational and informational needs of children, has educating and informing children as a significant purpose, and otherwise meets the definition of Core Programming as specified in the Commission's rules.",4,N/A,N/A,N/A
2002,KCBS,CBS,Los Angeles,3,Analog,PELSWICK,Core,Network,"SATURDAY, 9:30-10AM",6,2,30,6,11,"Pelswick is a smart, mischievous leader of a close group of friends. He is also confined to a wheelchair because of an automobile accident, but refuses to allow this fact to prevent him from being fully integrated into the life of his community or from taking on challenges and risks. Pelswick's advisor and mentor is an irreverent, spiritual figure named Mr. Jimmy, who appears only to Pelswick. The objectives of the program are to teach children that a handicapping condition does not preclude a life full of the same types of successes and disappointments experienced by any other person, and to present to children through the behavior and emotions of the characters some of the social issues they may face. This program is specifically designed to further the educational and informational needs of children, has educating and informing children as a significant purpose, and otherwise meets the definition of Core Programming as specified in the Commission's rules.",2,N/A,N/A,N/A
2002,KCBS,CBS,Los Angeles,3,Analog,HEY ARNOLD!,Core,Network,"SATURDAY, 9-9:30AM",4,1,30,6,11,"This series revolves around the adventures of nine-year-old Arnold, who lives in his grandparents' boarding house, where he must interact with a group of eccentric boarders, as well as with his friends and other neighborhood children. Arnold uses his creativity, resourcefulness and calm to deal with the issues presented by life as a fourth grader in the big city. The objectives of this series are to help elementary school aged children to acquire better personal and social development skills through life-lessons, themes and stories that will cause them to think, assess, explore and monitor their own behavior, and to introduce them to a variety of people and issues in order to provide them with a springboard for understanding experiences in their own lives. This program is specifically designed to further the educational and informational needs of children, has educating and informing children as a significant purpose, and otherwise meets the definition of Core Programming as specified in the Commission's rules.",1,N/A,N/A,N/A
2002,KCOP,UPN,Los Angeles,3,Analog,DISNEY'S RECESS,Core,Network,M-F at 8am (10/1-12/31) and Sundays at 8:30am (10/6-12/29),79,0,30,2,11,"Disney's Recess is designed to educate and inform children who are between the ages of two and eleven. More specifically, the series teaches children about the fundamentals, morals and educational lessons of life.",99,N/A,N/A,N/A
2002,KDOC,N/A,Los Angeles,5,Analog,SAVED BY THE BELL,Core,Syndicated,M-F 3pm & 4:30pm,130,2,30,14,16,"The characters discover the fun and frustrations of high school life, and each episode is told through the teen's point of view. Common themes among the episodes include peer pressure, self-esteem, tolerance and acceptance.",0,N/A,N/A,N/A
2002,KDOC,N/A,Los Angeles,5,Analog,ANYPLACE WILD,Core,Syndicated,Saturday 6:30-7pm,11,0,30,14,16,Takes teens to a new wilderness destination for self-propelled travel in some of the world's most spectacular places.,99,N/A,N/A,N/A
2002,KDOC,N/A,Los Angeles,5,Analog,THE PET PLACE,Non-core,Local,Sat. 7:30am,13,0,30,13,18,A program that aims to educate adults and children alike on the growing population of stray pets and the importance of pet care.,99,N/A,N/A,N/A
2002,KFTR,Telefutura programming service*,Los Angeles,15.4,Analog,EL NUEVO MUNDO DE LOS GNOMOS,Core,Network,SU & SA 07:00AM 100502-100602,2,0,30,7,11,"A significant purpose and key educational objective of this half-hour program is an appreciation for Mother Nature. Through the activities of the Gnomes, children learn to protect endangered species, create and preserve protected areas, and address global threats to the environment.",99,N/A,N/A,N/A
2002,KFTR,Telefutura programming service*,Los Angeles,15.4,Analog,ANATOLE,Core,Network,SU & SA 08:00AM 100502-100602,2,0,30,7,11,"A significant purpose and key educational objective of this half-hour program is to promote a better understanding of other people. Through the efforts of Anatole, a mouse, and his family, children learn how he tries to understand humans and tries to get humans to understand him. Children can learn to accept, value, and appreciate the competencies and differences in others, leading to the development of openness, trust, and mutual respect, and to value the positive aspects of a strong family unit.",99,N/A,N/A,N/A
2002,KFTR,Telefutura programming service*,Los Angeles,15.4,Analog,EL LAGARTIJO DE NED,Core,Network,SU & SA 08:30AM 100502-100602; SU & SA 07:00AM 101202-122902,26,0,30,7,12,"A significant purpose and key educational objective of this half-hour program is to illustrate problem solving and sharing. Ned feeds his pet newt ""Zippo Newt Food"" and turns it into a five hundred-pound monster called Newton, the most mischievous, gluttonous, and empathetic playmate ever. Newton can camouflage himself to avoid detection, and he is Ned's pal for life. But just when Ned needs giant Newton the most, the newt shrinks down to four inches again. Ned's and Newton's adventures with Ned's parents, friends, and the school bully teach young viewers about responsibility, friendship, sharing, and problem-solving.",99,N/A,N/A,N/A
2002,KFTR,Telefutura programming service*,Los Angeles,15.4,Analog,GUERREROS MITICOS,Core,Network,SU & SA 09:30AM 100502-100602; SU & SA 07:30AM 101202-102702; SU & SA 08:30AM 110202-122902,26,0,30,7,12,"A significant purpose and key educational objective of this half-hour program is to teach children about basic lessons about truth, honor, courage, and love through the time honored tales of Greek myths. Through the adventures of these heroes, children not only learn important moral lessons but also learn about an ancient culture.",99,N/A,N/A,N/A
2002,KFTR,Telefutura programming service*,Los Angeles,15.4,Analog,CADILLACS Y DINOSAURIOS,Core,Network,SU & SA 08:00AM 101202-102702; SU & SA 09:00AM,24,0,30,7,12,"A significant purpose and key educational objective of this half-hour program is to illustrate the importance of nature and caring for the environment. In the world of the 26th century, dinosaurs roam the earth with humans and classic cars race woolly mammoths. Through the show children learn how humans can learn to live and co-exist peacefully with nature.",99,N/A,N/A,N/A
2002,KFTR,Telefutura programming service*,Los Angeles,15.4,Analog,CUENTOS DE LA CRIPTA,Core,Network,SU & SA 08:30AM 101202-102702; SU & SA 09:30AM,24,0,30,7,12,"In this half-hour show fanciful characters, such as the Old Witch, the Mummy, the Werewolf, and the Vampire, take children on a journey through the outrageous world of the crypt and on the journey introduce a variety of educational subjects and messages.",99,N/A,N/A,N/A
2002,KFTR,Telefutura programming service*,Los Angeles,15.4,Analog,LOS CONEJITOS TORPES,Core,Network,SU & SA 07:30AM 110202-122902,18,0,30,5,10,"A significant purpose and key educational objective of this program is to illustrate the importance of family and working together to overcome mistakes. Throughout the shows, the Dumb Bunny family gets into various problems and adventures, but always manage to work together to solve their problems.",99,N/A,N/A,N/A
2002,KFTR,Telefutura programming service*,Los Angeles,15.4,Analog,WIDGET,Core,Network,SU & SA 08:00AM,18,0,30,7,12,"A significant purpose and key educational objective of this program is to teach about interacting with cultures other than your own and learning to act independently. When Widget, a friendly extra-terrestrial, is stranded on Earth, he must learn to survive on his own. Throughout the show, Widget’s adventures teach him about keeping an open mind, perseverance, learning from those around him, and taking care of himself.",99,N/A,N/A,N/A
2002,KFTR,Telefutura programming service*,Los Angeles,15.4,Analog,MI TELE: CARRUSEL,Core,Network,"M-F 07:00AM' ,M-F 08:00AM",48,1,60,7,12,"This children's novella about a teacher and her students focuses on the many issues facing school-aged children. It appeals to the cognitive interests of elementary school children by presenting these issues in the school setting to which viewers of this age can relate, as well as through humorous situations. The program teaches young viewers about sharing, compassion, and tolerance as well as many other pro-social lessons about human relationships between the teacher and her students and among the students themselves. For example, as the episodes unfold, in the beginning the students play practical jokes on their teacher, but over time, the students learn to respect their teacher and view her as a role model. Through many other adventures, the students also teach viewers about love, respect, racial discrimination, and family values.",0,N/A,N/A,N/A
2002,KFTR,Telefutura programming service*,Los Angeles,15.4,Analog,GOTITA DE AMOR,Core,Network,M-F 08:00AM,19,0,60,7,12,"A significant purpose and key educational objective of this program is to show the importance of determination, hope and love. Chabelita, a six-year-old girl, has experienced a life of loss and difficultly but is still able to persevere and continue on toward her dreams. Throughout the shows, Chabelita demonstrates individuality, problem solving and creativity to overcome the difficulties in her life and find happiness.",99,N/A,N/A,N/A
2002,KFTR,Telefutura programming service*,Los Angeles,15.4,Analog,COMPLICES AL RESCATE,Core,Network,M-F 06:00PM,63,3,60,7,12,"A significant purpose and key educational objective of this program is to illustrate how friendship, love and kindness can help overcome life’s adversities. Complices al Rescate (“Friends to the Rescue”) follows the lives of two eleven-year-old girls, Silvana and Mariana, who have both experienced sadness, loss, and injustice in their lives. Throughout the shows, the girls learn to appreciate that happiness is not found in popularity and money, but in true friendship, goodwill toward others and love.",0,N/A,N/A,N/A
2002,KFTR,Telefutura programming service*,Los Angeles,15.4,Analog,RAYITO DE LUZ,Non-core,Network,M-F 08:00AM,13,2,60,7,12,A significant purpose and key educational objective of this program is to show the importance of community and perseverance during trial. Rayito de Luz is a Christmas holiday story of a newborn child abandoned at a seminary and the love and dedication of Father Cervantes to care for the child with help of the entire community.,N/A,N/A,N/A,N/A
2002,KHIZ-TV,N/A,Los Angeles,3,Analog,JACK HANNA'S ANIMAL ADVENTURES,Core,Syndicated,Mondays @ 5 p.m.,14,0,30,5,18,"Cameras follow animal entusiast Jack Hanna & his daughter through adventures teaching children about various animal species, thier habitats, animal behavior, and what to do to aid and protect all animals.",99,N/A,N/A,N/A
