1999,KWHY-TV,N/A,Los Angeles,3,Analog,NEW ZOO REVUE,Core,Local,SATURDAYS 7:00 AM 7:30 AM,13,0,30,3,12,"NEW ZOO REVUE TEACHES CHILDREN ABOUT LIFE AND DEALS WITH IMPORTANT SITUATIONS, PROBLEM SOLVING, AND OPPORTUNITIES TO GROW. THEY USE MUSIC, SONG, AND DANCE TO MAKE THE LEARNING PROCESS MORE INTERESTING, FUN AND RETENTIVE TO YOUNG MINDS. TOPICS SUCH AS SELF RESPECT, PATIENCE, SHARING, OVERCOMING FEARS, ETC. THE PROGRAM FEATURES CHARMING HUMAN CHARACTERS (DOUG, AMY JO, FREDDY THE FROG, CHARLIE THE OWL, ETC.) WHO VALUE LEARNING, THINKING, AND THOUGHTFULNESS AS A MEANS TO ADDRESS DAY TO DAY SITUATIONS AND PROBLEM SOLVING.",99,N/A,N/A,N/A
1999,KWHY-TV,N/A,Los Angeles,3,Analog,CARIBOU KITCHEN/MI GRAN AMIGO,Core,Local,SUNDAYS 7:00 AM - 8:00 AM,13,0,60,3,8,"THIS BLOCK OF SPANISH LANGUAGE ENGLISH PROGRAMMING COMBINES ANIMATION AND LIVE ACTION SEGMENTS WITH FUN ANIMAL FRIENDS THAT TEACH CHILDREN LESSONS ABOUT SHARING, TELLING THE TRUTH, PROBLEM SOLVING, SOCIAL SKILLS, AND MORE. SMART, HUMOROUS, CARING ANIMAL CHARACTERS LIKE ""AZUL THE DRAGON,"" ""ABE THE ANTEATER,"" ""BETTY BEAVER,"" AND OTHERS USE ACTION, STORIES, MUSIC, AND HUMOR TO HELP KIDS RETAIN IMPORTANT EDUCATIONAL VALUES.",99,N/A,N/A,N/A
1999,KWHY-TV,N/A,Los Angeles,3,Analog,BIZBERIJE/INTERCIENCIA,Core,Local,SUNDAYS 8:00AM - 9:00,13,0,60,7,16,"DESIGNED TO EDUCATE AND STIMULATE THINKING, BIZBERIJE AWAKENS YOUNG IMAGINATIONS, CURIOUSITY, AND OTHER LEARNING FACULTIES IN KIDS WITH SCIENTIFIC EXPERIMENTS, KIDS REPORTING CRAFTS, BRAIN TEASERS AND OTHER COMPELLING LEARNING TOOLS. INTERSCIENCIA OFFERS AN AMAZING JOURNEY THROUGH THE WORLDS OF MUSIC, EARTH, ECOLOGY, SPACE, MATH, AND HISTORY ON EACH PROGRAM THAT FOCUSES ON THE MANY DIMENSIONS OF ONE TOPIC. ALTHOUGH SCIENTIFIC IN NATURE, THE VISUAL STIMULATION, FASCINATING CONTENT OF THE PROGRAM, AND PACE KEEPS KIDS WATCHING AND LEARNING.",99,N/A,N/A,N/A
1999,KADY,UPN,Los Angeles,3,Analog,AWESOME ADVENTURES,Core,Syndicated,SATURDAYS 8 AM,13,0,30,12,16,Children are able to explore and experience the world around the globe from each journey. The lessons are about the beautyof nature and the people that inhabit it.,99,N/A,N/A,N/A
1999,KADY,UPN,Los Angeles,3,Analog,YOUNG AMERICA OUTDOORS,Core,Syndicated,SATURDAYS 7:30 AM,13,0,30,12,16,"Children are introduced to a fun way to enjoy and learn about the great outdoors. Thye learn safty tips, environmental issues and equipment needs.",99,N/A,N/A,N/A
1999,KADY,UPN,Los Angeles,3,Analog,DOUG,Core,Syndicated,MON-FRI 8:30 AM,60,0,30,2,11,"Each episode explores a diffrent ""kid Issues"" Doug's fantasies explore the best and worst possibilties inherent to a given situation. Doug chooses sincerity over superficiality.",99,N/A,N/A,N/A
1999,KADY,UPN,Los Angeles,3,Analog,WILD ABOUT ANIMALS,Core,Syndicated,SATURDAYS 7 AM,13,0,30,1,16,This show is designed for young people to learn about animals and their environment.,99,N/A,N/A,N/A
1999,KADY,UPN,Los Angeles,3,Analog,PEPPER ANNE,Non-Core,Syndicated,MON-FRI 7:30 AM,60,0,30,2,11,Children Learn about the daily going ons at school and are able to relate to the problems that occur and Pepper Anne solves along with her friends.,99,N/A,N/A,N/A
1999,KHSC-TV,N/A,Los Angeles,3,Analog,VEGETABLE SOUP,Core,Syndicated,SUNDAYS 7 AM,13,0,30,5,12,"A significant purpose of this half-hour magazine show is to educate and inform children ages 5-12 about human relations, language skills and science. The show features guest hosts who introduce studio, puppet and animated segments.",99,N/A,N/A,N/A
1999,KHSC-TV,N/A,Los Angeles,3,Analog,NEW ZOO REVUE,Core,Syndicated,SUNDAYS 7:30 AM,13,0,30,4,9,A significant purpose of this award-winning half-hour show is to educate and inform children ages 4-9 about cooperation and how to be caring and constructive citizens through the use of a musical comedy format. The show’s awards include endorsements by the NEA and by the National School Boards Association; a Four-Star Rating from the National PTA Review Board; and a Certificate of Quality from the California State PTA.,99,N/A,N/A,N/A
1999,KHSC-TV,N/A,Los Angeles,3,Analog,JACK HOUSTON IMAGINE LAND,Core,Syndicated,SUNDAYS 8 AM,13,0,30,4,9,"A significant purpose of this Telly award-winning half-hour program, aired on numerous PBS stations in all major markets, is to educate and inform children ages 4-9 about a wide spectrum of life experiences. Through live action and puppetry, singer-storyteller Jack Houston and the characters who live on his farm help children learn valuable life lessons: from the importance of reading to the importance of friends and everything in between.",99,N/A,N/A,N/A
1999,KHSC-TV,N/A,Los Angeles,3,Analog,MUSICAL ENCOUNTER,Core,Syndicated,SUNDAYS 8:30 AM & 9 AM,24,2,30,6,12,A significant purpose of this half-hour award-winning series is to educate and inform children ages 6-12 about a particular musical instrument or style of music. This show is designed to foster music appreciation in youngsters and was produced at and aired on several PBS stations in the United States.,N/A,N/A,N/A,N/A
1999,KHSC-TV,N/A,Los Angeles,3,Analog,YOUNG AMERICA OUTDOORS,Core,Syndicated,SUNDAYS 9;30 AM & MONDAYS 7 AM,14,2,30,13,16,A significant purpose of this half-hour program is to educate and inform children ages 13-16 about the environment and various outdoor activities they can enjoy with family and friends. Guests and experts share their knowledge to help children participate safely in the activities featured on the show.,N/A,N/A,N/A,N/A