1999,KJLA,N/A,Los Angeles,3,Analog,NANA PUDDIN',Core,Syndicated,Saturdays@8:30,3,0,30,4,11,"The Nana Puddin' series is a brand new chikdren;s program that is colorful,action packed,and full of wondrful surprises.Kids and their parents will be laughing along with the studio audience through fast-moving skits,songs and special featires. Nana puddin' features music,videos, games,informecial spoofs,pretend commercials, and fun, on-location segments are interwoven with solid messages that teach everyone, no matter the age,about positive choices and how to say yes to life.",99,N/A,N/A,N/A
1999,KJLA,N/A,Los Angeles,3,Analog,ELECTRIC PLAYGROUND,Core,Syndicated,Saturdays@9:00AM,12,0,30,13,16,"Electric Playground is an educational show that focuses on the world of computers, computer software, computer games and the Internet. It attempts to teach children more about computers and how they are forever changing the world as we know it.",99,N/A,N/A,N/A
1999,KJLA,N/A,Los Angeles,3,Analog,WILD'S LIFE,Core,Syndicated,Saturdays@9:30AM,12,0,30,4,12,"A Weekly series for children and their parents that explores the world of wildlife. Christopher Wild is surprised by his ""magic shell"" at the start of each show to find out his Wonder of the wild for the week. In order to solve the riddle, he must visit and learn about a plant, an animal and a fish and discover how they connect.",99,N/A,N/A,N/A
1999,KMEX-TV,Univision Programming Service*,Los Angeles,3.5,Analog,PLAZA SESAMO,Core,Network,SA/SU 08:00 AM,26,0,60,2,5,"Provides reading readiness training, early mathematics skills, education in health, hygiene and nutrition, and provides encouragement and stimulation for academic success. Produced by CTW specifically for a Spanish-language audience.",99,N/A,N/A,N/A
1999,KMEX-TV,Univision Programming Service*,Los Angeles,3.5,Analog,LA PINATA LOCA,Core,Network,SU 09:00 AM 10/3/99-10/31/99; SA 09:00 AM 11/6/99-12/25/99,12,1,60,6,11,"A showcase of the educational cartoons ""La Banda de Mozart"" and ""The Never Ending Story"". ""La Banda de Mozart"" (Mozart's Band) brings to children, in an auditive and explanatory way, the classical compositions of Mozart, Verdi, Chopin and Beethoven within the weekly plot portrayed. ""The Never Ending Story"" deals with many of the moral conflicts and fears that a growing up kid faces. It teaches family values and special relationships within the family and promotes the use of books as a fountain of learning and entertainment.",N/A,N/A,N/A,N/A
1999,KMEX-TV,Univision Programming Service*,Los Angeles,3.5,Analog,CARRUSEL DE LAS AMERICAS,Core,Network,SU 09:00 AM 11/7/99-12/26/99,8,0,60,6,11,"The cast of ""Carrusel"" embarks on an approximately 120 chapter history and geography lesson plan in which viewers learn with eager television classmates. The ""Carrusel"" curriculum focuses on the discovery of the Americas, dedicating chapters to discovers and historic personalities, such as Christopher Columbus, Simon Boliver, Father Hidalgo and Americo Vespuci, and historical events in Latin American history including the arrival of slaves in the Americas, the Mexican Revolution, the independence of Mexico and Central America and the arrival of the Portuguese in Brazil. The show also teaches children about the impact of the exploration and discovery of the Americas on both the conquerors and indigenous peoples. The series aims to teach all children of the Americas about their commonality rooted in their shared origins.",99,N/A,N/A,N/A
1999,KNBC,NBC,Los Angeles,3,Analog,SAVED BY THE BELL: THE NEW CLASS,Core,Network,SA 8:00AM - 8:30AM,12,1,30,13,16,"The educational objective of this program is to demonstrate how the knowledge of one or more characters in the story moves from one level to a more informed or higher level of knowledge by the end of each episode. This change in knowledge conveys an educational message to the audience which may fall into one or more categories - intellectual-cognitive and/or socio-emotional. The message will always be integral to the plot and present throughout the script. This objective is achieved through this series by exploring social themes through the daily school life of six teenage friends at Bayside High who help each other make the most of growing up in a complicated world. The Bayside kids give teens a useful perspective on many of the tough issues they have to face both in their peer relationships, and in personal decision-making both in and out of the classroom.",N/A,N/A,N/A,N/A
1999,KNBC,NBC,Los Angeles,3,Analog,HANG TIME,Core,Network,SA 8:30AM - 9:00AM,12,1,30,13,16,"The educational objective of this program is to demonstrate how the knowledge of one or more characters in the story moves from one level to a more informed or higher level of knowledge by the end of each episode. This change in knowledge conveys an educational message to the audience which may fall into one or more categories - intellectual-cognitive and/or socio-emotional. The message will always be integral to the plot and present throughout the script. This objective is achieved in this series by showing how a group of teens deals with gender equality, competition, cooperation, and balancing priorities.",N/A,N/A,N/A,N/A
1999,KNBC,NBC,Los Angeles,3,Analog,NBA: INSIDE STUFF,Core,Network,SA 10:30AM - 11:00AM,9,4,30,13,16,"The educational objective of this program is to introduce the teen audience to the pro-social, off-court activities of basketball players and other individuals, and to individuals who have overcome various obstacles in order to achieve their goals. The program segments are based on a curriculum inspired by the U.S. Department of Education's Goals 2000, with particular focus on messages encouraging the following values: school completion, community service, cooperation, tolerance of differences,healthful practices and athletics, peaceful conflict resolutions and global awareness. These educational and informational messages are conveyed primarily through real life examples, interviews and commentary by the program's hosts.",N/A,N/A,N/A,N/A
1999,KNBC,NBC,Los Angeles,3,Analog,CITY GUYS (1),Core,Network,SA 9:00AM - 9:30AM,12,1,30,13,16,"The educational objective of this program is to demonstrate how the knowledge of one or more characters in the story moves from one level to a more informed or higher level of knowledge by the end of each episode. This change in knowledge conveys an educational message to the audience which may fall into one or more categories - intellectual-cognitive and/or socio-emotional. The message will always be integral to the plot and present throughout the script. This objective is achieved in this series by exploring the pressures of living in a big city environment where situations are sometimes so difficult and challenging, kids have to learn sophisticated and responsible decision-making to be safe and stay focused. The series follows the encounters and problem-solving of two young men through an eventful school year at Manhattan High and shows teens how to work with their principal, family and friends to be successful.",N/A,N/A,N/A,N/A
1999,KNBC,NBC,Los Angeles,3,Analog,CITY GUYS (2),Core,Network,SA 10:00AM - 10:30AM,10,3,30,13,16,"The educational objective of this program is to demonstrate how the knowledge of one or more characters in the story moves from one level to a more informed or higher level of knowledge by the end of each episode. This change in knowledge conveys an educational message to the audience which may fall into one or more categories - intellectual-cognitive and/or socio-emotional. The message will always be integral to the plot and present throughout the script. This objective is achieved in this series by exploring the pressures of living in a big city environment where situations are sometimes so difficult and challenging, kids have to learn sophisticated and responsible decision-making to be safe and stay focused. The series follows the encounters and problem-solving of two young men through an eventful school year at Manhattan High and shows teens how to work with their principal, family and friends to be successful.",N/A,N/A,N/A,N/A
1999,KNBC,NBC,Los Angeles,3,Analog,ONE WORLD,Core,Network,SA 9:30AM - 10:00AM,11,2,30,13,16,"The educational objective of this program is to demonstrate how the knowledge of one or more characters in the story moves from one level to a more informed or higher level of knowledge by the end of each episode. This change in knowledge conveys an educational messsage to the audience which may fall into one or more categories -- intellectual-cognitive and/or socio-emotional. The message will always be integral to the plot and present throughout the script. This objective is achieved through this series by exploring socio-emotional themes of identity, self-worth, social reciprocity, service to others and acceptance of differences. Through the characters in the show, our audience will see examples of different approaches to resolving problems caused by these issues.",N/A,N/A,N/A,N/A
1999,KPXN,PAX TV,Los Angeles,3,Analog,WHERE ON EARTH IS CARMEN SANDIEGO?,Core,Network,Monday - Friday 8:00 a.m. PT / October 4th - December 24th,65,0,30,8,12,"With thrilling adventures and mysterious clues, Where on Earth is Carmen Sandiego? is an exciting animated series which challenges viewers to figure out the thrilling capers. Carmen Sandiego is the world's greatest theif and each episode finds her stealing larger-than-life treasures ranging from the Mona Lisa and the Faberge Eggs to the Space Shuttle and the Statue of Liberty. Each show is filled with real facts that play back through ""Icon Windows"" and ""Hyperpaths"" which appear onscreen, using a variety of multimedia effects to captivate the audience. This non-violent show is rich in both excitement and education as Carmen goes after the most valuable objects in the world while Zak and Ivy, the two young detectives who are our protagonists, join the audience in trying to figure out what she's up to this time and where on earth she is. The audience comes away with knowledge of historically valuable treasures, geography and logistics.",99,N/A,N/A,N/A
1999,KPXN,PAX TV,Los Angeles,3,Analog,ARCHIE'S WEIRD MYSTERIES,Core,Network,Saturdays 8:00 a.m. PT / October 2nd - December 25th,13,0,30,7,11,"This animated series brings back Archie and the gang to Riverdale. Only this time Archie inadvertently shorts out the high school's science lab's new Hyper Sub-Molecular Quarkinator. This creates a hole in the cosmic fabric of sleepy Riverdale and turns it into a kind of suburban Bermuda Triangle. It becomes a weirdness magnet. Each show is loaded with the fun and goofy antics of pop culture's most enduring and loved comic book characters. The audience learns about teamwork, patience, acceptance of others, humor and more.",99,N/A,N/A,N/A
1999,KPXN,PAX TV,Los Angeles,3,Analog,ARCHIE'S WEIRD MYSTERIES,Core,Network,Monday - Friday 8:00 a.m. PT - December 27th - December 31st,5,1,30,7,11,"This animated series brings back Archie and the gang to Riverdale. Only this time Archie inadvertently shorts out the high school's science lab's new Hyper Sub-Molecular Quarkinator. This creates a hole in the cosmic fabric of sleepy Riverdale and turns it into a kind of suburban Bermuda Triangle. It becomes a weirdness magnet. Each show is loaded with the fun and goofy antics of pop culture's most enduring and loved comic book characters. The audience learns about teamwork, patience, acceptance of others, humor and more.",N/A,N/A,N/A,N/A
1999,KRCA,N/A,Los Angeles,3,Analog,LA ISLA DE JORDAN,Core,Syndicated,Monday through Saturday at 7am through 12/18/99,68,0,30,2,12,"This program is educational and intended to inform children 16 years of age and under. It airs at 7am Mondays through Saturdays, 30 minutes in length. This series is designed to enlighten chiildren about animals and the environment. Children also learn valuable everyday life lessons through the actions and interactions of the characters.",99,N/A,N/A,N/A
1999,KRCA,N/A,Los Angeles,3,Analog,NUBELUZ,Core,Syndicated,Monday through Saturday at 7am beginning 12/20/99,11,0,30,4,12,"This program is educational and intended to inform children 16 years of age and under. It airs at 7am Mondays through Saturdays, 30 minutes in length. The series is a combination of in-studio contests (memory puzzles, physical challenges, geography and word games) along with sing-along songs about nature, the environment, friendship, sharing and various other life experiences.",99,N/A,N/A,N/A
1999,KSCI-TV,N/A,Los Angeles,3,Analog,I CAN DO IT,Core,Syndicated,M-F 9:00am-9:30am,65,1,30,4,6,"Educational and Informational Objective: This program combines live action with animation and music to provide education and instruction in a variety of areas of value to children in this age group (scholastic as well as practical skills). This program is in Korean. Based on content, airtime and length, the program meets points 1-4. It is included in this form 398 to meet point 5 and is reported to program guide publishers as educational to meet point 6.",N/A,N/A,N/A,N/A
1999,KSCI-TV,N/A,Los Angeles,3,Analog,TIME FOR CHILDREN,Core,Syndicated,Thursday 11:00am-11:30am,13,1,30,10,13,"This program is in Mandarin with Chinese subtitling that also makes it accessible to Cantonese-speaking and hearing-impaired viewers. The program features a young energetic hostess who with her chimpanzee puppet sidekick and the assistance of experts in various fields, teaches children about a wide variety of subjects by utilizing on-site, hands-on experience.",N/A,N/A,N/A,N/A
1999,KTBN,TBN,Los Angeles,4,Analog,GOSPEL BILL,Core,Network,Saturday 7:00am (PST),11,2,30,6,12,GOSPEL BILL educates and informs children between the ages of 6 - 12 by teaching positive social skills and self awareness based on Biblical principles.,N/A,N/A,N/A,N/A
1999,KTBN,TBN,Los Angeles,4,Analog,JANICE'S ATTIC,Core,Network,Saturday 7:30am (PST),11,2,30,4,8,"JANICE'S ATTIC educates and informs children between the ages of 4 - 8 about nature, personal health and the value of positive character qualities.",N/A,N/A,N/A,N/A
1999,KTBN,TBN,Los Angeles,4,Analog,JUST THE FACTS,Core,Network,Saturday 8am (PST),11,2,30,10,16,JUST THE FACTS educates and informs children between the ages of 10 - 16 by teaching critical thinking and problem solving skills based on Bible principles to help adolescents deal with issues that affect them.,N/A,N/A,N/A,N/A
1999,KTBN,TBN,Los Angeles,4,Analog,KIDS AGAINST CRIME,Core,Network,Saturday 8:30am (PST),7,6,30,5,12,KIDS AGAINST CRIME educates and informs children between the ages of 5 - 12 by exploring the real-life crimes committed against and by youth and the penalities for those who commit these crimes.,N/A,N/A,N/A,N/A
1999,KTBN,TBN,Los Angeles,4,Analog,THE REPPIES,Core,Network,Saturday 9am (PST),10,3,30,3,9,THE REPPIES educates and informs children between the ages of 3 - 9 on valuable life lessons as if explores the decision making process of the important and sometimes difficult choices that children encounter.,N/A,N/A,N/A,N/A
1999,KTBN,TBN,Los Angeles,4,Analog,COLBY'S CLUBHOUSE,Core,Network,Saturday 9:30am (PST),11,2,30,6,12,COLBY'S CLUBHOUSE educates and informs children between the ages of 6 - 12 about how to successfully deal with everday situations and challenges using the principles of the Bible.,N/A,N/A,N/A,N/A
1999,KTBN,TBN,Los Angeles,5.5,Analog,KIDS CLUB,Core,Network,Saturday 10am (PST),11,2,30,3,9,KIDS CLUB educates and informs children between the ages of 3 - 9 about history through the Bible as well as teaching children about safety and offering exercise instructions.,N/A,N/A,N/A,N/A
1999,KTBN,TBN,Los Angeles,5.5,Analog,FAITHVILLE,Core,Network,Saturday 10:30am (PST),11,2,30,4,16,FAITHVILLE educates and informs children between the ages of 4 - 16 about the value of team work and the inportance of the individual within the community.,N/A,N/A,N/A,N/A
1999,KTBN,TBN,Los Angeles,5.5,Analog,KIDS LIKE YOU,Core,Network,Saturday 11am (PST),8,5,30,6,12,KIDS LIKE YOU educates and informs children between the ages of 6 - 12 by presenting challenging situations with solutions that develop character.,N/A,N/A,N/A,N/A
1999,KTLA,WB,Los Angeles,3,Analog,HISTERIA,Core,Network,M-F 10/1/99-12/31/99 2:30P,66,0,30,6,12,"The program seeks to increase young viewers' awareness and appreciation for history and to enhance viewers' knowledge and understanding of different ethnic, religious, cultural geographical and gender based groups through history and modern time to promote tolerance and diversity.",99,N/A,N/A,N/A
1999,KTLA,WB,Los Angeles,3,Analog,DETENTION,Core,Network,"SA 10/9-10/30/99 9:30A, 11/6-12/25/99 10A",11,1,30,6,12,"The program seeks to inform preteens of the issues that challenge today's junior high schoolers. Storylines deal with the issues of peer pressure, self esteem and tolerance.",N/A,N/A,N/A,N/A
1999,KTTV,FOX,Los Angeles,3.4,Analog,THE MAGIC SCHOOL BUS,Core,Network,Mon-Fri at 2:30 pm (10/1/99-12/31/99) and Friday at 2:00 pm (11/26/99),65,1,30,6,9,"Explores science through an animated journey aboard a magically transformed school bus to destinations such as the center of the earth, inside the human body, outer space, remote ecological environments, inside a molecule and inside a plant.",N/A,N/A,N/A,N/A
1999,KTTV,FOX,Los Angeles,3.4,Analog,SHERLOCK HOLMES IN THE 22ND CENTURY,Core,Network,Saturday at 7AM (10/2/99-12/11/99),11,1,30,9,11,"The series is designed to build problem-solving and informational management skills and to model the pro-social values and behaviors associated with enduring friendships and effective teamwork. Problem solving themes are illustrated in each episode which also demonstrate fundamental principles of gathering, evaluating, and interpreting information and using it to imagine, present and test plausible scenarios. It is the intent of the series to motivate children to see critical thinking and team problem-solving as exciting, fun, and within their capacity. The program is regularly scheduled and airs between the hours of 7:00 am and 10:00 pm. The program is 30 minutes in length, and is identified as an educational and informational show, targeted to 9 to 11 year olds, at the beginning of each broadcast and in listings provided to publishers of program guides.",N/A,N/A,N/A,N/A
1999,KTTV,FOX,Los Angeles,3.4,Analog,NFL UNDER THE HELMET,Core,Network,Saturdays at 11 AM (10/2/99-12/25/99),13,0,30,13,16,"“NFL Under The Helmet “ showcases the pro-social on and off the field activities of the NFL’s leading players and coaches. Working with the National Association for Sports and Physical Education, the program (1) educates teens about dedication, hard work, teamwork, goal setting and community service, (2) provides examples of responsible social and personal behavior, (3) demonstrates how to deal constructively with the differences among people, and (4) teaches the benefits of physical activity and fitness. The program is regularly scheduled and airs between the hours of 7:00 am and 10:00 pm. The program is 30 minutes in length, and is identified as an educational and informational show, targeted to teens (13-16 year olds), at the beginning of each broadcast and in listings provided to publishers of program guides.",99,N/A,N/A,N/A
1999,KTTV,FOX,Los Angeles,3.4,Analog,SHERLOCK HOLMES IN THE 22ND CENTURY,Non-Core,Network,Mondays at 4 pm (11/29/99-12/27/99),5,0,30,9,11,"The series is designed to build problem-solving and informational management skills and to model the pro-social values and behaviors associated with enduring friendships and effective teamwork. Problem solving themes are illustrated in each episode which also demonstrate fundamental principles of gathering, evaluating, and interpreting information and using it to imagine, present and test plausible scenarios. It is the intent of the series to motivate children to see critical thinking and team problem-solving as exciting, fun, and within their capacity. The program is regularly scheduled and airs between the hours of 7:00 am and 10:00 pm. The program is 30 minutes in length, and is identified as an educational and informational show, targeted to 9 to 11 year olds, at the beginning of each broadcast and in listings provided to publishers of program guides.",99,N/A,N/A,N/A
1999,KVEA,Telemundo,Los Angeles,6,Analog,PISTAS DE BLUE (BLUES CLUES),Core,Network,M - F 8 am - 8:30 am,65,0,30,2,6,"Blues Clues is an interactive pre-school program, which teaches children how to use the basic tools for critical thinking and reasoning, before going to school for the first time. Clues are given throughout the program by Steve the principal host and his dog Blue.",99,N/A,N/A,N/A
1999,KVEA,Telemundo,Los Angeles,6,Analog,OYE ARNOLD ( HEY ARNOLD),Core,Network,T&Th: 7 AM (10/01/99-10/29/99); Monday 7 AM (12/13/99-12/31/99),11,0,30,6,11,"Oye Arnold presents a fresh look at life in the big city from a child's point of view. The program focuses on Arnold, the principal character and his friends as they learn to deal with challenges, fears, temptations and responsiblity.",99,N/A,N/A,N/A
1999,KVEA,Telemundo,Los Angeles,6,Analog,AVENTURAS EN PAÑALES ( RUGRATS),Core,Network,M - F 7:30am- 8:00am,65,0,30,4,8,"Aventura en Panales takes children on a tour of the world that exists between your knees and the floor. It is a baby's-eye-view of life that takes the main character, one-year-old Tommy Pickles, and his friends on adventures that explore the way everday experiences can be fantastic. They discover magic, danger, and comic adventure in our world. They venture into the unknown led my their curiosity and innocent love of mischief. The annimation emphasizes perspective often exaggerating sizes and shapes to reflect a child's point of view.",99,N/A,N/A,N/A
1999,KVEA,Telemundo,Los Angeles,6,Analog,OYE ARNOLD ( HEY ARNOLD),Non-Core,Network,"Tuesdays 6:45 AM, Wednesdays 6:30 AM, Thursdays 7:00 AM, Fridays 7:15 AM",42,0,15,6,11,"Oye Arnold presents a fesh look at life in the big city froma child's point of view. The program focuses on Arnold, the principal character and his friends as they learn to deal with challenges, fears, temptations and responsibility.",99,N/A,N/A,N/A
1999,KVMD,N/A,Los Angeles,2.7,Analog,BECKY'S BARN,Core,Syndicated,"Thursday, 12:30 PM",12,0,30,3,7,"Becky's Barn is a program that teaches children both education and morality lessons through a cast of real life and puppet characters whose lives revolve around a farm, specifically Becky's barn. The show is divided into various segments with a lesson learned through the actions of the barn characters. Segments include: The Alphabet Train, the eggies, interviews with pre-schoolers, Uncle Henry's Hired Hand (Crafts), Uncle Henry's Orchard (Scripture Lesson) and Papa Joes Bible story. Each episode combines spirtual and educational concepts along with health and safety tips.",99,N/A,N/A,N/A
1999,KVMD,N/A,Los Angeles,2.7,Analog,SUNSHINE FACTORY,Core,Syndicated,"Thursday, 1:00 PM",12,0,30,5,9,A show devoted to teaching children lessons in moral and emotional issues. The show centers around the owners of a fixit shop and some of the people who live in the neighborhood. Each wek a specific issue is raised at the shop and the characters take a special trip to the Sunshine Factory to learn how to resolve situations and deal with problems.,99,N/A,N/A,N/A
1999,KVMD,N/A,Los Angeles,2.7,Analog,SONSHINY DAY,Core,Syndicated,"Thursday, 1:30PM",12,0,30,2,6,"Sonshiny Day is a show that has a mix of human and puppet characters. The show features a host, Audrey, who along with her friends teach morality lessons and Biblical themes through music, song, and prayer.",99,N/A,N/A,N/A
1999,KVMD,N/A,Los Angeles,2.7,Analog,WORSHIP FOR KIDS,Core,Syndicated,"Thursday, 2:00 PM",12,0,30,4,8,"A half hour program devoted to giving kids the opportunity to learn and to worship God. Host Gary Richardson uses song and Biblical readings to illustrate a moral teaching and challenges children to apply Christian values to every day life situations. Gramma Mac reads stories to children while pages from the book are shown on screen. Upbeat, sing-along songs aimed at children are synchronized to videos featuring nature scenes, children and animals.",99,N/A,N/A,N/A
1999,KVMD,N/A,Los Angeles,2.7,Analog,JUST KIDS,Core,Syndicated,"Thursday, 2:30 PM",12,0,30,5,9,"Just Kids is a program designed to inform children in both educational and spiritual matters through the use of informative and interesting segments. A cast of regular characters share insight that will help children grow in practical ways. Segments include: the Cooking Corner, Weekly Scripture, The Kids Kaleidoscope (kA look at different places and occupations), Bible Fact, The Just Kids Singers, and a reading of various children's books.",99,N/A,N/A,N/A
1999,KVMD,N/A,Los Angeles,2.7,Analog,JOY JUNCTION,Core,Syndicated,"Thursday, 3:00 PM",12,0,30,8,12,Joy Junction is a program designed to be an interactive learning experience. Set in a western town. Joy Junction features a cast of characters and a studio audience. Kids in the audience participate in a game show format while the show's characters play out a story that teaches kids a pro-social message and morality lesson in a way that has long lasting impact.,99,N/A,N/A,N/A
1999,KWHY-TV,N/A,Los Angeles,3,Analog,DESAFIO ACADEMICO,Core,Local,Sundays 1:00 - 1:30PM,13,0,30,8,16,"DESAFIO ACADEMICO, A RECIPIENT OF THE 1999 PARENTS' CHOICE AWARD, MOTIVATES STUDENTS TO STUDY PRIMARY SUBJECTS SUCH AS MATHEMATICS, SCIENCE, HISTORY, GEOGRAPHY, AND LANGUAGE SKILLS WITHIN A FUN, TEAM BUILDING, COMPETITIVE ENVIRONMENT. SPANISH SPEAKING HIGH SCHOOL STUDENTS ARE CHALLENGED TO MEET HIGH SCHOOL EQUIVALENCY STANDARDS BY DEMONSTRATING THEIR PROFICIENCY IN MULTIPLE SUBJECTS.",99,N/A,N/A,N/A
