1997,KOIN-TV,CBS,"Portland, OR",3,Analog,Fudge,Core,Network,Saturdays/7:30am,13,0,30 minutes,5 years,9 years,"Based on the book series by award-winning author Judy Blume, the program follows its soon-to-be-teen protagonist as he deals with the trials and tribulations into which he is led by his little brother Fudge. The program focuses on issues young children need to understand in order to move successfully toward the next stage of social-emotional development. Its objectives are to help young viewers, through story-telling and program content, to learn about and put into practice some of the basic techniques associated with conflict resolution, and makes them aware of some of the ways to mediate and resolve conflict using prosocial behaviors. This program is specifically designed to further the educational and informational needs of children, has educating and informing children as a significant purpose, and otherwise meets the definition of Core Programming as specified in the Commission's rules.",99,N/A,N/A,N/A
1997,KOIN-TV,CBS,"Portland, OR",3,Analog,In the News,Non-core,Network,Saturdays,4,0,1 minute,7 years,11 years,"This short form program consists of a series of one-minute vignettes highlighting current events. The objectives of the program are to inform children about important events taking place at local, state, and national levels and around the world, and to stimulate and foster their interest in seeking information about current events through various print and electronic media. The vignettes air on a weekly basis within each of the following core educational and informational programs - Beakman's world, Fudge, The Ghostwriter Mysteries, and The Weird Al Show.",99,N/A,N/A,N/A
1997,KPDX,FOX,"Portland, OR",3.5,Analog,Bobby's World,Core,Network,Mon - Thurs/7:00am (10/1/97 - 12/31/97),53,0,30 minutes,4 years,11 years,"The series Bobby's World is an imaginative, entertaining and informative program which deals with the challenges of growing up. Each episode offers children an opportunity to learn how to cope with the complexities of the world for young children.",99,N/A,N/A,N/A
1997,KPDX,FOX,"Portland, OR",3.5,Analog,Bobby's World,Core,Network,Saturdays/7:00am (10/4/97 - 12/27/97),13,0,30 minutes,4 years,11 years,"The series Bobby's World is an imaginative, entertaining and informative program which deals with the challenges of growing up. Each episode offers children an opportunity to learn how to cope with the complexities of the world for young children.",99,N/A,N/A,N/A
1997,KPDX,FOX,"Portland, OR",3.5,Analog,C-Bear and Jamal,Core,Network,Fridays/7:00am (10/3/97 - 12/26/97),13,0,30 minutes,4 years,11 years,"C Bear & Jamal teaches children the importance of education, equality and exercise and other life learning skills. Each episode contributes to the educational, physchosocial and intellectual development of children by incorporating short vignettes that encourage positive family and peer relationships as well as sound moral development.",99,N/A,N/A,N/A
1997,KPDX,FOX,"Portland, OR",3.5,Analog,Life with Louie,Core,Network,Saturdays/10:00am (10/4/97 - 12/27/97),12,1,30 minutes,6 years,11 years,"Life with Louie offers young viewers answers to issues and scenarios that are common to growing up, yet might be perplexing to a child. Each episode offers children an opportunity to learn how to cope with family and friends as part of growing up.",N/A,N/A,N/A,N/A
1997,KPDX,FOX,"Portland, OR",3.5,Analog,Life with Louie,Non-core,Network,Saturdays (11/22/97 - 12/27/97),5,0,30 minutes,6 years,11 years,"Life with Louie offers young viewers answers to issues and scenarios that are common to growing up, yet might be perplexing to a child. Each episode offers children an opportunity to learn how to cope with family and friends as part of growing up.",99,N/A,N/A,N/A
1997,KPDX,FOX,"Portland, OR",3.5,Analog,Young America Outdoors,Non-core,Syndicated,Fridays/5:00am (10/3/97 - 12/26/97); Saturdays/noon (12/4/97 - 10/11/97),15,0,30 minutes,13 years,16 years,"Young America Outdoors is an entertaining and informative series which not only teaches children the importance of taking care of our environment, but it also shows them how to enjoy the outdoors safely.",99,N/A,N/A,N/A
1997,KPDX,FOX,"Portland, OR",3.5,Analog,Mark's Wired World,Non-core,Syndicated,Fridays/5:30am (10/3/97 - 12/26/97),13,0,30 minutes,11 years,16 years,"Mark's Wired World talks to kids about computers, the Internet, cool web sites and more. This program is an energetic blend of education and entertainment that kids can use in school or at home.",99,N/A,N/A,N/A
1997,KPTV,UPN,"Portland, OR",3,Analog,Disney's Sing Me a Storey with Belle,Core,Syndicated,Saturday/8:30am,13,0,30 minutes,2 years,6 years,"""DISNEY'S SING A STORY WITH BELLE"" - The series is designed to teach young children, through a series of classic stories and discussions, about fundamentals, morals and educational lessons of life. The show adresses issues like overcoming fears, working with others, understanding diversity, dealing with problems, etc. Reading is strongly encouraged throughout the series.",99,N/A,N/A,N/A
1997,KPTV,UPN,"Portland, OR",3,Analog,Jack Hanna's Animal Adventures,Core,Syndicated,Sundays/11:00am,13,0,30 minutes,12 years,16 years,"""JACK HANNA'S ANIMAL ADVENTURES"" - This program explores the world of animals in their natural habitat. Jack takes his young viewers on a fascinating journey into natural habitats and zoological parks to reveal secrets of the animal kingdom.",99,N/A,N/A,N/A
1997,KPTV,UPN,"Portland, OR",3,Analog,Bananas in Pajamas,Core,Syndicated,Saturdays/7:00am - 8:00am,26,0,30 minutes,2 years,6 years,"""BANANAS IN PAJAMAS"" - This live action series features mischievous twins who live in a colorful storybook world with their friends, the teddies, and the lovable rogue Rat-in-the-Hat. Together they engage in wondrous adventures that capture the imagination of children. These endearing stories teach young children about social concepts such as sharing, generousity, cooperation, following directions, and creative expression.",99,N/A,N/A,N/A
1997,KPTV,UPN,"Portland, OR",3,Analog,Oscar's Orchestra,Core,Syndicated,Saturdays/9:30am,13,0,30 minutes,6 years,11 years,"""OSCAR'S ORCHESTRA"" - The series is an excellent educational resource because it makes learning about classical music fun and exciting. Children are exposed to all the great composers and their music and an in-depth curriculum has been developed to correspond with each episode.",99,N/A,N/A,N/A
1997,KPTV,UPN,"Portland, OR",3,Analog,Hollywood Video's High Five Challenge,Core,Local,Saturdays/11:30am,13,0,30 minutes,12 years,17 years,"This locally produced program is an academic competition featuring two high school teams from the Northwest. Each show features 50 questions/answers...five questions each in ten different categories. These categories include topics in geography, world history, American history, literature, science, arts and entertainment, sports, math, languages, ethnic cultures, and assorted other subjects. Students in-studio and at home are given the opportunity to use their educational skills in an exciting competition.",99,N/A,N/A,N/A
1997,KWBP,WB,"Portland, OR",4.5,Analog,Captain Planet,Core,Network,Mon - Fri/7:30am,60,0,30 minutes,2 years,16 years,"THE NEW ADVENTURES OF CAPTAIN PLANET"" - An animated series that emphasize teamwork, environmental responsibility and an appreciation for cultural diversity, and serves as a tool to educate children on environmental problems by offering ways in which they can contribute to the solutions.",99,N/A,N/A,N/A
1997,KWBP,WB,"Portland, OR",4.5,Analog,Channel Umptee 3,Core,Network,Sundays/8:00am,8,0,30 minutes,2 years,16 years,"""CHANNEL UMPTEE 3"" - This program is designed to help children learn about science, technology, mathematics, psychology, geography, history, music, literature and art and to use critical thinking in analyzing the information provided. Dramatic situations, humor and vocabulary are used to make the program enjoyable for children in the target group, older siblings and parents.",99,N/A,N/A,N/A
1997,KWBP,WB,"Portland, OR",4.5,Analog,Mr. Men,Core,Syndicated,Mon - Fri/2:00pm,60,0,30 minutes,2 years,12 years,"""MR. MEN"" - The program is a creative inspiration from the well known ""Mr. Men"" and ""Little Miss"" series of children's books. Each episode introduces children to a number of educationally positive ideas. Some episodes encourage children to appreciate and respect the differences in all people. In other, episodes, the characters teach children to be sensitive to other people's feelings. The characters also reinforce the concept that children need to manage their own feelings and emotions. Children are taught a number of simple and useful ways to solve everyday problems.",99,N/A,N/A,N/A
1997,KWBP,WB,"Portland, OR",4.5,Analog,Oliver Twist,Core,Syndicated,Saturdays/9:00am,13,0,30 minutes,7 years,16 years,"""OLIVER TWIST"" - The program introduces children in the target audience to one of Charles Dickens' best loved and most read classic through music and dance.",99,N/A,N/A,N/A
1997,KWBP,WB,"Portland, OR",4.5,Analog,Field Trip,Non-core,Syndicated,Sundays/6:30am; Saturdays/5:30am,13,0,30 minutes,7 years,16 years,"""FIELD TRIP"" - This program takes a look at history, art, music and science from a different angle ""up close and personal"". Children go on exciting, fun-filled real life adventures. ""Field Trip"" encourages independent exploration with suggested reading and resources for other information.",99,N/A,N/A,N/A
1997,KWBP,WB,"Portland, OR",4.5,Analog,Enchanted Tales,Non-core,Syndicated,Sundays/6:00am,13,0,60 minutes,2 years,16 years,"""ENCHANTED TALES"" - The educational and informational objective of the program is to assist children in using their imagination and learning the importance of reading while instilling positive, social behavior. Each episode incorporates lessons about values and morals, which are reiterated at the end again by Wizen the Wizard. The series introduces children to some of the best literary classics and encourages them to visit their local library to read the original stories and other works by the same author. The episodes introduces children to orchestrated scores by such great composers as Beethoven, Mozart and Tchaikovsky.",99,N/A,N/A,N/A