Year,Call Sign,Network Affiliation,Nielsen DMA,Ave. # of Analog hours,Analog or Digital,Title of EI programs,Core or Non-core,Origin of Program,Regular schedule of Program,Total times aired,Number of pre-emptions,Length of Program (in minutes),Age of Target Audience From,Age of Target Audience To,Description of Program,Number of pre-emptions rescheduled,Ave. # of hours of all digital programming per week,Ave. # of hours per week of digital Core Programming per week,Y or N to Q 11 in Digital Core Programming: At least 50% of the Core Programming had not already aired within the previous seven days
1997,KATU,ABC,"Portland, OR",4,Analog,Disney's 101 Dalmations - The Series,Core,Network,Saturdays/7:00am,13,5,30 minutes,7 years,11 years,"In the personae of a group of dalmatian puppies and their friend, a resourceful chicken named ""Spot,"" this series addresses many of the key developmental issues of middle childhood. Stories revolve around conflicts over rules, learning to be responsible, attempts to gain peer acceptance, learning from mistakes, desires to help other animals or human characters, problem-solving. The series encourages prosocial values such as empathy, fairness, and cooperative behavior as well as modeling information-gathering and thinking strategies.",N/A,N/A,N/A,N/A
1997,KATU,ABC,"Portland, OR",4,Analog,Disney's 1 Saturday Morning,Core,Network,Saturdays/7:30am,13,5,120 minutes,8 years,12 years,"This series features long-form educational elements -- ""Brand Spanking New! Doug,"" ""Disney's Recess"" and ""Disney's Pepper Ann"" -- and short-form educational elements. This two-hour program block features three half-hour educational series in combination with a variety of short-form educational and entertainment elements which include ""Great Minds...Think For Themselves"" (American History segments), ABC's Schoolhouse Rock"" and fact-based shorts called ""What's Up With That?"". Brand Spanking New! Doug -- Narrated via the spoken journal entries of aspiring writer/cartoonist Doug Funnie, this series uses humor and fantasy in depicting the struggles of a twelve-year-old boy to develop self-confidence and identity, resolve family, peer and school problems and maintain friendships strained by preadolescent physical and emotional change. Series episodes foster values such as honesty, loyalty, fairness and respect for individual differences. By means of its narrative episode structure ""Brand Spanking New! Doug"" also serves to encourage creative writing and artistic expression. (Target Age - 8-12) Disney's Pepper Ann -- ""Pepper Ann"" features a twelve-year-old girl who demonstrates that individuality, self-expression, competence and humor are assets for a pre-teenager. From week to week Pepper, who is growing up in a single-parent family and who attends Middle School, learns that it is O.K. to make mistakes and that it is important to speak out for what one believes. Additionally, the series affirms positive values such as effort/perseverance, taking responsibility, creativity and the value of friendship. (Target Age - 10-12) Disney's Recess -- ""Disney's Recess"" is a collection of animated stories about a group of fourth graders who attend suburban public school. Having been loyal friends for years, these children are an ethnically and gender-diverse group. They provide role models for viewers who may likewise be struggling with problems common to middle childhood such as conflicts with authority figures, school and family rules, desire to be popular, peer pressure, crises of confidence, lack of fairness. A recurrent theme is the issue of dealing with the class bully or ""teacher's pet."" Certain episodes raise thought-provoking questions which parents and children can talk about together, providing a rich source of value-oriented family discussion material. (Target Age - 8-12)",N/A,N/A,N/A,N/A
1997,KATU,ABC,"Portland, OR",4,Analog,Disney's Jungle Cubs,Core,Network,Saturdays/10:30am,13,5,30 minutes,5 years,8 years,"The 1997-98 episodes of ""Jungle Cubs"" are specifically designed to be an educational children's series. In this animated series the beloved animals from Rudyard Kipling's ""The Jungle Book"" -- Bagheera, Baloo, Hathi, Kaa, Louie and Shere Khan -- are portrayed as young animals who are growing up in the jungles of India. Series episodes teach and reinforce prosocial values such as cooperative behavior, resolving disagreements, developing empathy, building self-esteem, taking responsibility, overcoming fears, maintaining friendships.",N/A,N/A,N/A,N/A
1997,KATU,ABC,"Portland, OR",4,Analog,How 'Bout That?,Core,Local,Saturdays/9:30am,13,3,30 minutes,6 years,10 years,"A music magazine show for kids ages 6-10 that explores how ideas and dreams become reality. Viewers are taken on musical adventures, delving into features on everything from how they make crayons to what it takes to become a professional beekeeper. Through original music, processes and professions are explored in rythm and rhyme.",N/A,N/A,N/A,N/A
1997,KATU,ABC,"Portland, OR",4,Analog,Nick News for Kids,Core,Syndicated,Saturdays/10:00am,13,5,30 minutes,7 years,11 years,"""Nick News"" - The program provides a forum for kids to think and ask questions about the world. Gives kids information and background they need to understand events, illuminates future potential in current events for kids, gives kids ways of using news as a part of their lives, enables and encourages kids to take a point of view.",N/A,N/A,N/A,N/A
1997,KATU,ABC,"Portland, OR",4,Analog,The New Adventures of Winnie the Pooh,Non-core,Network,Saturdays/11:00am,13,5,30 minutes,3 years,6 years,"""The New Adventures of Winnie The Pooh"" - depicts the everyday lives of Christopher Robin and animal friends. Series episodes convey strong prosocial messages about honesty, responsibility, persistence and cooperative effort. ",N/A,N/A,N/A,N/A
1997,KATU,ABC,"Portland, OR",4,Analog,Science Court,Non-core,Network,Saturdays/11:30am,13,5,30 minutes,8 years,12 years,"""Science Court"" - offers a novel and highly entertaining approach to science education. It uses a humorous courtroom setting as a vehicle for teaching broad scientific concepts and their everyday applications.",N/A,N/A,N/A,N/A
1997,KATU,ABC,"Portland, OR",4,Analog,Brand Spanking New Doug Holiday Marathon,Non-core,Network,Saturday/5:00am,1,0,120 minutes,8 years,12 years,"This special features four episodes of ""Brand Spanking New Doug."" Narrated via entries in Doug's journal, the special follows Doug through some unique learning experiences -- parental advice, appreciation, standing up for what you believe in, and feeling left out -- culminating with the arrival of a new baby sibling.",99,N/A,N/A,N/A
1997,KBSP,N/A,"Portland, OR",3,Analog,The New Zoo Review,Core,Syndicated,Saturdays & Sundays/7:00am (10/4-12/28),26,0,30 minutes,3 years,12 years,"Recommended by the Nat Ed Assn during its production in the 1970s, NZR teaches children 'a way of life through music. It brings 'an understanding of good and bad to children. Three costumed characters and two adults guide children through situations with music, song and dance.",99,N/A,N/A,N/A
1997,KBSP,N/A,"Portland, OR",3,Analog,Bookmice,Core,Syndicated,Saturdays & Sundays/7:30am (10/4-12/28),26,0,30 minutes,6 years,10 years,"Puppet mice (who like to read), a puppet cat and people working and visiting at a branch library present adventures 'as they explore the world of books. Encourages love of reading, promotes social values as children learn about helping others, the importance of honesty, and overcoming fears.'",99,N/A,N/A,N/A
1997,KBSP,N/A,"Portland, OR",3,Analog,Carrascolendas,Core,Syndicated,Saturdays/8:00am (10/4 - 12/27),13,0,30 minutes,6 years,11 years,"Spanish and English are spoken by the actors to make the program understandable in both languages. Produced for PBS, each episode develops a moral or social theme. The e/i objective for children, as illustrated by the characters in the small town of Carrascoelndas is to increase the understanding of Southwestern Spanish-English culture.",99,N/A,N/A,N/A
1997,KBSP,N/A,"Portland, OR",3,Analog,Center Street,Core,Syndicated,Saturdays/8:30am (10/4 -12/27),13,0,30 minutes,12 years,16 years,A teen news and lifestyle magazine from the LDS Church whose objective is to teach youth good values which will help them make educated decisions and establish a personal standards system in their lives.,99,N/A,N/A,N/A
1997,KGW,NBC,"Portland, OR",3,Analog,Saved by the Bell - The New Class I,Core,Network,Sundays/7:00am,13,0,30 minutes,13 years,16 years,"""Saved By The Bell-The New Class"" explores social themes through the daily school life of six teenage friends at Bayside High who help each other make the most of growing up in a complicated world. The Bayside kids give teens a useful perspective on many of the tough issues they have to face both in and out of the classroom. Through relatable storylines, this multi-ethnic cast serves as role models as they explore such issues as dealing with the death of a loved one, the right to say ""no"", the meaning of heroism, and teenage alcohol use. Add that to the normal stresses of sustaining friendships, performing well in school, and developing an identity, and the scene at Bayside High is packed with more than the usual challenges of high school life.",99,N/A,N/A,N/A
1997,KGW,NBC,"Portland, OR",3,Analog,Saved by the Bell - The New Class II,Core,Network,Sundays/7:30am,13,0,30 minutes,13 years,16 years,"""Saved By The Bell-The New Class"" explores social themes through the daily school life of six teenage friends at Bayside High who help each other make the most of growing up in a complicated world. The Bayside kids give teens a useful perspective on many of the tough issues they have to face both in and out of the classroom. Through relatable storylines, this multi-ethnic cast serves as role models as they explore such issues as dealing with the death of a loved one, the right to say ""no"", the meaning of heroism, and teenage alcohol use. Add that to the normal stresses of sustaining friendships, performing well in school, and developing an identity, and the scene at Bayside High is packed with more than the usual challenges of high school life.",99,N/A,N/A,N/A
1997,KGW,NBC,"Portland, OR",3,Analog,Hang Time - I,Core,Network,Saturdays/7:30am,13,0,30 minutes,13 years,16 years,"""Hang Time"" follows the Deering Tornados, a boy's basketball team in an Indiana High School that is dealing with the issue of welcoming and integrating a female player into the social and interpersonal fabric of the team. The series follows the starting line-up through its basketball seasons and explores both personal themes of adolescent life, as well as the social themes which relate to sportsmanship, fair play, jealousy, teamwork, cooperation and competition. As the team progresses through each season, the audience will see them develop skills in several areas. These include establishing priorities, managing conflict, developing self-confidence, respecting differences, and reducing bias in behavior towards others. There is an emphasis on interpersonal competence and teamwork which demonstrates to the audience ways to develop positive self-concepts yet also make and maintain effective social relationships.",99,N/A,N/A,N/A
1997,KGW,NBC,"Portland, OR",3,Analog,Hang Time - II,Core,Network,Saturdays/10:00am,10,2,30 minutes,13 years,16 years,"""Hang Time"" follows the Deering Tornados, a boy's basketball team in an Indiana High School that is dealing with the issue of welcoming and integrating a female player into the social and interpersonal fabric of the team. The series follows the starting line-up through its basketball seasons and explores both personal themes of adolescent life, as well as the social themes which relate to sportsmanship, fair play, jealousy, teamwork, cooperation and competition. As the team progresses through each season, the audience will see them develop skills in several areas. These include establishing priorities, managing conflict, developing self-confidence, respecting differences, and reducing bias in behavior towards others. There is an emphasis on interpersonal competence and teamwork which demonstrates to the audience ways to develop positive self-concepts yet also make and maintain effective social relationships.",N/A,N/A,N/A,N/A
1997,KGW,NBC,"Portland, OR",3,Analog,NBA Inside Stuff,Core,Network,Saturdays/10:30am,8,5,30 minutes,13 years,16 years,"Also included in the TNBC lineup is ""NBA Inside Stuff,"" a half hour news magazine program directed at teens between the ages of 13-16. The program features the pro-social off-court activities of male and female basketball players, coaches, team personnel and teenage athletes. An expert educational consultant works with the producers and writers of the show to make sure that the program segments are based on a curriculum inspired by the U.S. Department of Education's Goals 2000, with particular focus on messages encouraging the following values - school completion, community service, cooperation, tolerance of differences, healthful practices and athletics, peaceful conflict resolution and global awareness. These educational and informational messages are conveyed primarily through real life examples, interviews and commentary by the program's host. Weekly features on players and other individuals help the audience see how these individuls were able to overcome various obstacles in order to achieve their goals.",N/A,N/A,N/A,N/A
1997,KGW,NBC,"Portland, OR",3,Analog,Bill Nye the Science Guy,Core,Syndicated,Saturdays/7:00am,13,0,30 minutes,6 years,11 years,"This program is designed to educate and inform children between the ages of 6 and 11 years old. More specifically, the series is designed to teach children in an entertaining way about fairly sophisticated scientific concepts.",99,N/A,N/A,N/A
1997,KGW,NBC,"Portland, OR",3,Analog,Peer Pressure,Non-core,Syndicated,Saturdays/11:00am,5,8,30 minutes,13 years,16 years,Peer Pressure is a high energy game show that looks at life from a teenage perspective and spoofs the process of growing up.,3,N/A,N/A,N/A
1997,KGW,NBC,"Portland, OR",3,Analog,Click,Non-core,Syndicated,Sundays/2:00am,13,0,30 minutes,13 years,16 years,Click is a game of speed and knowledge in which adolescent teams compete to provide correct and rapid answers to different types of questions and challenges.,99,N/A,N/A,N/A
1997,KGW,NBC,"Portland, OR",3,Analog,City Guys,Non-core,Network,Saturdays/11:30am,99,9,30 minutes,13 years,16 years,The educational objective of this program is to demonstrate how the knowledge of one or more characters in the story moves from one level to a more informed or higher level of knowledge by the end of each episode.,N/A,N/A,N/A,N/A
1997,KNMT,TBN,"Portland, OR",3,Analog,Just the Facts,Core,Network,Saturdays/7:00am,10,1,29 minutes,10 years,16 years,"""JUST THE FACTS"" - A program that deals with teen issues of everyday life. This program educates and informs teens about life-style choices. The show teaches on how to love, help those in need, problem-solve, and how to search for the real truth.",N/A,N/A,N/A,N/A
1997,KNMT,TBN,"Portland, OR",3,Analog,Superbook,Core,Network,Saturdays/7:30am,8,2,29 minutes,5 years,10 years,"""SUPERBOOK"" - The educational value of SuperBook is based on the accumulation of 4000 years of teachings about the necessity of sound social and moral behavior in the general health of any social group. These Old Testament historical accounts are codified in one of the oldest and most proven group of laws or moral codes known to man, the Mosaic Laws and Covenants, and are taught through entertaining animation and children's characters.",N/A,N/A,N/A,N/A
1997,KNMT,TBN,"Portland, OR",3,Analog,Quigley Village,Core,Network,Saturdays/8:00am  ,8,2,29 minutes,2 years,7 years,"""QUIGLEY'S VILLAGE"" - This program educates and informs children by teaching important life skills based on positive and practical principles.",N/A,N/A,N/A,N/A
1997,KNMT,TBN,"Portland, OR",3,Analog,Kids Against Crime,Core,Network,Saturdays/8:30am  ,10,1,29 minutes,5 years,12 years,"""KIDS AGAINST CRIME"" - This program educates and informs children by exploring the real-life crimes committed against and by youths and the penalities for those who commit these crimes.",N/A,N/A,N/A,N/A
1997,KNMT,TBN,"Portland, OR",3,Analog,Kids Like You,Core,Network,Saturdays/9:00am,5,2,28 minutes,6 years,12 years,"""KIDS LIKE YOU"" - Jailhouse Joe, Boxcar Billy, Agnes Bittimore, and lots of loveable puppets create a setting to teach Judeo-Christian values and principles via drama, skits, and songs to grade school children - enchancing the spiritual part of their lives. The show educates and informs children by presenting challenging situations with solutions that develop character.",N/A,N/A,N/A,N/A
1997,KNMT,TBN,"Portland, OR",3,Analog,Colby's Clubhouse,Core,Network,Saturdays/9:30am,10,2,28 minutes,6 years,12 years,"""COLBY'S CLUB HOUSE"" - This program educates and informs children between the ages og 6-12 about how to successfully deal with everyday situations and challenges using the principles of the bible.",N/A,N/A,N/A,N/A
1997,KNMT,TBN,"Portland, OR",3,Analog,Kids Club,Core,Network,Saturdays/10:00am,12,2,30 minutes,3 years,9 years,"""THE KIDS CLUB"" - This program educates and informs children about history through the Bible as well as teaching children about safety and offering exercise instructions.",N/A,N/A,N/A,N/A
1997,KNMT,TBN,"Portland, OR",3,Analog,Faithville,Core,Network,Saturdays/10:30am,8,3,30 minutes,8 years,12 years,"""FAITHVILLE"" - This program educates and informs children about the value of team work and the importance of the individual within the community.",N/A,N/A,N/A,N/A
1997,KNMT,TBN,"Portland, OR",3,Analog,Carman,Core,Network,Saturdays/7:00am,8,5,30 minutes,12 years,16 years,"""CARMAN"" - Carman deals with issues such as teen pregnancy, abortion, pre-marital sex, and illiteracy. The program encourages children to be the best they can be in life.",N/A,N/A,N/A,N/A
1997,KNMT,TBN,"Portland, OR",3,Analog,Gospel Bill,Non-core,Network,Saturdays/5:30 pst,6,0,29 minutes,6 years,12 years,"""GOSPEL BILL"" - Adventure in an old west setting - featuring Gospel Bill as the sheriff of Dry Gulch and a host of interesting characters. Educates children in Judeo-Christian values, morals and standards by using the experiences of these characters children can relate to, thereby providing them with practical applications of Biblical principles which can be applied to their daily lives.",99,N/A,N/A,N/A
1997,KNMT,TBN,"Portland, OR",3,Analog,Flying House,Non-core,Network,Saturdays/3:30 pst,8,0,28 minutes,4 years,8 years,"""FLYING HOUSE"" - An animated presentation of the historical events of the life of Jesus as taken from the New Testament recorded from 4 A.D. to approximately 33 A.D. In addition to learning the events themselves, children are exposed to the parables, moral and ethical teaching of the period through animated dramatic presentation. Children are taught to respect their parents, be truthful, not to steal, refrain from violence and to show respect for the government and its laws. They are taught the value of respecting people of different ethnic backgrounds, helping the needy, feeding the hungry, nursing the sick and many more humanitarian values.",99,N/A,N/A,N/A
1997,KNMT,TBN,"Portland, OR",3,Analog,Janice's Attic,Non-core,Network,Saturdays/4:00am pst,8,0,30 minutes,4 years,8 years,"""JANICE""S ATTIC"" - Through real life experiences, children are educated about science, health, crafts, cooking, nature, Bible stories and people from all walks of life. Each half hour is dedicated to a value such as adaptability, courtesy, humility, obedience, cleanliness, choices, etc.",99,N/A,N/A,N/A
1997,KNMT,TBN,"Portland, OR",3,Analog,Joy Junction,Non-core,Network,Saturdays/6:30am,9,1,29 minutes,8 years,12 years,"""JOY JUNCTION"" - This is a program designed to be an interactive learning experience. Set in a Western town, Joy Junction features a cast of characters and a studio audience. Kids in the audience participate in a game show format while the show's characters play out a story that teaches kids a pro-social message and morality lesson in a way that has a long lasting impact.",N/A,N/A,N/A,N/A
1997,KNMT,TBN,"Portland, OR",3,Analog,Circle Square,Non-core,Network,Saturdays/6:00am,9,1,28 minutes,4 years,12 years,"""CIRCLE SQUARE"" - This program educates and informs children by presenting Biblically based values and morals used for problem solving in everyday situations.",N/A,N/A,N/A,N/A
1997,KOIN-TV,CBS,"Portland, OR",3,Analog,Beakman's World,Core,Network,Saturdays/7:00am,13,0,30 minutes,6 years,11 years,"In this series, the scientist host, Beakman, responds to viewer's questions about a variety of scientific phenomena by performing experiments and demonstrations. The objectives of the program are to increase early school age children's knowledge of selected scientific facts and principles, to stimulate their curiosity about the world around them, and to teach them to understand and use scientific techniques and methods to learn about the world. This program is specifically designed to further the educational and informational needs of children, has educating and informing children as a significant purpose, and otherwise meets the definition of Core Programming as specified in the Commission's rules.",99,N/A,N/A,N/A
1997,KOIN-TV,CBS,"Portland, OR",3,Analog,The New Ghostwriter Mysteries,Core,Network,Saturdays/8:00am,13,1,30 minutes,7 years,11 years,"In this series, three young sleuths join forces to solve mysteries. Reading, writing and problem-solving skills all come into play, as the children's other-worldly ally, ""Ghostwriter,"" provides them with written answers to their questions, thereby helping them to solve each mystery. The objective of the program is to provide compelling opportunities for school-age children to read and write, thereby motivating them to enjoy and value these skills. The program also seeks to show children how to use effective reading and writing strategies. This program is specifically designed to further the educational and informational needs of children, has educating and informing children as a significant purpose, and otherwise meets the definition of Core Programming as specified in the Commission's rules.",N/A,N/A,N/A,N/A
1997,KOIN-TV,CBS,"Portland, OR",3,Analog,Wheel of Fortune 2000,Core,Network,Saturdays/8:30am,13,1,30 minutes,7 years,11 years,"In this program, children compete to solve word and language puzzles that are based on age-appropriate educational material similar to that found in the traditional school curriculum. The objectives of the program are to demonstrate to viewers techniques of defining a problem and judging information, and to teach them how principles of critical thinking can be applied to solve the puzzles. The program also aims to teach children information and facts about science, mathematics, history, language, the arts music and sports through the program's games and activities. This program is specifically designed to further the educational and informational needs of children, has educating and informing children as a significant purpose, and otherwise meets the definition of Core Programming as specified in the Commission's rules.",N/A,N/A,N/A,N/A
1997,KOIN-TV,CBS,"Portland, OR",3,Analog,The Sports Illustrated for Kids Show,Core,Network,Saturdays/9:00am,13,4,30 minutes,7 years,11 years,"In this series, two young hosts go behind the scenes to interview successful athletes and provide information about their lives both on and off the field. The program also provides information about health, fitness and nutrition, and presents the views of children on a variety of issues of public significance. The program seeks to help children understand the level of training, discipline, perseverence and practice it takes to be a successful athlete, so that they can incorporate some level of these traits in their own lives. It also aims to encourage children to participate in physical activities as an individual and/or team member, in both competitive and non-competitive settings, and to teach them the importance of maintaining good health and nutritional practices. This program is specifically designed to further the educational and informational needs of children, has educating and informing children as a significant purpose, and otherwise meets the definition of Core Programming as specified in the Commission's rules.",N/A,N/A,N/A,N/A
1997,KOIN-TV,CBS,"Portland, OR",3,Analog,The Weird Al Show,Core,Network,Saturdays/9:30am,13,4,30 minutes,7 years,11 years,"In this program, the host, Al Yankovic, brings his distinctive personality and humor to bear on various situations and interactions with others, in order to convey to children messages relating to honesty, self-expression, personal responsibility, cooperation, respect for oneself and others, and other issues critical to social development. The program aims to help viewers appreciate the uniqueness of each individual and the strengths inherent in a diverse society, and to foster children's pro-social development. This program is specifically designed to further the educational and informational needs of children, has educating and informing children as a significant purpose, and otherwise meets the definition of Core Programming as specified in the Commission's rules.",N/A,N/A,N/A,N/A
