Year,Call Sign,Network Affiliation,Nielsen DMA,Ave. # of Analog hours,Analog or Digital,Title of EI programs,Core or Non-core,Origin of Program,Regular schedule of Program,Total times aired,Number of pre-emptions,Length of Program (in minutes),Age of Target Audience From,Age of Target Audience To,Description of Program,Number of pre-emptions rescheduled,Ave. # of hours of all digital programming per week,Ave. # of hours per week of digital Core Programming per week,Y or N to Q 11 in Digital Core Programming: At least 50% of the Core Programming had not already aired within the previous seven days
1998,KATU,ABC,"Portland, OR",4.5,Analog,Disney's 1 Saturday Mornings,Core,Network,Saturdays/7:30am,13,4,120 minutes,8 years,12 years,"This two-hour program block features three half-hour educational series in combination with several short-form educational elements. The latter includes ""Great Minds...Think For Themselves"" (American history segments) and ""Where'd It Go?"" (short segments describing animal behavior). Disney's Doug -- Narrated via the spoken journal entries of aspiring writer/cartoonist Doug Funnie, this series uses humor and fantasy in depicting the struggles of a twelve-year-old boy to define identity, develop self-confidence, resolve family and school problems and maintain friendships strained by preadolescent physical and emotional change. Series episodes promote values such as honesty, loyalty, fairness and respect for individual differences. Disney's Pepper Ann -- ""Pepper Ann"" features a twelve-year-old girl who is growing up in a single-parent family. She demonstrates that individuality, competence and humor are survival skills for any pre-teenager. From week to week Pepper Ann discovers the importance of speaking out for what one believes and the value of learning from one's mistakes. The primary educational focus of the series is self-esteem - particularly that of young girls. Additionally, the series teaches perseverance, taking responsibility and thinking creatively. Disney's Recess -- ""Disney's Recess"" is a collection of animated stories about six fourth graders who attend suburban public school. Loyal friends, these children are an ethnically and gender-diverse group. They provide role models for viewers who may be struggling with problems common to middle childhood such as conflicts with authority figures, school and family rules, issues of fairness, desire to be popular, peer pressure and crises of confidence. A recurrent theme is the problem of dealing with the class bully or ""teacher's pet."" Series episodes raise thought-provoking questions which parents and children can talk about together, providing a rich source of values-oriented family discussion material. [Note: Dec. 19 preemption was caused by ABC Network News coverage of impeachment hearings, Iraq military operation, and related coverage. The preempted episode was not rebroadcast.]",N/A,N/A,N/A,N/A
1998,KATU,ABC,"Portland, OR",4.5,Analog,Disney's 101 Dalmations: The Series,Core,Network,Saturdays/10:30am PT,13,4,30 minutes,7 years,11 years,"This series addresses many of the key developmental issues of middle childhood. A group of Dalmatian puppies and a resourceful chicken named ""Spot"" are featured in stories that center on problem-solving. Plots frequently introduce conflicts over rules, learning responsibility, attempts to gain peer acceptance, learning from mistakes and efforts to help other animals or human characters. The series encourages prosocial values such as empathy, fairness and cooperative behavior, as well as modeling information-gathering and strategic thinking. [Note: Dec. 19 preemption was caused by ABC Network News coverage of impeachment hearings, Iraq military operation, and related coverage. The preempted episode was not rebroadcast.]",N/A,N/A,N/A,N/A
1998,KATU,ABC,"Portland, OR",4.5,Analog,The New Adventures of Winnie the Pooh,Core,Network,Saturdays/11:00 am PT,13,4,30 minutes,3 years,6 years,"Based on the classic Winnie The Pooh books by author A.A. Milne, ""The New Adventures Of Winnie The Pooh"" depicts the everyday lives of Christopher Robin and his animal companions Pooh, Piglet, Rabbit, Tigger, Eeyore, Owl and Gopher. Stories convey strong prosocial messages about honesty, taking responsibility, persistence, cooperative effort, friendship and caring. Episodes selected for the 1998-99 package present stories having greatest educational relevance to younger viewers. Many of these stories are designed to help younger children distinguish between fantasy and reality, identify feelings and overcome common childhood fears. [Note: Dec. 19 preemption was caused by ABC Network News coverage of impeachment hearings, Iraq military operation, and related coverage. The preempted episode was not rebroadcast.]",N/A,N/A,N/A,N/A
1998,KATU,ABC,"Portland, OR",4.5,Analog,Squigglevision,Core,Network,Saturdays/11:30am PT,13,4,30 minutes,8 years,12 years,"Primarily designed for children in the middle school grades, ""Squigglevision"" uses activities at a radio station and in the courtroom as springboards for teaching scientific concepts and their everyday applications. Characters use critical thinking to examine and describe phenomena, thereby helping the home viewer to sharpen observational and sequential thinking skills. They demonstrate both inductive and deductive reasoning and evaluate hypotheses in light of data obtained and make judgments. Scientific and math estimation concepts are illustrated by means of practical ""demonstrations"" and graphics. [Note: Dec. 19 preemption was caused by ABC Network News coverage of impeachment hearings, Iraq military operation, and related coverage. The preempted episode was not rebroadcast.]",N/A,N/A,N/A,N/A
1998,KATU,ABC,"Portland, OR",4.5,Analog,Nick New for Kids,Core,Syndicated,Sundays/10:00am,13,1,30 minutes,7 years,11 years,A forum for kids to think and ask questions about the world around them; give kids a way to obtain information and background they need to understand world events; give kids a way of using news as a part of their lives and feel good about wanting to know more.,N/A,N/A,N/A,N/A
1998,KATU,ABC,"Portland, OR",4.5,Analog,How 'Bout That?,Core,Local,Sundays/10:30am,13,1,30 minutes,6 years,10 years,"A music magazine show that explores how ideas and dreams become reality. Viewers are taken on musical adventures, delving into features on everything from how they make crayons to what it takes to be a professional beekeeper. Through original music, processes and professions are explained in rhythm and rhyme.",N/A,N/A,N/A,N/A
1998,KATU,ABC,"Portland, OR",4.5,Analog,ABC's Schoolhouse Rock,Non-Core,Network,Saturdays/9:57am PT,10,5,3 minutes,6 years,11 years,"This short-form educational program teaches concepts in grammar, math, U.S. history, science and finance by transforming these concepts into popular song, rhyme and amusing visuals. This method of presenting academic concepts has proven to be a powerful instructional tool.",4,N/A,N/A,N/A
1998,KATU,ABC,"Portland, OR",4.5,Analog,ABC's Schoolhouse Rock,Non-Core,Network,Saturdays/10:27am PT,10,5,3 minutes,6 years,11 years,"This short-form educational program teaches concepts in grammar, math, U.S. history, science and finance by transforming these concepts into popular song, rhyme and amusing visuals. This method of presenting academic concepts has proven to be a powerful instructional tool.",4,N/A,N/A,N/A
1998,KATU,ABC,"Portland, OR",4.5,Analog,ABC Kids Movie Matinee: Disney's One Saturday Morning Crush Marathon,Non-Core,Network,Saturday/5:30am PT (10/17/98),1,0,90 minutes,8 years,12 years,"Selected episodes of ""Disney's Doug,"" ""Disney's Recess"" and ""Disney's Pepper Ann"" portray the experience of falling in love or being the object of a youthful ""crush."" Disney's Doug -- Narrated via the spoken journal entries of aspiring writer/cartoonist Doug Funnie, this series uses humor and fantasy in depicting the struggles of a twelve-year-old boy to define identity, develop self-confidence, resolve family and school problems and maintain friendships strained by preadolescent physical and emotional change. Series episodes promote values such as honesty, loyalty, fairness and respect for individual differences. Disney's Pepper Ann -- ""Pepper Ann"" features a twelve-year-old girl who is growing up in a single-parent family. She demonstrates that individuality, competence and humor are survival skills for any pre-teenager. From week to week Pepper Ann discovers the importance of speaking out for what one believes and the value of learning from one's mistakes. The primary educational focus of the series is self-esteem - particularly that of young girls. Additionally, the series teaches perseverance, taking responsibility and thinking creatively. Disney's Recess -- ""Disney's Recess"" is a collection of animated stories about six fourth graders who attend suburban public school. Loyal friends, these children are an ethnically and gender-diverse group. They provide role models for viewers who may be struggling with problems common to middle childhood such as conflicts with authority figures, school and family rules, issues of fairness, desire to be popular, peer pressure and crises of confidence. A recurrent theme is the problem of dealing with the class bully or ""teacher's pet."" Series episodes raise thought-provoking questions which parents and children can talk about together, providing a rich source of values-oriented family discussion material.",99,N/A,N/A,N/A
1998,KATU,ABC,"Portland, OR",4.5,Analog,ABC Kids Movie Matinee: Doug's Quail Man Marathon,Non-Core,Network,Saturday/5:30am PT (12/5/98),1,0,90 minutes,8 years,12 years,"In the guise of imaginary superhero ""QuailMan,"" Doug attempts to resolve some of his personal conflicts. With superhero canine ""QuailDog"" and his ally ""Super Skeeter,"" Doug/QuailMan conquers nefarious characters and foils their selfish plots. These characters bear a striking resemblance to Guy, Roger and other mean or arrogant people in Doug's community. The story ""QuailDad"" is particularly nice in that QuailMan/Doug comes to realize that his father is a very talented and resourceful person -- not a klutz, as he thought, but a real-life hero.",99,N/A,N/A,N/A
1998,KATU,ABC,"Portland, OR",4.5,Analog,ABC Children's Special,Non-Core,Network,Saturday/9:30am PT (10/3/98),1,0,60 minutes,8 years,12 years,"This ABC Children's Special collects four episodes of ""Disney's Recess"" into a one-hour special presentation. ""Disney's Recess"" is a collection of animated stories about six fourth graders who attend suburban public school. Loyal friends, these children are an ethnically and gender-diverse group. They provide role models for viewers who may be struggling with problems common to middle childhood such as conflicts with authority figures, school and family rules, issues of fairness, desire to be popular, peer pressure and crises of confidence. A recurrent theme is the problem of dealing with the class bully or ""teacher's pet."" Series episodes raise thought-provoking questions which parents and children can talk about together, providing a rich source of values-oriented family discussion material.",99,N/A,N/A,N/A
1998,KATU,ABC,"Portland, OR",4.5,Analog,ABC Children's Special,Non-Core,Network,Saturday/9:30am PT (11/7/98),1,0,60 minutes,8 years,12 years,"This ABC Children's Special collects four episodes of ""Disney's Pepper Ann"" into a one-hour special presentation. ""Disney's Pepper Ann"" features a twelve-year-old girl who is growing up in a single-parent family. She demonstrates that individuality, competence and humor are survival skills for any pre-teenager. From week to week Pepper Ann discovers the importance of speaking out for what one believes and the value of learning from one's mistakes. The primary educational focus of the series is self-esteem - particularly that of young girls. Additionally, the series teaches perseverance, taking responsibility and thinking creatively.",99,N/A,N/A,N/A
1998,KGW,NBC,"Portland, OR",3,Analog,Bill Nye the Science Guy,Core,Syndicated,Saturdays/7:00am,12,1,30 minutes,6 years,11 years,"This program is specifically designed to educate and inform children between the ages of 6 and 11 years old. More specifically, the series is designed to teach children in an entertaining way about fairly sophisticated scientific concepts. ",N/A,N/A,N/A,N/A
1998,KGW,NBC,"Portland, OR",3,Analog,Hang Time (1),Core,Network,Saturdays/7:30am,12,1,30 minutes,13 years,16 years,"The educational objective of this program is to demonstrate how the knowledge of one or more characters in the story moves one level to a more informed or higher level of knowledge by the end of each episode. This change in knowledge conveys an educational message to the audience which may fall into one or more categories—intellectual-cognitive and/or socio-emotional. The message will always be integral to the plot and present throughout the script. This objective is achieved in this series by showing how a group of teens deals with gender equality, competition, cooperation, and balancing priorities.",N/A,N/A,N/A,N/A
1998,KGW,NBC,"Portland, OR",3,Analog,Hang Time (2),Core,Network,Saturdays/10:00am,10,3,30 minutes,13 years,16 years,"The educational objective of this program is to demonstrate how the knowledge of one or more characters in the story moves one level to a more informed or higher level of knowledge by the end of each episode. This change in knowledge conveys an educational message to the audience which may fall into one or more categories—intellectual-cognitive and/or socio-emotional. The message will always be integral to the plot and present throughout the script. This objective is achieved in this series by showing how a group of teens deals with gender equality, competition, cooperation, and balancing priorities.",N/A,N/A,N/A,N/A
1998,KGW,NBC,"Portland, OR",3,Analog,Inside Stuff,Core,Network,Saturdays/10:30am  ,9,4,30 minutes,13 years,16 years,"The educational objective of this program is to introduce the teen audience to the pro-social, off-court activities of basketball players and other individuals, and to individuals who have overcome various obstacles in order to achieve their goals. The program segments are based on a curriculum inspired by the U.S. Department of Education’s Goals 2000, with particular focus on messages encouraging the following values: school completion, community service, cooperation, tolerance of differences, healthful practices and athletics, peaceful conflict resolutions and global awareness. These educational and informational messages are conveyed primarily through real life examples, interviews and commentary by the program’s hosts.",N/A,N/A,N/A,N/A
1998,KGW,NBC,"Portland, OR",3,Analog,Saved by the Bell,Core,Network,Sundays'7:00am,13,0,30 minutes,13 years,16 years,"The educational objective of this program is to demonstrate how the knowledge of one or more characters in the story moves from one level to a more informed or higher level of knowledge by the end of each episode. This change in knowledge conveys an educational message to the audience which may fall into one or more categories—intellectual-cognitive and/or socio-emotional. The message will always be integral to the plot and present throughout the script. This objective is achieved through this series by exploring social themes through the daily school life of six teenage friends at Bayside High who help each other make the most of growing up in a complicated world. The Bayside kids give teens a useful perspective on many of the tough issues they have to face both in their peer relationships, and in personal decision-making both in and out of the classroom.",99,N/A,N/A,N/A
1998,KGW,NBC,"Portland, OR",3,Analog,One World,Core,Network,Sundays'7:30am,13,0,30 minutes,13 years,16 years,"The educational objective of this program is to demonstrate how the knowledge of one or more characters in the story moves from one level to a more informed or higher level of knowledge by the end of each episode. This change in knowledge conveys an educational message to the audience which may fall into one or more categories—intellectual-cognitive and/or socio-emotional. This message will always be integral to the plot and present throughout the script. This objective is achieved through this series by exploring socio-emotional themes of identity, self-worth, social reciprocity, service to others and acceptance of differences. Through the characters in the show, our audience will see examples of different approaches to resolving problems caused by these issues.",99,N/A,N/A,N/A
1998,KGW,NBC,"Portland, OR",3,Analog,City Guys,Non-Core,Network,Saturdays/11:30am  ,6,7,30 minutes,13 years,16 years,"The educational objective of this program is to demonstrate how the knowledge of one or more characters in the story moves from one level to a more informed or higher level of knowledge by the end of each episode. This change in knowledge conveys an educational message to the audience which may fall into one or more categories—intellectual-cognitive and/or socio-emotional. The message will always be integral to the plot and present throughout the script. This objective is achieved in this series by exploring the pressures of living in an big city environment where situations are sometimes so difficult and challenging, kids have to learn sophisticated and responsible decision-making to be safe and stay focused. The series follows the encounters and problem-solving of two young men through an eventful year at Manhattan High and shows teens how to work with their principal, family and friends to be successful.",N/A,N/A,N/A,N/A
1998,KGW,NBC,"Portland, OR",3,Analog,Click,Non-Core,Network,Sundays/2:30am,12,1,30 minutes,13 years,16 years,"Click is a game of speed and knowledge in which adolescent teams compete to provide correct and rapid answers to different types of questions and challenges. The educational objectives are: provide a positive learning context for the acquisition of knowledge; stimulate interest in intellectual activities; foster rapid thinking and information retrieval; to enhance adolescents’ capacity to ""think on their feet,"" to develop the ability to decode and recognize alternative representations of words and to enhance responsiveness to non-verbal as well as verbal cues; to promote the acquisition of specific knowledge in diverse content areas; to demonstrate that intellectual activities can be rewarding and fun; to demonstrate the value of cooperation in intellectual tasks.",1,N/A,N/A,N/A
1998,KNMT,Trinity Broadcasting Network (TBN),"Portland, OR",3.6,Analog,Just the Facts,Core,Network,Saturdays/8:00am,11,2,30 minutes,10 years,16 years,"Host Rob Hambree teaches children not to be too proud, the importance of being responsible, having a willing and obedient attitude, using good judgment, the meaning of real love, not taking revenge and how to have good friendships with others.",N/A,N/A,N/A,N/A
1998,KNMT,Trinity Broadcasting Network (TBN),"Portland, OR",3.6,Analog,Kids Against Crime,Core,Network,Saturdays/8:30am,12,1,30 minutes,5 years,12 years,"Host Rosey Grier takes a look a look at issues about crime like a juvenile court, how to stay away from drugs, standing up for your right to live free, and how to be aware of your surroundings. He also takes a serious look at issues such as suicide.",N/A,N/A,N/A,N/A
1998,KNMT,Trinity Broadcasting Network (TBN),"Portland, OR",3.6,Analog,Kids Like You,Core,Network,Saturdays/11:00am (beginning 11/21/98),6,0,30 minutes,6 years,12 years,"This program teaches children how to develop self-control, patience, kindness, and love. It teaches children how to be gentle and helpful, as well as how to respect others and how to make friends.",99,N/A,N/A,N/A
1998,KNMT,Trinity Broadcasting Network (TBN),"Portland, OR",3.6,Analog,Colby's Clubhouse,Core,Network,Saturdays/9:30am,12,1,30 minutes,6 years,12 years,"This program teaches children how to be effective leaders and good citizens, as well as lessons on how to combat peer pressure, deal with persecution, use their strengths, and how to trust God during difficult situations.",N/A,N/A,N/A,N/A
1998,KNMT,Trinity Broadcasting Network (TBN),"Portland, OR",3.6,Analog,Kid's Club,Core,Network,Saturdays/10:00am,12,1,30 minutes,6 years,12 years,"The host of this program teaches children to sing, fun exercises, the alphabet, and how to use the library. The children also learn the importance of reading, as well as principles of science like electricity.",N/A,N/A,N/A,N/A
1998,KNMT,Trinity Broadcasting Network (TBN),"Portland, OR",3.6,Analog,Faithville,Core,Network,Saturdays/10:30am (pst),12,1,30 minutes,3 years,9 years,"This program teaches children how to take responsibility for their actions. It teaches listening skills and how to avoid being deceived. It also teaches children how to set priorities, how not to jump to conclusions and the importance of following instructions.",N/A,N/A,N/A,N/A
1998,KNMT,Trinity Broadcasting Network (TBN),"Portland, OR",3.6,Analog,Janice's Attic,Core,Network,Saturdays/7:30am,8,5,30 minutes,4 years,8 years,This program teaches children the importance of maintaining good physical condition. It stresses personal qualities like perserverance and honesty. Lessons are usually taught by example and analogies.,N/A,N/A,N/A,N/A
1998,KNMT,Trinity Broadcasting Network (TBN),"Portland, OR",3.6,Analog,Gospel Bill,Core,Network,Saturdays/7:00am,8,5,30 minutes,6 years,12 years,"The setting of this program is an old western town where Gospel Bill and the rest of the townspeople teach children life lessons. They teach children lessons on respect, honesty, healthy living, how not to exact revenge, how to resist using bad language and keep a good attitude.",N/A,N/A,N/A,N/A
1998,KNMT,Trinity Broadcasting Network (TBN),"Portland, OR",3.6,Analog,Kids on the Move,Core,Network,Saturdays/9:00am,12,1,30 minutes,6 years,12 years,"Kids On The Move informs and educates children about historical information found in the Bible. The program incorporates questions and contestants in a ""game show"" format.",N/A,N/A,N/A,N/A
1998,KNMT,Trinity Broadcasting Network (TBN),"Portland, OR",3.6,Analog,Kids Against Crime,Non-Core,Network,Saturdays/5:00am,11,2,30 minutes,5 years,12 years,"Host Rosey Grier takes a look a look at issues about crime like a juvenile court, how to stay away from drugs, standing up for your right to live free, and how to be aware of your surroundings. He also takes a serious look at issues such as suicide.",N/A,N/A,N/A,N/A
1998,KNMT,Trinity Broadcasting Network (TBN),"Portland, OR",3.6,Analog,Superbook,Non-Core,Network,Saturdays/4:00am,11,2,30 minutes,5 years,10 years,"Superbook is an animation series that teaches history by presenting biblical figures and events. Children are taught forgiveness, love, and overcoming trials and adversity.",N/A,N/A,N/A,N/A
1998,KNMT,Trinity Broadcasting Network (TBN),"Portland, OR",3.6,Analog,Kids on the Move,Non-Core,Network,Saturdays/5:30am,11,1,30 minutes,6 years,12 years,"Kids On The Move informs and educates children about historical information found in the Bible. The program incorporates questions and contestants in a ""game show"" format. ",N/A,N/A,N/A,N/A
1998,KNMT,Trinity Broadcasting Network (TBN),"Portland, OR",3.6,Analog,Quigley's Village,Non-Core,Network,Saturdays/6:30am,12,1,30 minutes,2 years,7 years,"This program teaches children how to listen, develop good manners, cooperation, how to resist temptation and how to forgive. The program also teaches responsibility and patience.",N/A,N/A,N/A,N/A
1998,KNMT,Trinity Broadcasting Network (TBN),"Portland, OR",3.6,Analog,Flying House,Non-Core,Network,Saturdays/3:30am,11,2,30 minutes,4 years,8 years,"This program teaches children about things like dealing with anger, bitterness, alcoholism and stealing is wrong. It reinforces loving others, kindness, sharing, and protecting the faithful and innocent.",N/A,N/A,N/A,N/A
1998,KNMT,Trinity Broadcasting Network (TBN),"Portland, OR",3.6,Analog,Colby's Clubhouse,Non-Core,Network,Saturdays/4:30am,11,2,30 minutes,6 years,12 years,"This program teaches children how to be effective leaders and good citizens, as well as lessons on how to combat peer pressure, deal with persecution, using their strengths, and how to trust God during difficult situations.",N/A,N/A,N/A,N/A
1998,KNMT,Trinity Broadcasting Network (TBN),"Portland, OR",3.6,Analog,Joy Junction,Non-Core,Network,Saturdays/6:00am,11,2,30 minutes,8 years,12 years,"This program teaches children how to say and do the ""right"" things, how to develop good habits and how to break bad ones. It teaches patriotism, and perseverance, as well as how to make love a priority and to follow good role models.",N/A,N/A,N/A,N/A
